,category,image_url,title
904,basketball,https://i5.walmartimages.com/asr/c379e5b8-6804-4722-94f5-f675fc1346f0.701c41e0c3db4d41aae6c941358ca066.jpeg?odnHeight=180&odnWidth=180&odnBg=ffffff,Basketball Hoop Portable Basketball Goal System with Adjustable Height with Big Backboard & Wheels and Large Base for Youth & Adults Family Indoor Outdoor
905,basketball,https://i5.walmartimages.com/asr/fdded218-ab35-45ef-ac9e-8b292ae9509e.d774d697765218018c4c47b27b93fece.jpeg?odnHeight=180&odnWidth=180&odnBg=ffffff,Purdue Boilermakers Rookie Stationary Basketball Set
906,basketball,https://i5.walmartimages.com/seo/Christmas-Gift-Cuhas-Silent-Ball-Children-s-Pat-Training-Ball-Indoor-Silent-Basketball-Baby-Shooting-Special-Ball-18cm_6589e1c1-7e25-4615-bd4b-c6468714369c.a520ed736bbc303a5769278b821d58df.jpeg?odnHeight=180&odnWidth=180&odnBg=fffff,Christmas Gift! Cuhas Silent Ball Children's Pat Training Ball Indoor Silent Basketball Baby Shooting Special Ball 18cm
907,basketball,https://i5.walmartimages.com/seo/JBee-Ctrl-Kids-Basketball-Hoop-Stand-Adjustable-Set-Toddler-Toys-Boys-Age-3-4-5-6-7-8-Indoor-Outdoor-Backyard-Sport-Game-Gifts_94f2d19e-e374-4672-a01e-ddf7da5ecc1a.7c85cdb8f9c0f8d174173e40ad19ba18.jpeg?odnHeight=180&odnWidth=180&odnBg=fffff,"JBee Ctrl Kids Basketball Hoop with Stand, Adjustable Basketball Set, Toddler Basketball Toys for Boys Age 3 4 5 6 7 8, Indoor Outdoor Backyard Sport Game Gifts"
908,basketball,https://i5.walmartimages.com/seo/iFanze-44-Portable-Basketball-Hoop-System-4-4-10-ft-Height-Adjustable-Goal-System-Wheels-Shatterproof-Backboard-Large-Base-Adults-Kids-Outdoor-Indoor_e8f9fa4e-a6c8-4df7-9a43-e0097c7a1a74.b45845eb0521106e1dee682bb36a6aba.jpeg?odnHeight=180&odnWidth=180&odnBg=fffff,"iFanze 44"" Portable Basketball Hoop System, 4.4-10 ft Height Adjustable Basketball Goal System with Wheels and Shatterproof Backboard and Large Base for Adults Kids Outdoor Indoor Court"
909,basketball,https://i5.walmartimages.com/asr/ffc343ed-c592-4b6f-9943-a9be874cdf67.c2b289b058fda96146f228b2f2c9c032.jpeg?odnHeight=180&odnWidth=180&odnBg=ffffff,"Sportime Junior StreetMax Basketball, 27-1/2 Inches, Black"
910,basketball,https://i5.walmartimages.com/seo/Silent-Basketball-Quiet-Basketball-Indoor-Uncoated-High-Density-Foam-Ball-Soft-Flexible-Lightweight-Easy-Grip-Various-Indoor-Activities-9inch_05ec9393-55e1-4d29-8362-411d0e4a952a.604470732a869e16bfaef1a09ec58954.jpeg?odnHeight=180&odnWidth=180&odnBg=fffff,"Silent Basketball,Quiet Basketball Indoor,Uncoated High-Density Foam Ball,Soft,Flexible,Lightweight and Easy to Grip for Various Indoor Activities,9inch"
911,basketball,https://i5.walmartimages.com/asr/68bc4927-f2fc-47f8-9e26-2b404b4579de.179d2bf3dbbf38735f0b1e9f27692d6a.jpeg?odnHeight=180&odnWidth=180&odnBg=ffffff,"5 Foam Mini Basketball for Mini Basketball Hoop, 2 Pack, Safe & Quiet Small Basketball for Over The Door Mini Hoop Basketball Sets"
912,basketball,https://i5.walmartimages.com/asr/ef8e8eca-48ab-44c4-b150-ce1139fa16e9.1e1c9e9fca72d57d13aaaf5da22284cc.jpeg?odnHeight=180&odnWidth=180&odnBg=ffffff,"Spalding Ultimate Hybrid 54"" Acrylic Portable Basketball Hoop"
913,basketball,https://i5.walmartimages.com/asr/de4742b8-a7b1-4ee6-addb-edb98a6da917_1.179a0f5d971e374cb9edb0ce75802cfa.jpeg?odnHeight=180&odnWidth=180&odnBg=ffffff,Mini Kids Child Rubber Basketball Outdoor Indoor Play Game Ball for Children
914,basketball,https://i5.walmartimages.com/asr/0e55a4ec-a9ac-4c5f-9815-ae2c7b96f34c.de44c024569a994cc4ec2ede1221502a.jpeg?odnHeight=180&odnWidth=180&odnBg=ffffff,Boston Celtics NBA Basketball Mat (29 diameter)
915,basketball,https://i5.walmartimages.com/seo/JEUXUS-Threadrock-boys-unisex-child-Basketball_ae1620f1-dd0d-49cb-b462-a9c4664f73db.7b8ca62ffb691455547f5c88f4a542af.jpeg?odnHeight=180&odnWidth=180&odnBg=fffff,JEUXUS Threadrock boys unisex-child Basketball
916,basketball,https://i5.walmartimages.com/asr/afccbf03-7492-4028-8be6-fbcfbf9de4dc.23837334d161cb6144454260617aa2b9.jpeg?odnHeight=180&odnWidth=180&odnBg=ffffff,Tyrese Maxey Philadelphia 76ers Autographed Wilson Authentic Series Indoor/Outdoor Basketball - Fanatics Authentic Certified
917,basketball,https://i5.walmartimages.com/asr/548e44b0-2261-480f-a3ed-576d86301dbf_1.685d01768c78a9a05b7aa0c704efb667.jpeg?odnHeight=180&odnWidth=180&odnBg=ffffff,TCU Horned Frogs Mini Rubber Basketball
918,basketball,https://i5.walmartimages.com/asr/99be38d3-5e48-45a9-b58e-694b63c71460_1.1d95f3aa9ba20a0d601259bd7e8d3b65.jpeg?odnHeight=180&odnWidth=180&odnBg=ffffff,"Silverback Junior Youth 33"" Basketball Hoop with Lock n Rock Mounting Technology Mounts to Round and Vertical Poles"
919,basketball,https://i5.walmartimages.com/seo/Chamoist-Silent-Basketball-Silent-Ball-Basketball-Mute-Indoor-Children-s-Basketball-Racket-Sports-Toys-Baby-Sponge-Frame-Various-Activities_31f3f4b7-52d3-4544-a2f5-6c17acce33e5.aab7f795c5b5697b3279c28ba9704ca8.jpeg?odnHeight=180&odnWidth=180&odnBg=fffff,"Chamoist Silent and Silent Basketball,Silent Ball Basketball,Mute Ball Indoor Children's Silent Basketball Racket Ball Sports Ball Toys Baby Sponge Ball Frame for Various Indoor Activities"
920,basketball,https://i5.walmartimages.com/asr/294ec97f-2389-4bd2-9d2a-5fa0e8d5a71a.22a4549b72587f9af2dc87dbf979e63d.jpeg?odnHeight=180&odnWidth=180&odnBg=ffffff,"Spiderman 13.5 x 10"" Basketball Hoop with ball"
921,basketball,https://i5.walmartimages.com/seo/cyrico-2-Pack-Basketball-Net-Replacement-Outdoor-Anti-Whip-Hoop-Nets-12-Loops_a39e45e7-18db-4ab9-a423-ff02dc0036eb.d05ada75426a56ecccab74d7f60a7f7d.jpeg?odnHeight=180&odnWidth=180&odnBg=fffff,"cyrico 2 Pack Basketball Net Replacement, Outdoor Anti Whip Hoop Nets 12 Loops"
922,basketball,https://i5.walmartimages.com/seo/XEOVHV-Silent-Basketball-2024-Newest-Foam-Basketball-Indoor-Training-Ball-Uncoated-High-Density-Ball-Low-Noise-Various-Activities_da96221f-f540-4c70-99b3-6411c1298a8e.e76967b7845e5e2d83236260a8af49cb.jpeg?odnHeight=180&odnWidth=180&odnBg=fffff,"XEOVHV Silent Basketball,2024 Newest Foam Basketball Indoor Training Ball, Uncoated High-Density Foam Ball Low Noise Basketball Training for Various Indoor Activities"
923,basketball,https://i5.walmartimages.com/asr/5d484286-8ca3-465a-8feb-cd6ffd5f47dc.cb96b139f30c72a8a33654af39be5e0b.jpeg?odnHeight=180&odnWidth=180&odnBg=ffffff,Pop-A-Shot Official Home Dual Shot Basketball Arcade Game
924,basketball,https://i5.walmartimages.com/asr/15d349d4-cf05-434d-95c6-82a1eb3a328b.6f04e25f7d5cdea454afc2502965c3b8.jpeg?odnHeight=180&odnWidth=180&odnBg=ffffff,Alden Design 9 to 12 ft. Portable Basketball System Hoop for Indoor and Outdoors
925,basketball,https://i5.walmartimages.com/asr/9a53fb3e-24fb-4fa0-b5bd-5186a5f92095.c17c543b8b5e16800a74b8a9a9da7a93.jpeg?odnHeight=180&odnWidth=180&odnBg=ffffff,1PC Standard Basketball Ball Durable Rubber Basketball for Teens Outdoor Training Games
926,basketball,https://i5.walmartimages.com/seo/Compatible-Xiaomi-Redmi-A2-PLUS-Wallet-Case-Full-Protection-Card-Insertion-Shockproof-Flip-Cover-Side-Buckle-Skin-Feeling-And-Love_378cf81d-8edb-4d3a-b9b1-effec7ea0553.8153e6cc434f009cddbc4e3820162b18.jpeg?odnHeight=180&odnWidth=180&odnBg=fffff,Compatible Xiaomi Redmi A2 PLUS Wallet Case Full Protection Card Insertion Shockproof Flip Cover Side Buckle Skin Feeling And Love
927,basketball,https://i5.walmartimages.com/seo/Bexikou-Silent-Indoor-Basketball-Foam-Basketball-No-Sound-Basketball-Mute-Soft-Lightweight-Easy-Grip-Outdoor_6d96fd9d-ace3-4560-813d-684cb6dec500.ac0f60ee27145c49ed8fe6be44ddf8cc.jpeg?odnHeight=180&odnWidth=180&odnBg=fffff,"Bexikou Silent Indoor Basketball,Foam Basketball - No Sound Basketball, Mute Basketball, Soft Basketball, Lightweight and Easy to Grip for Indoor Outdoor"
928,basketball,https://i5.walmartimages.com/asr/d4ccb81f-a7c7-4ca2-90be-3b5e8f5520f2.222345ee466875be3d2582fefab7dd47.jpeg?odnHeight=180&odnWidth=180&odnBg=ffffff,Spalding Sports 63-750T Junior NBA Basketball - 27.5 in.
929,basketball,https://i5.walmartimages.com/seo/Basketball-Ball-PU-Material-Official-Basketball-Free-With-Net-Bag-and-Indoor-Basketball-Matching-and-Training-Ball-Size-5_71983316-f8ba-40a4-8459-0f8d9e82d1e1.d6ac332dce618957f1bed5f3e346d13c.jpeg?odnHeight=180&odnWidth=180&odnBg=fffff,Basketball Ball PU Material Official Basketball Free With Net Bag and / Indoor Basketball Matching and Training Ball Size 5
930,basketball,https://i5.walmartimages.com/asr/c477101c-cac4-4227-aa76-d939371aa371.15e4bac7ef9962f56b5f86368e3edb1b.jpeg?odnHeight=180&odnWidth=180&odnBg=ffffff,GxIne B5G3800
931,basketball,https://i5.walmartimages.com/seo/Nike-Exploration-Series-Tie-Dye-Basketball-Size-OS-Color-Tie-Dye_39ccdffb-57b0-4d13-a236-ffa69e867bfd.a3cf561c744834ae436c794e17c0437a.jpeg?odnHeight=180&odnWidth=180&odnBg=fffff,"Nike Exploration Series Tie-Dye Basketball Size OS, Color: Tie Dye"
932,basketball,https://i5.walmartimages.com/seo/Indoor-Basketball-Silent-Hush-Handle-Quiet-Dribbling-Ball-High-Elasticity-Foam-Experience-Low-Noise-Play-Various-Outdoor-Activities_9be6dc10-8206-4ddb-bc0b-bf1ba00d8391.44fe18eee04350bd18ce8fae32bdfee2.jpeg?odnHeight=180&odnWidth=180&odnBg=fffff,Indoor Basketball Silent - Hush Handle - Quiet Dribbling Ball - High-Elasticity Foam - Experience Low Noise Play - Various Indoor & Outdoor Activities
933,basketball,https://i5.walmartimages.com/seo/Lifetime-Adjustable-Youth-Portable-Basketball-Hoop-32-inch-Impact-Plastic-90909_2e5c637a-d0f6-49b3-888e-bb46f0f19f5c_1.be70c47437c747ce62f2eeb0c86f250e.jpeg?odnHeight=180&odnWidth=180&odnBg=fffff,"Lifetime Adjustable Youth Portable Basketball Hoop, 32 inch Impact® Plastic (90909)"
934,basketball,https://i5.walmartimages.com/seo/Silent-Basketball-2024-Quiet-Basketball-Indoor-Dribbling-Hush-Handle-Foam-No-Noise-Indoor-Training-Ball_390f68aa-98cf-42f2-919f-7306b346fb9b.18ab50328268353078b582994ad9de1e.jpeg?odnHeight=180&odnWidth=180&odnBg=fffff,"Silent Basketball, 2024 Quiet Basketball Indoor, Silent Basketball Dribbling Indoor, Hush Handle Silent Foam Basketball, No Noise Basketball, Indoor Training Foam Ball"
935,basketball,https://i5.walmartimages.com/asr/f2436588-f4d9-4629-aa28-2d870adf2cd0.000fc1a7f1fe7c5c64095cafc4723afe.jpeg?odnHeight=180&odnWidth=180&odnBg=fffff,Light Up Basketball High Elasticity Battery-free PVC High Bright Holographic Basketball for Kids
936,basketball,https://i5.walmartimages.com/asr/fdb0d204-81cd-4a50-b254-566548ebb558.e2ab9e75f222dd242f3d4f791cf9abb5.jpeg?odnHeight=180&odnWidth=180&odnBg=ffffff,Shaquille O'Neal Los Angeles Lakers Autographed Wilson Authentic Series Indoor/Outdoor Basketball - Fanatics Authentic Certified
937,basketball,https://i5.walmartimages.com/seo/NEDYO-Portable-Basketball-Hoop-Goal-System-Outdoor-Court-5ft-9ft-Adjustable-HDPE-Backboard-Material_e1d9c0e7-55f0-4b31-bcbf-9953eb87dc9d.52bc89199e2bda0478bc6bf168139678.jpeg?odnHeight=180&odnWidth=180&odnBg=fffff,"NEDYO Portable Basketball Hoop Goal System Outdoor Court 5ft-9ft Adjustable, HDPE Backboard Material"
938,basketball,https://i5.walmartimages.com/seo/Basketball-Hoop-Portable-Basketball-System-Height-Adjustable-4-4-ft-6-9ft-with-32-inch-PC-Backboard-Material-Best-Christmas-Gifts-for-Kids_782ca7cc-63cd-4e0b-8662-fbdc7a1fc2ce.c364b650d90a8ccb7ce975929cb52612.jpeg?odnHeight=180&odnWidth=180&odnBg=fffff,"Basketball Hoop Portable Basketball System Height Adjustable 4.4 ft - 6.9ft with 32 inch PC Backboard Material, Best Christmas Gifts for Kids"
939,basketball,https://i5.walmartimages.com/asr/bc7a09ba-774a-4f02-a4a3-687533628e0d.785852d89678fa3fdd4ec16ada8f6860.jpeg?odnHeight=180&odnWidth=180&odnBg=ffffff,"Hall of Games 84 Indoor Steel Frame EZ-Fold Arcade Basketball Game, Black"
940,basketball,https://i5.walmartimages.com/asr/b1aaf239-c1f8-4fc9-8139-7a4800085138.39e2c575af9b492ffd4fd518ee66d18e.jpeg?odnHeight=180&odnWidth=180&odnBg=ffffff,"Entil 44'' Portable Basketball Hoop Outdoor/Indoor, HDPE Backboard, Height Adjustable 7ft 6in-10ft, High-duty PE Base & Wheels for Kids/Youth"
941,basketball,https://i5.walmartimages.com/seo/SDJMa-Silent-Basketball-Silent-Basketball-Dribbling-Indoor-No-Noise-Standard-Hush-Handle-Foam-Basketball-Yellow-8-2-Inch_9defa612-ffc3-470e-bcc3-7e5ea2f81529.cb10a811a4c337a32184d0661ef01bd1.jpeg?odnHeight=180&odnWidth=180&odnBg=fffff,SDJMa Silent Basketball - Silent Basketball Dribbling Indoor No Noise - Standard Hush Handle Foam Basketball - Yellow/8.2 Inch
942,basketball,https://i5.walmartimages.com/asr/616060ab-b9fd-48a2-b417-a83c1d38b41c.453c735f24244a87cc480ee6cfb36cb5.jpeg?odnHeight=180&odnWidth=180&odnBg=fffff,AYYUFE Light Up Basketball High Elasticity PVC High Bright Holographic Basketball for Kids
943,basketball,https://i5.walmartimages.com/asr/6f9ee6f6-060e-4f36-830b-98d06970f055.64a7532009ed079238c4ee7cb34e8523.jpeg?odnHeight=180&odnWidth=180&odnBg=ffffff,Rico Industries Phoenix  Basketball
944,basketball,https://i5.walmartimages.com/seo/Ant-Class-Kids-Basketball-Hoop-Toddlers-Portable-Stand-Adjustable-Height-2-8-6-2-ft-Indoor-Outdoor-Boys-Girls-Blue_b413375a-e726-428f-b4be-47685c42ca1f.571f3de59933cbfeed58613c10d98de5.png?odnHeight=180&odnWidth=180&odnBg=fffff,"Ant Class Kids Basketball Hoop for Toddlers,Portable Basketball Hoop Stand with Adjustable Height 2.8-6.2 ft, Indoor Outdoor Basketball Hoop for Kids Boys Girls,Blue"
945,basketball,https://i5.walmartimages.com/asr/2b1ae97c-2d55-4168-bf47-ffc8ab1a8a4b.bd0ecde5950735a290ce26119a4fb33d.jpeg?odnHeight=180&odnWidth=180&odnBg=ffffff,Diary of a Wimpy Kid: Big Shot (Diary of a Wimpy Kid Book 16) (Hardcover)
946,basketball,https://i5.walmartimages.com/asr/3822a9ac-642b-42cb-b47d-4c75529525a0.5de70b9f3c11ec7dc3c4e9bdf025201e.jpeg?odnHeight=180&odnWidth=180&odnBg=ffffff,"NiamVelo  Basketball Hoop Basketball Goal, 7-10FT Height Adjustable Basketball Backboard with Stand & Wheels  for Kids Adult Youth Black"
947,basketball,https://i5.walmartimages.com/seo/Pirecart-44-Outdoor-Basketball-Hoop-with-PVC-Backboard-Portable-Goal-Basketball-Hoop-System-4-4ft-10ft-Height-Adjustable-for-Youth-Adults_df9b73d5-918c-4ffb-b7a1-4c839fef11c6.977674bb7a7ec8ccaeaeb9376f9e2e5e.jpeg?odnHeight=180&odnWidth=180&odnBg=fffff,"Pirecart 44"" Outdoor Basketball Hoop with PVC Backboard, Portable Goal Basketball Hoop System 4.4ft. - 10ft. Height Adjustable for Youth Adults"
948,basketball,https://i5.walmartimages.com/seo/Spalding-Eco-Composite-32-inch-Telescoping-Portable-Basketball-Hoop-System_114215ff-49cb-4cb1-9712-f608349100ec.b0d801e2c85bd1cb287ca4f4b94e5ff1.jpeg?odnHeight=180&odnWidth=180&odnBg=fffff,Spalding Eco-Composite 32 inch Telescoping Portable Basketball Hoop System
949,basketball,https://i5.walmartimages.com/asr/afd6f21f-3e69-4dd1-842d-3c8160720565.93fe3b4a7b894c62368145cf775a9b3b.jpeg?odnHeight=180&odnWidth=180&odnBg=ffffff,"Zimtown 7.2ft - 8.5ft Height Basketball Stand, Portable Basketball Hoop System, with Wheels, Indoor Outdoor"
950,basketball,https://i5.walmartimages.com/asr/33893678-f623-4f7a-b330-acaf9c68c176.dca80a880a3707331ed8cdb5fd8c59c3.jpeg?odnHeight=180&odnWidth=180&odnBg=ffffff,"Swim Central 8.5"" Sports Ball Classic Pro Water Basketball Swimming Pool Accessory - Brown"
951,basketball,https://i5.walmartimages.com/seo/Fridja-8-3-The-Handleshh-Silent-Basketball-Silent-Basketball-Silent-Basketball-Dribbling-Indoor-Uncoated-High-Density-Foam-Ball-with-Low-Noise_05ec9393-55e1-4d29-8362-411d0e4a952a.604470732a869e16bfaef1a09ec58954.jpeg?odnHeight=180&odnWidth=180&odnBg=fffff,"Fridja 8.3"" The Handleshh Silent Basketball, Silent Basketball, Silent Basketball Dribbling Indoor, Uncoated High Density Foam Ball with Low Noise"
952,basketball,https://i5.walmartimages.com/seo/dianhelloya-Light-Up-Basketball-High-Elasticity-Battery-free-PVC-High-Bright-Holographic-Basketball-for-Kids-18cm_46b884ff-9d69-4456-8108-53be6e4017b9.ebe1a5b884feeb4e00c013ef19595925.jpeg?odnHeight=180&odnWidth=180&odnBg=fffff,dianhelloya Light Up Basketball High Elasticity Battery-free PVC High Bright Holographic Basketball for Kids 18cm
953,basketball,https://i5.walmartimages.com/asr/655894c8-7633-4d06-b6ae-12c23b8af5e3.0eda331b170c72607ca55183311f2d0c.jpeg?odnHeight=180&odnWidth=180&odnBg=ffffff,"SmileMart 7 to 9 Ft Portable Basketball System Hoop for Outdoor Indoor, Black /Red"
954,basketball,https://i5.walmartimages.com/asr/4463a496-28b5-4d65-82d6-efa7121f07e5.92d6be860c954048d52bd0231f666669.jpeg?odnHeight=180&odnWidth=180&odnBg=ffffff,"Runic Full Court Composite Basketball Size 29.5"""
955,basketball,https://i5.walmartimages.com/seo/Basketball-Hoop-Portable-Basketball-System-Height-Adjustable-4-4ft-10ft-with-45-inch-Indoor-Outdoor-PC-Backboard-Material_c14b96ef-43f4-4778-af27-c56a223f4544.1df99da5b4bb093ccfe9410b7efdc585.jpeg?odnHeight=180&odnWidth=180&odnBg=fffff,Basketball Hoop Portable Basketball System Height Adjustable 4.4ft - 10ft with 45 inch Indoor Outdoor PC Backboard Material
956,basketball,https://i5.walmartimages.com/asr/5aa1dd4a-76f9-479a-9fa8-f7f1baba8b49.5c3e60836f4cf77a742e44895e796f96.jpeg?odnHeight=180&odnWidth=180&odnBg=ffffff,"Outdoor Basketball Hoop,Portable Basketball Hoop with 44 inch Shatterproof Polycarbonate Backboard, 4.8-10 ft Height Adjustable Basketball Goal System"
957,basketball,https://i5.walmartimages.com/seo/JBee-Ctrl-Kids-Basketball-Hoop-Stand-Adjustable-Set-Toddler-Toys-Boys-Age-3-4-5-6-7-8-Indoor-Outdoor-Backyard-Sport-Game-Gifts_94f2d19e-e374-4672-a01e-ddf7da5ecc1a.7c85cdb8f9c0f8d174173e40ad19ba18.jpeg?odnHeight=180&odnWidth=180&odnBg=fffff,"JBee Ctrl Kids Basketball Hoop with Stand, Adjustable Basketball Set, Toddler Basketball Toys for Boys Age 3 4 5 6 7 8, Indoor Outdoor Backyard Sport Game Gifts"
958,basketball,https://i5.walmartimages.com/seo/iFanze-44-Portable-Basketball-Hoop-System-4-4-10-ft-Height-Adjustable-Goal-System-Wheels-Shatterproof-Backboard-Large-Base-Adults-Kids-Outdoor-Indoor_e8f9fa4e-a6c8-4df7-9a43-e0097c7a1a74.b45845eb0521106e1dee682bb36a6aba.jpeg?odnHeight=180&odnWidth=180&odnBg=fffff,"iFanze 44"" Portable Basketball Hoop System, 4.4-10 ft Height Adjustable Basketball Goal System with Wheels and Shatterproof Backboard and Large Base for Adults Kids Outdoor Indoor Court"
959,basketball,https://i5.walmartimages.com/asr/f2436588-f4d9-4629-aa28-2d870adf2cd0.000fc1a7f1fe7c5c64095cafc4723afe.jpeg?odnHeight=180&odnWidth=180&odnBg=fffff,Realyc Light Up Basketball High Elasticity Battery-free PVC High Bright Holographic Basketball for Kids
960,basketball,https://i5.walmartimages.com/asr/7aa935bb-44c1-4c97-af05-aa068e958bff_1.880cb5ec44ba5abfda590f667fbb20b9.jpeg?odnHeight=180&odnWidth=180&odnBg=ffffff,Mini Yellow Basketball Rubber Training Small Size for Indoor Mini Basketball Ball games
961,basketball,https://i5.walmartimages.com/seo/BCZHQQ-Silent-Basketball-24cm-2023-Newest-Foam-Indoor-Training-Ball-Uncoated-High-Density-Ball-Low-Noise-Various-Activities_05ec9393-55e1-4d29-8362-411d0e4a952a.604470732a869e16bfaef1a09ec58954.jpeg?odnHeight=180&odnWidth=180&odnBg=fffff,"BCZHQQ Silent Basketball 24cm, 2023 Newest Foam Basketball Indoor Training Ball, Uncoated High-Density Foam Ball Low Noise Basketball Training for Various Indoor Activities"
962,basketball,https://i5.walmartimages.com/asr/de4742b8-a7b1-4ee6-addb-edb98a6da917_1.179a0f5d971e374cb9edb0ce75802cfa.jpeg?odnHeight=180&odnWidth=180&odnBg=ffffff,huntermoon Mini Kids Child Rubber Basketball Outdoor Indoor Play Game Ball for Children Not inflated
963,basketball,https://i5.walmartimages.com/asr/b16b2fc5-19bc-481f-af5f-93a7a82066f8.7b51fcd7bbd51b09619793686dbd20f0.jpeg?odnHeight=180&odnWidth=180&odnBg=ffffff,3 Pieces Of Mini Bouncy Basketball Sports
964,basketball,https://i5.walmartimages.com/asr/49afe935-0158-4f66-aaed-c49d5edf9d9b.1483f2dadcd7f5f6ad837ad4de113522.jpeg?odnHeight=180&odnWidth=180&odnBg=ffffff,Perrini Kids Indoor Outdoor Sports Performer Orange Color Basket Ball Size 3
965,basketball,https://i5.walmartimages.com/asr/f7761410-98ae-43c3-bdcf-bcc0d5c0272c.b545d72ee1db41901e67cebc6204a144.jpeg?odnHeight=180&odnWidth=180&odnBg=ffffff,2pcs Kids Basketball Indoor Outdoor Basketball Inflatable Youth Basketball
966,basketball,https://i5.walmartimages.com/seo/The-Mamba-Mentality-How-I-Play-Hardcover_67b139a7-6c95-471e-9dc0-f05951695d5b.73e4a5643b7b015fef6fa50e1d97bce0.jpeg?odnHeight=180&odnWidth=180&odnBg=fffff,The Mamba Mentality: How I Play - Hardcover
967,basketball,https://i5.walmartimages.com/asr/6cefbd8c-22da-4dda-8a11-9f7030ffb22b.b2fb398b24c7e43a92987163349afb16.jpeg?odnHeight=180&odnWidth=180&odnBg=ffffff,Gordon Hayward Charlotte Hornets Autographed Spalding White Panel Basketball - Fanatics Authentic Certified
968,basketball,https://i5.walmartimages.com/asr/37578fc1-e34d-41ae-88ef-471efb120fd4.8e7c30b4c28c366d549866af2262ce37.jpeg?odnHeight=180&odnWidth=180&odnBg=ffffff,"2x 6pcs Mini Basketball Boy Girl Toy - Pink, As Described"
969,basketball,https://i5.walmartimages.com/asr/b90c801b-fcf7-4705-ae7d-027219d70b94.01925f37dc9d0beadb2614f7e4e91d8a.jpeg?odnHeight=180&odnWidth=180&odnBg=ffffff,Costway Kids Dual Shot Basketball Arcade Game w/4 Balls Pump Easy Quick Assembling Gift
970,basketball,https://i5.walmartimages.com/seo/Mini-Children-Inflatable-Basketballs-Small-Children-Basketball-Ball-Outdoor-Indoor-Sports-Inflatable-Toy_b37a80a2-bbec-4753-9022-95032ba7d14e.db283017952daf273d6bf3cac7f5a48c.jpeg?odnHeight=180&odnWidth=180&odnBg=fffff,Mini Children Inflatable Basketballs Small Children Basketball Ball Outdoor/Indoor Sports Inflatable Toy
971,basketball,https://i5.walmartimages.com/seo/Christmas-Gifts-for-Kids-Cuhas-Silent-Ball-Children-s-Pat-Training-Ball-Indoor-Silent-Basketball-Baby-Shooting-Special-Ball-21cm_332ededb-3055-4c4a-bce5-1b6f9108d8ec.598168099fa2affb3cda88fb1427efc2.jpeg?odnHeight=180&odnWidth=180&odnBg=fffff,Christmas Gifts for Kids! Cuhas Silent Ball Children's Pat Training Ball Indoor Silent Basketball Baby Shooting Special Ball 21cm
972,basketball,https://i5.walmartimages.com/asr/f0576481-50e6-4571-9ca2-f3f381819b19.3c2d42ec18206661dba1d4cfbf41b127.jpeg?odnHeight=180&odnWidth=180&odnBg=fffff,"Silent Basketball - Moderate Elasticity, Anti-deformation, Long Lasting, Comfortable Touch, Anti-Skid, Parent-child Interaction, Polyurethane Kids Silent Bounce Ball, Outdoor Toy"
973,basketball,https://i5.walmartimages.com/asr/31386d7e-7184-4d87-8aef-78edf34cadd1.77b65414eb5913683a569a48e60e7f6d.jpeg?odnHeight=180&odnWidth=180&odnBg=ffffff,Sportime  Hands-On Cellular 27 In. Junior Basketball
974,basketball,https://i5.walmartimages.com/seo/Feledorashia-7-08-Silent-Basketball-Balls-for-Indoor-Outdoor-Sport-Play_9defa612-ffc3-470e-bcc3-7e5ea2f81529.cb10a811a4c337a32184d0661ef01bd1.jpeg?odnHeight=180&odnWidth=180&odnBg=fffff,"Feledorashia 7.08"" Silent Basketball Balls for Indoor/Outdoor Sport Play"
975,basketball,https://i5.walmartimages.com/asr/7a978a54-f24e-4a22-8eca-9759c0b5bc5d.c15cddc68d853d92ba55165d6f1a91b7.jpeg?odnHeight=180&odnWidth=180&odnBg=ffffff,Lifetime Basketball Backboard and Rim Combo 50-inch Polycarbonate - 79910
976,basketball,https://i5.walmartimages.com/asr/5d24ff9c-2f81-4743-b9c9-72112ea6462a.cc691f61a07646195096cdd3568fd175.jpeg?odnHeight=180&odnWidth=180&odnBg=ffffff,Rhode Island Novelty Assorted 7 Inch Mini Basketballs Set of 6 Colors May Vary
977,basketball,https://i5.walmartimages.com/seo/UDIYO-Light-Up-Basketball-High-Elasticity-Battery-free-PVC-High-Bright-Holographic-Basketball-for-Kids_616060ab-b9fd-48a2-b417-a83c1d38b41c.453c735f24244a87cc480ee6cfb36cb5.jpeg?odnHeight=180&odnWidth=180&odnBg=fffff,UDIYO Light Up Basketball High Elasticity Battery-free PVC High Bright Holographic Basketball for Kids
978,basketball,https://i5.walmartimages.com/asr/65c0284d-a47f-428b-a4b1-a374e249d565.1c674a2a0afb924501f80851c8ca57f2.jpeg?odnHeight=180&odnWidth=180&odnBg=ffffff,Kids Basketball Basketballs Small Boys Luminous Replace Mini Pvc Child Toddler
979,basketball,https://i5.walmartimages.com/asr/84f50565-95ef-4862-b553-23046728f188.86b8b82960950f2bd4a6ac06c4953a7b.jpeg?odnHeight=180&odnWidth=180&odnBg=ffffff,"7 in. Soft Sport Basketball, Red & White & Royal"
980,basketball,https://i5.walmartimages.com/seo/ASWMXR-Breathable-Women-s-Chic-Graffiti-Low-Top-Basketball-Shoes-Non-Slip-All-Season-Comfort-Shock-Absorbent_104e5313-703c-4d16-a7b5-b1b1a605496e.7e8b6fb9a1c3e10bd8ef0d27c7622bdc.jpeg?odnHeight=180&odnWidth=180&odnBg=fffff,ASWMXR  Breathable Women‘s Chic Graffiti Low-Top Basketball Shoes - Non-Slip  All-Season Comfort  Shock-Absorbent
981,basketball,https://i5.walmartimages.com/asr/0c46b515-9133-4b96-8ca5-e8a536f832c8.9220ce68c6f124b7a3185614771b1649.jpeg?odnHeight=180&odnWidth=180&odnBg=ffffff,ZENSTYLE Basketball Hoop System Metal Frame Height Adjustable 7.2 -9.2FT Home Outdoor
982,basketball,https://i5.walmartimages.com/seo/HooKung-Portable-Basketball-Hoops-Height-Adjustable-5-6ft-7ft-System-28-Backboard-Net-Wheels-Teenagers-Youth-Indoor-Outdoor-Use_7600d268-3ea5-4cce-a719-9fb1eeb2299f.81945ebba3e0b17c6d5e17cfe1512a6e.jpeg?odnHeight=180&odnWidth=180&odnBg=fffff,HooKung Portable Basketball Hoops Height Adjustable 5.6ft -7ft Basketball System 28'' Backboard with Net Wheels for Teenagers Youth Indoor Outdoor Use
983,basketball,https://i5.walmartimages.com/seo/AND1-Enigma-Indoor-Outdoor-Intermediate-Premium-Rubber-Basketball-Teal-and-Black-28-5-in_9e7e02c2-a8c1-44aa-b080-cf9049931bc9.7e624106162847c80aaaba448a07d303.jpeg?odnHeight=180&odnWidth=180&odnBg=fffff,"AND1 Enigma Indoor/Outdoor Intermediate Premium Rubber Basketball, Teal and Black, 28.5 in"
984,basketball,https://i5.walmartimages.com/seo/AND1-Graffiti-Printed-Rubber-Basketball-Mint-and-Black-28-5-in_c1693c3e-9715-4b06-a4de-b9ece9a95e95.d2c38ee5c7eaf59283148c05b2ca199e.jpeg?odnHeight=180&odnWidth=180&odnBg=fffff,"AND1 Graffiti Printed Rubber Basketball, Mint and Black, 28.5 in"
985,basketball,https://i5.walmartimages.com/asr/9ab854a0-eb4a-4737-973d-ac97229ac360.159d491ec70005edb4f6afa9e145e7a7.jpeg?odnHeight=180&odnWidth=180&odnBg=ffffff,Rico Industries New York  Basketball
