,category,image_url,title
279,basketball,https://i5.walmartimages.com/asr/5ef9f8ec-0135-46aa-9b1e-58d4be634a05_1.026c2b42c52a3d894b2b963453165beb.jpeg?odnHeight=180&odnWidth=180&odnBg=ffffff,"MacGregor Colt 25.5"" Basketballs, Set of 6"
280,basketball,https://i5.walmartimages.com/asr/fe40d37c-f326-4418-ab33-6f7b6a960973.f37fbfd03ea5b40df087015ff02ebe7b.jpeg?odnHeight=180&odnWidth=180&odnBg=ffffff,"NOGIS Silent Basketball, 7 Inch Hush Handle Basketball, Silent Basketball Dribbling Indoor, Sneaky Ball, Foam Basketball Indoor, Quiet Bounce Basketball"
281,basketball,https://i5.walmartimages.com/asr/bf331bd7-d9f7-4146-80cf-276c0d6e2509.f24f868236ea1d62f68204f8084f9884.jpeg?odnHeight=180&odnWidth=180&odnBg=ffffff,"MacGregor Official Size (29.5"") X6000 SL Basketball"
282,basketball,https://i5.walmartimages.com/asr/7c7bab03-cd1a-4a5a-acdb-14fe566c0402.6cb2493421004a89e7c905b442e93200.jpeg?odnHeight=180&odnWidth=180&odnBg=ffffff,The Rock Women's/Intermediate C2C Composite Indoor Basketball - 28.5''
283,basketball,https://i5.walmartimages.com/asr/66cb61e2-cc65-4a27-bf39-a18abac42861_1.e87a207657b55eddfd4a371f6efcd75b.jpeg?odnHeight=180&odnWidth=180&odnBg=ffffff,"GoSports Indoor / Outdoor Rubber Size 7 Basketball - 29.5"" Basketball 6 Pack, Includes Pump and Tote"
284,basketball,https://i5.walmartimages.com/asr/3d054103-aec7-4c8a-9aab-64d4a1e658de.e26e6f6f7474678dc6a14476386b35d3.jpeg?odnHeight=180&odnWidth=180&odnBg=ffffff,"Spalding  33 in. TF-Trainer Oversized Basketball, Orange"
285,basketball,https://i5.walmartimages.com/seo/AND1-Enigma-Indoor-Outdoor-Intermediate-Premium-Rubber-Basketball-Teal-and-Black-28-5-in_9e7e02c2-a8c1-44aa-b080-cf9049931bc9.7e624106162847c80aaaba448a07d303.jpeg?odnHeight=180&odnWidth=180&odnBg=fffff,"AND1 Enigma Indoor/Outdoor Intermediate Premium Rubber Basketball, Teal and Black, 28.5 in"
286,basketball,https://i5.walmartimages.com/seo/AND1-Graffiti-Printed-Rubber-Basketball-Mint-and-Black-28-5-in_c1693c3e-9715-4b06-a4de-b9ece9a95e95.d2c38ee5c7eaf59283148c05b2ca199e.jpeg?odnHeight=180&odnWidth=180&odnBg=fffff,"AND1 Graffiti Printed Rubber Basketball, Mint and Black, 28.5 in"
287,basketball,https://i5.walmartimages.com/seo/Sterling-Athletics-Pink-Superior-Grip-Indoor-Outdoor-Basketball-Size-6-Women-s-Youth-28-5_bb24f6fe-8d7d-43d3-8fef-c53f4bb59429.4deb622514afb5ace6c66c3942c9ca33.png?odnHeight=180&odnWidth=180&odnBg=fffff,"Sterling Athletics Pink Superior Grip Indoor/Outdoor Basketball (Size 6 Women's & Youth 28.5"")"
288,basketball,https://i5.walmartimages.com/asr/f7826e51-d798-43ae-8416-4eb6332cbfaf.f774de38a374687183056a7304b97503.jpeg?odnHeight=180&odnWidth=180&odnBg=ffffff,The Rock  MG-4500-PC-NF Womens Composite Basketball
289,basketball,https://i5.walmartimages.com/seo/Voit-XB-20-Intermediate-28-5-Indoor-Outdoor-Basketball-6-PACK_0e51caa8-c8ae-45c6-b5c8-e23a81a04ace_1.b694ff17669e1ed3c22c289d250d2109.jpeg?odnHeight=180&odnWidth=180&odnBg=fffff,"Voit® XB 20 Intermediate (28.5"") Indoor/Outdoor Basketball, 6-PACK"
290,basketball,https://i5.walmartimages.com/asr/ce8f837c-2c8a-4145-8a10-7e03d238364f.5d66b88ce4936b98a0f5dac9a61a4862.jpeg?odnHeight=180&odnWidth=180&odnBg=ffffff,"Sterling Athletics Heart & Daisy Superior Grip Indoor/Outdoor Basketball (Size 5 Junior 27.5"")"
291,basketball,https://i5.walmartimages.com/seo/MODANU-Silent-Basketball-9-45inch-Indoor-Training-Ball-Uncoated-High-Density-Foam-Ball-Soft-Flexible-Lightweight-and-Easy-to-Grip-Orange_0a969cb5-de09-4b27-8294-22e788a181d7.d88a87027fe12f80880fbb2135af951c.jpeg?odnHeight=180&odnWidth=180&odnBg=fffff,"MODANU Silent Basketball, 9.45inch Indoor Training Ball, Uncoated High-Density Foam Ball, Soft, Flexible, Lightweight, and Easy to Grip, Orange"
292,basketball,https://i5.walmartimages.com/asr/e9a92d51-e1df-4bde-b05c-9acf9958800f.bf3c77b274a2b0d4370e2c3571c36f21.jpeg?odnHeight=180&odnWidth=180&odnBg=ffffff,"MacGregor X100 Intermediate Size (28.5"") Indoor Basketball"
293,basketball,https://i5.walmartimages.com/asr/c1127fe3-eaaf-46b0-857a-1a10476be9b0.b590e7cf4b181be88f10b40554904e06.jpeg?odnHeight=180&odnWidth=180&odnBg=ffffff,"Spalding Graffiti Rubber Basketball Multicolor, sky-blue Size 7"
294,basketball,https://i5.walmartimages.com/asr/e3f1e69b-8c3b-4c80-b71d-232140faecb3.9c0f6e1c238e984d891bf07324b74bde.jpeg?odnHeight=180&odnWidth=180&odnBg=ffffff,"Basketball by Mikasa Sports - Indoor/Outdoor, Size 4 - NJB Varsity Series"
295,basketball,https://i5.walmartimages.com/seo/Spalding-60-inch-Acrylic-Screw-Jack-Portable-Basketball-Hoop-System_68e84151-aa78-4dbd-b3bf-215cb3ecd9bc.25d78a4a07732d8b54a06a54c5be9974.jpeg?odnHeight=180&odnWidth=180&odnBg=fffff,Spalding 60 inch Acrylic Screw Jack Portable Basketball Hoop System
296,basketball,https://i5.walmartimages.com/seo/Spalding-Rebound-Rubber-Basketball-Color-Brick-Orange-Size-7-NBA-Rebound_79fd937d-9a7a-4157-9706-9dae78c06936.a27dd4223503b927516523613a3b9683.jpeg?odnHeight=180&odnWidth=180&odnBg=fffff,"Spalding Rebound Rubber Basketball (Color: Brick Orange, Size: 7) (NBA Rebound)"
297,basketball,https://i5.walmartimages.com/asr/29704daf-b1e4-468d-991f-195f3f446ee3.e87a3b84c482912324702f290847ed9d.jpeg?odnHeight=180&odnWidth=180&odnBg=ffffff,"Spalding Marble Rubber Basketball (Black), Size: 7"
298,basketball,https://i5.walmartimages.com/asr/4231ce7d-f548-42c0-a8d5-cc75e2e83451.37affdcedd71a3d5752e59c682e619de.jpeg?odnHeight=180&odnWidth=180&odnBg=ffffff,"Silent Basketball,Silent Training Quiet Soft Foam Ball,Foam Basketball Indoor Training Ball, Uncoated High-Density Foam Ball Low Noise Basketball Training for Various Indoor Activities"
299,basketball,https://i5.walmartimages.com/asr/baa81a99-bd20-44d9-bf5f-4a8012e233c6.8d6ee83712931bcfbfab9d86a24d80bd.jpeg?odnHeight=180&odnWidth=180&odnBg=ffffff,Baden  29.5 in. Elite Pro Basketball
300,basketball,https://i5.walmartimages.com/asr/8e0a3dc2-451a-4212-acc2-d5246b7515e8.35a22402f9d8e7b73627a4eaf6ee29be.jpeg?odnHeight=180&odnWidth=180&odnBg=ffffff,"GoSports Blue Water Basketballs Set of 2 | Size 3 (7"") Pool Basketballs for Splash Hoop PRO and Similar Pool Hoops"
301,basketball,https://i5.walmartimages.com/asr/9b06f3ff-05da-4f84-8335-94973da553bb.b84333dbda0b763ca15bacd166bc84c6.jpeg?odnHeight=180&odnWidth=180&odnBg=ffffff,"MacGregor X6000 Junior Size (27.5"") Basketball"
302,basketball,https://i5.walmartimages.com/asr/b6fbcdc3-fae1-4eab-ac59-4990036c9ae6.14182994dffa5b3dac3c9948e9dd8b25.jpeg?odnHeight=180&odnWidth=180&odnBg=ffffff,"GoSports Swimming Pool Basketballs 6.5"", 3 Pack - Great for Floating Water Basketball Hoops"
303,basketball,https://i5.walmartimages.com/asr/f7f2b489-3a14-47ea-b458-99817180c143.0058a15c1d261fd3150956706e08c6f9.jpeg?odnHeight=180&odnWidth=180&odnBg=ffffff,"Silent Basketball, MODANU Foam Basketball Indoor Training Ball, Uncoated High-Density Foam Ball Low Noise Basketball Training for Various Indoor Activities (Orange, 9.45inch)"
304,basketball,https://i5.walmartimages.com/asr/a1612844-354e-4699-b46e-ea4dbd7647f2_1.933d6021846da164e597ac71b702344b.jpeg?odnHeight=180&odnWidth=180&odnBg=ffffff,"MacGregor Indoor/Outdoor Basketball Junior Size (27.5"") Rainbow Pack of 6"
305,basketball,https://i5.walmartimages.com/seo/AND1-Enigma-Indoor-Outdoor-Youth-Premium-Rubber-Streetball-Blue-and-Black-27-5_3fde3eff-6555-43ba-aaf5-fe1a2409170f.d36174e53e267fd5907126bf190880d5.jpeg?odnHeight=180&odnWidth=180&odnBg=fffff,"AND1 Enigma Indoor/Outdoor Youth Premium Rubber Streetball, Blue and Black, 27.5"""
306,basketball,https://i5.walmartimages.com/seo/Spalding-54-inch-Shatter-proof-Polycarbonate-Exacta-Height-Portable-Basketball-Hoop-System_c1432f78-daf5-4c75-9bc3-0e637efc62d9.69a4bc450c9b24b33a98ae5ba0fbb7a0.jpeg?odnHeight=180&odnWidth=180&odnBg=fffff,Spalding 54 inch Shatter-proof Polycarbonate Exacta Height® Portable Basketball Hoop System
307,basketball,https://i5.walmartimages.com/asr/d69adb2b-6cbe-4ba9-9519-bfe1e95da2ff.9b58560c0f64898648fbebe175a6e1e2.jpeg?odnHeight=180&odnWidth=180&odnBg=ffffff,MacGregor X100 Womens Indoor Basketball Intermediate Size (28.5in.)
308,basketball,https://i5.walmartimages.com/asr/66569b83-292e-4ecf-9411-cbe5c03eebd1.d8ea7d1d5b646785f4cda7a49f885871.jpeg?odnHeight=180&odnWidth=180&odnBg=ffffff,Bilot- Basketball - Official Mens
309,basketball,https://i5.walmartimages.com/asr/4ab5150e-be01-4ec6-a3b6-6b7e01a50ac4_2.cfc6fe78656d9877159a6897325a23ea.jpeg?odnHeight=180&odnWidth=180&odnBg=ffffff,"MacGregor X6000 Intermediate Size (28.5"") Basketball"
310,basketball,https://i5.walmartimages.com/seo/Wilson-NCAA-Elevate-VTX-Basketball_716fd005-e59a-408d-ae3f-2dc40f21d43a.a9171dd346b78c1d05773e3e1eec9e2a.jpeg?odnHeight=180&odnWidth=180&odnBg=fffff,Wilson NCAA Elevate VTX Basketball
311,basketball,https://i5.walmartimages.com/asr/a19993c5-4969-4af1-95ff-d83197af2df0.b2e32cca062bb91c731ce8de95c5b65f.jpeg?odnHeight=180&odnWidth=180&odnBg=ffffff,"basegel basketball goal portable bases polymer, 16-ounce"
312,basketball,https://i5.walmartimages.com/seo/Personalized-Customized-Nike-All-Court-Basketball-Gift_b5c70a43-00c3-423d-a579-05a5c05ad211.f18978494772ab2206535c21962a0be1.jpeg?odnHeight=180&odnWidth=180&odnBg=fffff,Personalized Customized Nike All- Court Basketball Gift
313,basketball,https://i5.walmartimages.com/seo/Naipo-Basketball-Hoop-Basketball-Goal-System-Height-Adjustable-5-8ft-7ft-Court-for-Kid-Adult-Indoor-Outdoor-Use_2c984270-bb96-4f24-b474-9f43680bf5ec.50aea82a6c832743fbfb1967bfb79a4f.jpeg?odnHeight=180&odnWidth=180&odnBg=fffff,Naipo Basketball Hoop Basketball Goal System Height Adjustable 5.8ft-7ft  Court for Kid & Adult Indoor Outdoor Use
314,basketball,https://i5.walmartimages.com/seo/44-inch-Outdoor-Basketball-Hoop-Stand-Adults-Sesslife-4-9FT-10FT-Height-Adjustable-Portable-w-Wheels-Shatterproof-Backboard-Outside-Court-Backyard-Bl_3545861d-2e17-43a3-9e88-586b92a3c8a5.44098e58e24c3d5757b107ff60bcce6b.png?odnHeight=180&odnWidth=180&odnBg=fffff,"44 inch Outdoor Basketball Hoop Stand for Adults, Sesslife 4.9FT-10FT Height Adjustable Portable Basketball Hoop w/Wheels & Shatterproof Backboard for Outside, Court Backyard, Black"
315,basketball,https://i5.walmartimages.com/seo/Silent-Basketball-Hoop-2023-Newest-Quiet-Indoor-Foam-Indoor-Dribbling-Training-Ball-Uncoated-High-Density-Mute-High-Resilience_40131032-7962-4612-8ef0-f75f1810128b.c0ee73f2229b32c86f8f39a1b28bd5be.jpeg?odnHeight=180&odnWidth=180&odnBg=fffff,"Silent Basketball & Basketball Hoop, 2023 Newest Quiet Basketball Indoor, Foam Indoor Dribbling Training Ball, Uncoated High-Density, Mute High-Resilience"
316,basketball,https://i5.walmartimages.com/seo/Sterling-Athletics-Navy-Blue-Shark-Superior-Grip-Indoor-Outdoor-Basketball-Size-5-Junior-Youth-27-5_8bffbe48-35f2-4b81-9de9-32b4c6730809.4e37a11546b2230c0d4b44d8ff555efb.png?odnHeight=180&odnWidth=180&odnBg=fffff,"Sterling Athletics Navy Blue Shark Superior Grip Indoor/Outdoor Basketball (Size 5 Junior & Youth 27.5"")"
317,basketball,https://i5.walmartimages.com/asr/5dbe18c3-0b93-4c87-96f3-fffdee3fca96.b3ed3ae780cc0bb0493b972d4894a012.jpeg?odnHeight=180&odnWidth=180&odnBg=ffffff,Voit 1307047 Lite 80 Basketball Prism Pack - Junior Size
318,basketball,https://i5.walmartimages.com/asr/16c22332-42cb-44bc-819d-5f3ddc632350_1.1401b162cd883b7877ca04cd41349add.jpeg?odnHeight=180&odnWidth=180&odnBg=ffffff,"Big Shot 33"" Training Basketball w/ Training DVD"
319,basketball,https://i5.walmartimages.com/seo/BSN-SPORTS-YMCA-Indoor-Outdoor-Basketball_ff5bc7ee-273d-4c95-950a-f29c65c463a4.d9c65ac117d1bc327196c4b756027fd9.jpeg?odnHeight=180&odnWidth=180&odnBg=fffff,BSN SPORTS™ YMCA® Indoor/Outdoor Basketball
320,basketball,https://i5.walmartimages.com/asr/b72713db-ff10-43fa-8cbb-ffdac516d11f.26f2d03c92068a24c92d674c1080ae85.png?odnHeight=180&odnWidth=180&odnBg=ffffff,"Sterling Athletics Royal Blue Superior Grip Indoor/Outdoor Basketball (Size 5 Junior & Youth 27.5"")"
321,basketball,https://i5.walmartimages.com/seo/Spalding-Varsity-Outdoor-Basketball-27-5_15566800-c77f-42d6-85f8-bc41b8a9d74e.e5fa922ca30e091b4958f4bf24e92474.jpeg?odnHeight=180&odnWidth=180&odnBg=fffff,"Spalding 84430 Official Youth Outdoor Basketball, Size 5 - Quantity 1"
322,basketball,https://i5.walmartimages.com/asr/36bbd7d4-caa1-404d-bc99-e9cf223f90c1_3.724230ce327c6b86b7f756b743dac16a.png?odnHeight=180&odnWidth=180&odnBg=ffffff,Baden Crossover Indoor/Outdoor Basketball-Black/Orange Size 6
323,basketball,https://i5.walmartimages.com/seo/Wave-Runner-Glow-The-Dark-Basketball-Official-Size-7-Light-Up-Toys-Night-Ball-Games-Regulation-Size-Tap-Activated-Glow-Gifts-Toy-All-Ages-Orange-w-Cr_0ac79f87-9109-4692-bf21-c2a52d2d37bd.a16f24b34b8bd1c6a439bcb3752ad2f4.jpeg?odnHeight=180&odnWidth=180&odnBg=fffff,"Wave Runner Glow in The Dark Basketball -Official Size 7 Light Up Toys for Night Ball Games, Regulation Size, Tap Activated -Glow Basketball Gifts and Toy Basketball for All Ages (Orange w/Cracks)"
324,basketball,https://i5.walmartimages.com/asr/69ee4ca7-f980-44b8-85cd-5b153a3ae4e3.a5690bace6022e5807c05ad68217b6db.jpeg?odnHeight=180&odnWidth=180&odnBg=ffffff,"NBA 54"" Portable Adjustable Basketball Hoop, Shatter-Resistant Backboard, Removable Rebounder360"
325,basketball,https://i5.walmartimages.com/asr/b3367eb4-b292-4ca6-a6d8-a292f3aa74cc_1.cd3e0743b89c53547b3ac59c2af36cdb.jpeg?odnHeight=180&odnWidth=180&odnBg=ffffff,Baden Crossover Indoor/Outdoor Basketball- Brown Size 7
326,basketball,https://i5.walmartimages.com/seo/SDJMa-Silent-Basketball-Silent-Basketball-Dribbling-Indoor-No-Noise-Standard-Hush-Handle-Foam-Basketball-Yellow-7-Inch_9defa612-ffc3-470e-bcc3-7e5ea2f81529.cb10a811a4c337a32184d0661ef01bd1.jpeg?odnHeight=180&odnWidth=180&odnBg=fffff,SDJMa Silent Basketball - Silent Basketball Dribbling Indoor No Noise - Standard Hush Handle Foam Basketball - Yellow/7 Inch
327,basketball,https://i5.walmartimages.com/seo/Spalding-NeverFlat-Pro-Indoor-Outdoor-Basketball-29-5_a20debf6-a6e4-4240-b1e3-09fc9b56cf16.9bacbb8e8be68a89ef13a8eee4d30c35.jpeg?odnHeight=180&odnWidth=180&odnBg=fffff,"Spalding NeverFlat Pro Indoor-Outdoor Basketball 29.5"""
328,basketball,https://i5.walmartimages.com/asr/637f2a85-55e7-4dd4-9cbd-ff16106e2adf.8e96f8876d72d9995f6f99c09cfeaaf6.jpeg?odnHeight=180&odnWidth=180&odnBg=ffffff,The Rock  C2C Composite Basketball
329,basketball,https://i5.walmartimages.com/seo/Customized-Wilson-EVO-NXT-Replica-Indoor-Outdoor-Basketball-Gift_b47ffd59-44e9-498e-a0cd-8afc42f2b353.2db5830c8db33319d86c1eadbfb6d8e0.png?odnHeight=180&odnWidth=180&odnBg=fffff,Customized Wilson EVO NXT Replica Indoor/Outdoor Basketball Gift
330,basketball,https://i5.walmartimages.com/asr/6ae9f19e-fe28-4e93-b4d9-02d8edd1ee5f.fcbfd24e94bab10d5c84049fa2bc25da.jpeg?odnHeight=180&odnWidth=180&odnBg=ffffff,MacGregor Women's Heavy Basketball
331,basketball,https://i5.walmartimages.com/seo/AND1-Enigma-Indoor-Outdoor-Intermediate-Premium-Rubber-Basketball-Teal-and-Black-28-5-in_9e7e02c2-a8c1-44aa-b080-cf9049931bc9.7e624106162847c80aaaba448a07d303.jpeg?odnHeight=180&odnWidth=180&odnBg=fffff,"AND1 Enigma Indoor/Outdoor Intermediate Premium Rubber Basketball, Teal and Black, 28.5 in"
332,basketball,https://i5.walmartimages.com/seo/AND1-Graffiti-Printed-Rubber-Basketball-Mint-and-Black-28-5-in_c1693c3e-9715-4b06-a4de-b9ece9a95e95.d2c38ee5c7eaf59283148c05b2ca199e.jpeg?odnHeight=180&odnWidth=180&odnBg=fffff,"AND1 Graffiti Printed Rubber Basketball, Mint and Black, 28.5 in"
333,basketball,https://i5.walmartimages.com/asr/f326590b-3e22-49b8-909d-7a6c030ec163.1509c59f31385e8ed9bc63755ca75be9.png?odnHeight=180&odnWidth=180&odnBg=ffffff,"Pop-a-Shot Slam Dunk over-the-door Mini Arcade Basketball Hoop, Foldable Hanging 18 in. Wide"
334,basketball,https://i5.walmartimages.com/asr/fc7f1210-f2b0-4f85-a7bc-e9b62b235db9.d13660f9712fec973200c70218ea4982.jpeg?odnHeight=180&odnWidth=180&odnBg=ffffff,Mikasa Jr. BX1008 Rubber Basketball
335,basketball,https://i5.walmartimages.com/asr/322ff0f3-fa4f-4278-b2c2-1e2e9fcbef27.6d92911dc3415d04f60a8ba2a4747176.jpeg?odnHeight=180&odnWidth=180&odnBg=ffffff,"Ktaxon 5.2' to 6.9' Adjustable Basketball Hoop Stand with Wheels, Backboard, Rim Net,Portable for Kids Teenager Indoor/Outdoor Fitness Exercise"
336,basketball,https://i5.walmartimages.com/asr/b3bbfaa1-c57e-4854-a692-482e03b6a451.7e9bf6db0b1517b60673b0eaaebc233f.jpeg?odnHeight=180&odnWidth=180&odnBg=ffffff,5.1 Inch Toddler Kids Mini Basketball Indoor Outdoor Toy Game Ball
337,basketball,https://i5.walmartimages.com/asr/2489bf19-d070-4093-b636-eb2f34c6dd3c.c9d07fed9345386897377ca918f1efa9.jpeg?odnHeight=180&odnWidth=180&odnBg=ffffff,"Children Basketball, Elasticity Wear Resistant Basketball, For Indoor And Outdoor Sports"
338,basketball,https://i5.walmartimages.com/seo/Eastshop-Silent-Basketball-Moderate-Elasticity-Anti-deformation-Long-Lasting-Comfortable-Touch-Anti-Skid-Parent-child-Interaction-Polyurethane-Outdoo_be468daa-f4f4-4c64-8a0f-04cc298381b0.8f8e12c8ba182bc7463e6f1c48c5506f.jpeg?odnHeight=180&odnWidth=180&odnBg=fffff,Eastshop Silent Basketball - Moderate Elasticity - Anti-deformation - Long Lasting - Comfortable Touch - Anti-Skid - Parent-child Interaction - Polyurethane - Outdoor Toy
339,basketball,https://i5.walmartimages.com/asr/d4fc67ff-71c7-4c85-a911-626b733a5d4c_2.27c6aeb585b15501011be67ec48777a2.png?odnHeight=180&odnWidth=180&odnBg=ffffff,Baden Crossover Indoor/OutdoorBasketball-Black/Green Size 6
340,basketball,https://i5.walmartimages.com/seo/Spalding-TF-Model-M-Official-Leather-Indoor-Game-Basketball-28-5_1600c5cb-a9ca-44d3-a8ce-148e7581d127.b6f7a27a1424f0fb373a4ce5717387e5.jpeg?odnHeight=180&odnWidth=180&odnBg=fffff,"Spalding TF Model M Official Leather Indoor Game Basketball - 28.5"""
341,basketball,https://i5.walmartimages.com/seo/Spalding-60-inch-Acrylic-Screw-Jack-Portable-Basketball-Hoop-System_68e84151-aa78-4dbd-b3bf-215cb3ecd9bc.25d78a4a07732d8b54a06a54c5be9974.jpeg?odnHeight=180&odnWidth=180&odnBg=fffff,Spalding 60 inch Acrylic Screw Jack Portable Basketball Hoop System
342,basketball,https://i5.walmartimages.com/seo/AND1-Enigma-Indoor-Outdoor-Youth-Premium-Rubber-Streetball-Blue-and-Black-27-5_3fde3eff-6555-43ba-aaf5-fe1a2409170f.d36174e53e267fd5907126bf190880d5.jpeg?odnHeight=180&odnWidth=180&odnBg=fffff,"AND1 Enigma Indoor/Outdoor Youth Premium Rubber Streetball, Blue and Black, 27.5"""
343,basketball,https://i5.walmartimages.com/asr/309e214a-1904-4512-9164-e2cba11286ec.85656258b4a401fd647b798b9ffa0b0e.jpeg?odnHeight=180&odnWidth=180&odnBg=ffffff,"LATA 6"" Durable PVC Mini Basketball Toy Balls for Indoor Mini Hoop, Outdoor Pool, and Party Favors - 4 Packs"
344,basketball,https://i5.walmartimages.com/asr/a007c8e4-4c4f-4f39-8b30-3b72052d134d_1.476b64986f7d48a613834c1749cbf173.jpeg?odnHeight=180&odnWidth=180&odnBg=ffffff,Weighted HeavyTrainer Basketball (3 or 2.75 lbs)
345,basketball,https://i5.walmartimages.com/asr/d4ccb81f-a7c7-4ca2-90be-3b5e8f5520f2.222345ee466875be3d2582fefab7dd47.jpeg?odnHeight=180&odnWidth=180&odnBg=ffffff,Spalding Sports 63-750T Junior NBA Basketball - 27.5 in.
346,basketball,https://i5.walmartimages.com/seo/Franklin-Sports-NBA-Los-Angeles-Clippers-Toy-Basketballs-2-Pack-Kids-Soft-Mini-Over-Door-Indoor-Hoops-Fan-Shop-2-Balls-Included_68f87511-bce4-4ab0-a471-b3fddbc1056c.14a52c9f0a45ee8dd2e5df740e76ea1d.jpeg?odnHeight=180&odnWidth=180&odnBg=fffff,Franklin Sports NBA Los Angeles Clippers Toy Basketballs - 2 Pack of Kids Soft Mini Basketballs for Over the Door + Indoor Hoops - NBA Fan Shop Kids Soft Toy Basketballs - (2) Mini Balls Included
347,basketball,https://i5.walmartimages.com/asr/e856e3f0-fb05-4678-8d2f-b9931f95cc10.01b6064c60735c20163fa30206f5dc29.jpeg?odnHeight=180&odnWidth=180&odnBg=ffffff,Champion Sports Size 7 Rubber Basketball Pink
348,basketball,https://i5.walmartimages.com/asr/bb42886e-6a9b-4183-9d50-706b227a74e6.12e24367f98d20c3042bea1f3566ac6a.jpeg?odnHeight=180&odnWidth=180&odnBg=ffffff,Lifetime Adjustable Portable Basketball Hoop (54-inch Polycarbonate) - 90631
349,basketball,https://i5.walmartimages.com/seo/Molten-2010-Basketball_3b6b0794-597e-41fb-9d9f-33029556b66d.a83b334589d305aa332dc8bcd7144e34.jpeg?odnHeight=180&odnWidth=180&odnBg=fffff,Molten 2010 Basketball
350,basketball,https://i5.walmartimages.com/seo/Personalized-Customized-Nike-All-Court-Basketball-Gift_b5c70a43-00c3-423d-a579-05a5c05ad211.f18978494772ab2206535c21962a0be1.jpeg?odnHeight=180&odnWidth=180&odnBg=fffff,Personalized Customized Nike All- Court Basketball Gift
351,basketball,https://i5.walmartimages.com/seo/Spalding-54-inch-Shatter-proof-Polycarbonate-Exacta-Height-Portable-Basketball-Hoop-System_c1432f78-daf5-4c75-9bc3-0e637efc62d9.69a4bc450c9b24b33a98ae5ba0fbb7a0.jpeg?odnHeight=180&odnWidth=180&odnBg=fffff,Spalding 54 inch Shatter-proof Polycarbonate Exacta Height® Portable Basketball Hoop System
352,basketball,https://i5.walmartimages.com/seo/AND1-Supreme-Grip-Spongetech-Rubber-Basketball-Multicolor-29-5-in_f1b6d4ae-dd14-465a-b971-d6926ef20f15.d434e197b9860d2aad2f228ff6dbf85e.jpeg?odnHeight=180&odnWidth=180&odnBg=fffff,"AND1 Supreme Grip Spongetech Rubber Basketball, Multicolor, 29.5 in"
353,basketball,https://i5.walmartimages.com/asr/975da732-438c-4ec1-89ce-fff271f22144_1.c3daeb9b9861408374b3a91a1b10fece.jpeg?odnHeight=180&odnWidth=180&odnBg=ffffff,"Franklin Sports Grip-Rite 1000 Official 29.5"" Basketball-Black/Red"
354,basketball,https://i5.walmartimages.com/asr/f453d673-79cf-4b53-8f92-8e2f3a7d4d1c.dececd44a04ec85cdeb2e1489113dfbd.jpeg?odnHeight=180&odnWidth=180&odnBg=ffffff,"Lifetime Adjustable Portable Basketball Hoop, 44 inch HDPE Plastic Impact (1221)"
355,basketball,https://i5.walmartimages.com/seo/AND1-Graffiti-Series-Fantom-Rubber-Basketball-Pump-Official-Size-7-Red_25d6f285-b383-4482-b7b6-5cd8f64ae3ab.10b5ff16610146f36887a78aa60f0b89.jpeg?odnHeight=180&odnWidth=180&odnBg=fffff,"AND1 Graffiti Series Fantom Rubber Basketball & Pump, Official Size 7, Red"
356,basketball,https://i5.walmartimages.com/seo/Sterling-Athletics-Tropical-Beach-Superior-Grip-Indoor-Outdoor-Basketball-Size-6-Women-s-Youth-28-5_93746020-4d44-4d3a-82fc-edc5f18057b6.746aab006356a9ce4ed538c575e5d541.png?odnHeight=180&odnWidth=180&odnBg=fffff,"Sterling Athletics Tropical Beach Superior Grip Indoor/Outdoor Basketball (Size 6 Women's & Youth 28.5"")"
357,basketball,https://i5.walmartimages.com/seo/AND1-Chaos-Jungle-Rubber-Basketball-Pump-Black-Blue-29-5_2e9fea16-40b9-4081-93f5-54e3195f21e1.d81d228b43d95fd13d6c852f16d7e382.jpeg?odnHeight=180&odnWidth=180&odnBg=fffff,"AND1 Chaos Jungle Rubber Basketball & Pump, Black & Blue, 29.5"""
358,basketball,https://i5.walmartimages.com/asr/576d87b9-ddd6-4cff-96de-0b2264cfff16.ab80ab5278be527400b127070dcf2413.jpeg?odnHeight=180&odnWidth=180&odnBg=ffffff,Spalding the Beast 72 In. Acrylic Portable Basketball Hoop System
359,basketball,https://i5.walmartimages.com/asr/dca190e5-9fad-4dc3-bddb-593692325f67.a36817962cac3c0c3dac420da1a7008e.jpeg?odnHeight=180&odnWidth=180&odnBg=ffffff,JUSTICE SPORTS RAINBOW SERIES TYE DYE RUBBER BASKETBALL (BLACK) (28.5)
360,basketball,https://i5.walmartimages.com/asr/d996c9db-51ab-4f56-83b2-ff394f36577b_1.d68bf8a277a3a86c7cafdbc30f1429ae.jpeg?odnHeight=180&odnWidth=180&odnBg=fffff,"Ultra Grip Rubber Basketball with Bladder, Official Size 7 | Bundle of 10 Each"
361,basketball,https://i5.walmartimages.com/seo/Flmtop-2Pcs-18cm-Light-Up-Basketball-High-Elasticity-Battery-free-PVC-High-Bright-Holographic-Basketball-for-Kids_616060ab-b9fd-48a2-b417-a83c1d38b41c.453c735f24244a87cc480ee6cfb36cb5.jpeg?odnHeight=180&odnWidth=180&odnBg=fffff,Flmtop 2Pcs 18cm Light Up Basketball High Elasticity Battery-free PVC High Bright Holographic Basketball for Kids
362,basketball,https://i5.walmartimages.com/asr/8307756c-e9d4-4301-a3f0-f94501e043a0.365fdf244e3a755f96b8ed5ed3f70658.jpeg?odnHeight=180&odnWidth=180&odnBg=ffffff,Customized Personalized Wilson Forge Basketball
363,basketball,https://i5.walmartimages.com/asr/d4b9ae00-886a-4250-9b30-4ac287587064.adf9180936ab4d55f2a938050dea9abf.jpeg?odnHeight=180&odnWidth=180&odnBg=ffffff,MacGregor Lil' Champ Basketball
364,basketball,https://i5.walmartimages.com/seo/Spalding-Precision-TF-1000-AAU-Indoor-Game-Basketball-28-5-In_380f5518-ec69-4b20-8b49-28bfce59f413.6d923108ede2a5ff71ac697ee459ab4c.jpeg?odnHeight=180&odnWidth=180&odnBg=fffff,Spalding Precision TF-1000 AAU Indoor Game Basketball 28.5 In.
365,basketball,https://i5.walmartimages.com/asr/4a7c4c9d-b31a-411c-9c83-1c12cb6917d6.022514eba4342bd37efe30dd01255ae4.jpeg?odnHeight=180&odnWidth=180&odnBg=ffffff,"VIRNAZ 44 in. Portable Basketball Hoop & Goal System for Outdoor Indoor Court, 4.8 - 10 Ft. Height Adjustable with Weight Bag"
366,basketball,https://i5.walmartimages.com/seo/Foldable-Arcade-Basketball-Game-Kids-BTMWAY-Dual-Shot-Electronic-Hoop-Indoor-Pinball-Machine-Timer-Scoreboard-6-Balls-8-Modes-Double-Mode-2-Players_83478b1d-dd49-4074-b97c-edef84abe078.a456fe49d5f748c08550edae03bbbfad.jpeg?odnHeight=180&odnWidth=180&odnBg=fffff,"Foldable Arcade Basketball Game for Kids, BTMWAY Dual Shot Electronic Basketball Hoop Indoor, Pinball Machine with Shot Timer | Basketball Scoreboard | 6 Balls - 8 Game Modes（Double Mode 2 Players）"
367,basketball,https://i5.walmartimages.com/seo/Spalding-Pure-Spin-12-Ball-Pack-Orange_804a59d4-4bb9-4c16-b414-43474769c2b5_1.07bfd0a48f659cd58376104c2172b1c2.jpeg?odnHeight=180&odnWidth=180&odnBg=fffff,Spalding Pure Spin 12 Ball Pack - Orange
368,basketball,https://i5.walmartimages.com/seo/Marvel-Marvel-Comics-Spider-Man-Homecoming-Basketball-Set-4pc-Set-Sports-Accessories_ef4b3a1a-fb2a-48f3-b22a-d0a974258be0.4966ad69092b9ad47441dd85fbdf86b5.jpeg?odnHeight=180&odnWidth=180&odnBg=fffff,Marvel Marvel Comics Spider-Man Homecoming Basketball Set (4pc Set) Sports Accessories
369,basketball,https://i5.walmartimages.com/asr/cb792eb7-bb9f-49f4-bf07-93c8d9900a87.2146b043153a13a270809c0cba8d7ffc.jpeg?odnHeight=180&odnWidth=180&odnBg=ffffff,S.R. Smith S-BASK-44 Swim N Dunk Complete Salt Friendly Basketball Game with in-Deck Anchors
