,category,image_url,title
550,basketball,https://i5.walmartimages.com/asr/ce946f8f-8023-42ed-a9fa-a4c779e25b34.15c75cf6d993090cc954bebfae74b700.jpeg?odnHeight=180&odnWidth=180&odnBg=ffffff,Spalding 10 Pack Needles
551,basketball,https://i5.walmartimages.com/asr/9d5a2515-1144-4a0f-b800-54b00593ec4e.0d2da589dfc8410c208f39046bb0f001.jpeg?odnHeight=180&odnWidth=180&odnBg=ffffff,"Lifetime Adjustable Portable Basketball Hoop, 52-inch Polycarbonate (1558)"
552,basketball,https://i5.walmartimages.com/seo/Silent-Basketball-Indoor-Quiet-Training-Ball-Uncoated-High-Density-Foam-Soft-Lightweight-Easy-Grip-Suitable-Various_da96221f-f540-4c70-99b3-6411c1298a8e.e76967b7845e5e2d83236260a8af49cb.jpeg?odnHeight=180&odnWidth=180&odnBg=fffff,"Silent Basketball, Indoor Quiet Training Ball, Uncoated High Density Foam Ball, Soft Lightweight, Easy to Grip Silent Ball, Suitable for Various Indoor"
553,basketball,https://i5.walmartimages.com/asr/989438fb-4890-4fb7-bdf1-25b25239b66c.5e4e647fa7776aee8cb32a4088f4bc19.jpeg?odnHeight=180&odnWidth=180&odnBg=ffffff,Hedstrom - Corona #7 XS-100 Basketball
554,basketball,https://i5.walmartimages.com/asr/78e2ac66-b924-4059-b606-d546bf72b654.ad445e0d7c2714f0cd9e948e9699a63d.jpeg?odnHeight=180&odnWidth=180&odnBg=ffffff,Goplus Portable Basketball Hoop System 5-10 FT Adjustable with Weight Bag Wheels Outdoor
555,basketball,https://i5.walmartimages.com/asr/45e61383-eeb6-4c85-9eeb-b8e29217533b.6fbe9301daa99aab9d000c3224dd9d84.jpeg?odnHeight=180&odnWidth=180&odnBg=ffffff,MacGregor Men's Heavy Basketball
556,basketball,https://i5.walmartimages.com/seo/Customized-Personalized-Spalding-Cross-Court-Basketball-Gift_d0359557-d276-46a4-b9e5-3f5944b01e75.08483724ceb5c76ef9bbed0ead6856d4.jpeg?odnHeight=180&odnWidth=180&odnBg=fffff,Customized Personalized Spalding Cross Court Basketball Gift
557,basketball,https://i5.walmartimages.com/asr/fb8d5d33-fadd-4544-9ce8-d9fb9170a8f2.3d100fcf5b4457351bd659b7a6025da0.jpeg?odnHeight=180&odnWidth=180&odnBg=ffffff,Spalding 54 In. Performance Acrylic Basketball Backboard and Rim Combo
558,basketball,https://i5.walmartimages.com/asr/41442981-3f2a-446a-ae19-912e73b327c9_1.ad95fe05d4633272b9cb48cce3c3fdbe.jpeg?odnHeight=180&odnWidth=180&odnBg=ffffff,"Wilson Evolution Game Basketball, Intermediate Size, Scarlet"
559,basketball,https://i5.walmartimages.com/asr/41442981-3f2a-446a-ae19-912e73b327c9_1.ad95fe05d4633272b9cb48cce3c3fdbe.jpeg?odnHeight=180&odnWidth=180&odnBg=ffffff,"Wilson Evolution Game Basketball, Intermediate Size, Scarlet"
560,basketball,https://i5.walmartimages.com/asr/4197481d-8dbf-42f2-9d08-e030770fcdaf.c708bc98ad91c86c6019dd2f5ace6901.jpeg?odnHeight=180&odnWidth=180&odnBg=ffffff,29.5 in. Elite Pro Basketball
561,basketball,https://i5.walmartimages.com/seo/YIWULA-Mini-Yellow-Basketball-Rubber-Training-Small-Size-for-Indoor-Mini-Basketball_9202a1da-d703-491b-89c8-28c15b2b425c_1.7770f1f472e048d7a670fdc626680466.jpeg?odnHeight=180&odnWidth=180&odnBg=fffff,YIWULA Mini Yellow Basketball Rubber Training Small Size for Indoor Mini Basketball
562,basketball,https://i5.walmartimages.com/asr/7aa935bb-44c1-4c97-af05-aa068e958bff_1.880cb5ec44ba5abfda590f667fbb20b9.jpeg?odnHeight=180&odnWidth=180&odnBg=fffff,Mini Yellow Basketball Rubber Training Small Size for Indoor Mini Basketball
563,basketball,https://i5.walmartimages.com/seo/Indoor-Mini-Rubber-Small-Basketball-Mini-Yellow-Size-Training-Basketball-for-sports_a0335148-b6f4-4e71-80fd-3b537cd07df9.81ab776c0700f442f0a3cdb61fd54621.jpeg?odnHeight=180&odnWidth=180&odnBg=fffff,Indoor Mini Rubber Small Basketball Mini Yellow Size Training Basketball for sports
564,basketball,https://i5.walmartimages.com/asr/3ae3f7c7-b235-4d4d-8c3a-bacd551dcf64.fc3b156bad1e8339ee895375a5b0cea7.jpeg?odnHeight=180&odnWidth=180&odnBg=ffffff,"Basketball, Silent Basketball Dribbling Indoor, Indoor Training Foam Ball No Noise No Sound Basketball"
565,basketball,https://i5.walmartimages.com/seo/AND1-Enigma-Indoor-Outdoor-Intermediate-Premium-Rubber-Basketball-Teal-and-Black-28-5-in_9e7e02c2-a8c1-44aa-b080-cf9049931bc9.7e624106162847c80aaaba448a07d303.jpeg?odnHeight=180&odnWidth=180&odnBg=fffff,"AND1 Enigma Indoor/Outdoor Intermediate Premium Rubber Basketball, Teal and Black, 28.5 in"
566,basketball,https://i5.walmartimages.com/seo/AND1-Graffiti-Printed-Rubber-Basketball-Mint-and-Black-28-5-in_c1693c3e-9715-4b06-a4de-b9ece9a95e95.d2c38ee5c7eaf59283148c05b2ca199e.jpeg?odnHeight=180&odnWidth=180&odnBg=fffff,"AND1 Graffiti Printed Rubber Basketball, Mint and Black, 28.5 in"
567,basketball,https://i5.walmartimages.com/asr/c987537c-59c0-4e1d-a39a-5b2827cd4d05.7770f1f472e048d7a670fdc626680466.jpeg?odnHeight=180&odnWidth=180&odnBg=fffff,LBS Indoor Mini Rubber Small Basketball Mini Yellow Size Training Basketball for Ball Sports
568,basketball,https://i5.walmartimages.com/seo/Wamans-Soft-Foam-Mini-Basketball-Ball-for-Hoops-Indoor-Play-Durable-Lightweight-Textured-Surface-Hoop-Balls-for-Practicing-Basketballs_9defa612-ffc3-470e-bcc3-7e5ea2f81529.cb10a811a4c337a32184d0661ef01bd1.jpeg?odnHeight=180&odnWidth=180&odnBg=fffff,"Wamans Soft Foam Mini Basketball Ball for Hoops & Indoor Play-Durable & Lightweight,Textured Surface, Hoop-Balls for Practicing Basketballs"
569,basketball,https://i5.walmartimages.com/seo/Mikasa-Women-s-Premium-Composite-Leather-Basketball-BWL110-28-1-2-Inches_70f7a3e3-fefc-4ca4-9c7a-60a3d3888cff_1.8660aecb94909dc0424cb0205e7b36f4.jpeg?odnHeight=180&odnWidth=180&odnBg=fffff,"Mikasa Women's Premium Composite Leather Basketball, BWL110, 28-1/2 Inches"
570,basketball,https://i5.walmartimages.com/asr/070642ee-cf26-4f93-8de0-da030ee85660.f2a975eba4f925c1fd653b1310cb57dc.jpeg?odnHeight=180&odnWidth=180&odnBg=ffffff,"Zimtown 6.5ft-8ft Portable Basketball Hoop System Stand, Height Adjustable Basketball Goal, with 32""W PVC Backboard 2 Nets Wheels, for Youth Kids Teenagers Indoor Outdoor Playing"
571,basketball,https://i5.walmartimages.com/seo/Kuangmi-Star-Field-Luminous-Basketball-Fluorescent-Street-Ball-Gift-29-5In_3a30b074-e9c8-40ea-98ed-e2202682956a.dd543419e9a87babf002f6c123519a5d.jpeg?odnHeight=180&odnWidth=180&odnBg=fffff,"Kuangmi Star Field Luminous Basketball ,Fluorescent Street Ball Gift 29.5In."
572,basketball,https://i5.walmartimages.com/asr/29b816c9-898c-4ee2-bd09-9e19e22e1ea0.1ad1d60ccde94d704f63ae1e1175af7d.jpeg?odnHeight=180&odnWidth=180&odnBg=ffffff,"WILSON Sporting Goods Luminous Glow Basketball - 29.5"""
573,basketball,https://i5.walmartimages.com/seo/Millenti-Street-Wise-Camo-Basketball-Ball-Outdoor-Indoor-for-Men-Women-Youth-Who-Love-Basketball-Gray-Size-7-BB0207GY_d72b24bb-71ed-4c7d-9e76-0489bbf63560.4821ca0db639b96c64c7c0ef82b97acb.jpeg?odnHeight=180&odnWidth=180&odnBg=fffff,"Millenti Street Wise Camo Basketball Ball Outdoor Indoor for Men, Women & Youth Who Love Basketball, Gray Size 7, BB0207GY"
574,basketball,https://i5.walmartimages.com/seo/Zimtown-Height-Adjustable-Portable-Swimming-Pool-Basketball-Hoop_c5a469d0-ffeb-4130-b777-73dff3612776_1.0cf9b5cdbfb86179607d70b135d57bfe.jpeg?odnHeight=180&odnWidth=180&odnBg=fffff,Zimtown Height Adjustable Portable Swimming Pool Basketball Hoop
575,basketball,https://i5.walmartimages.com/seo/Spalding-60-inch-Acrylic-Screw-Jack-Portable-Basketball-Hoop-System_68e84151-aa78-4dbd-b3bf-215cb3ecd9bc.25d78a4a07732d8b54a06a54c5be9974.jpeg?odnHeight=180&odnWidth=180&odnBg=fffff,Spalding 60 inch Acrylic Screw Jack Portable Basketball Hoop System
576,basketball,https://i5.walmartimages.com/seo/AND1-Enigma-Indoor-Outdoor-Youth-Premium-Rubber-Streetball-Blue-and-Black-27-5_3fde3eff-6555-43ba-aaf5-fe1a2409170f.d36174e53e267fd5907126bf190880d5.jpeg?odnHeight=180&odnWidth=180&odnBg=fffff,"AND1 Enigma Indoor/Outdoor Youth Premium Rubber Streetball, Blue and Black, 27.5"""
577,basketball,https://i5.walmartimages.com/seo/Champion-Official-Size-Rubber-Basketball-Orange-Black-Pack-of-2-CHSRBB1-2_6d797169-ef8b-4897-9892-f64b8c14cdd0.6c433bd720bb899d75dc5fbebe9a3177.jpeg?odnHeight=180&odnWidth=180&odnBg=fffff,Champion Official Size Rubber Basketball Orange/Black Pack of 2 CHSRBB1-2
578,basketball,https://i5.walmartimages.com/asr/159a4081-f8cc-4a47-b7ba-3bcc6bde165f.4f4596a0350ed30997a12865f091b956.jpeg?odnHeight=180&odnWidth=180&odnBg=ffffff,"VEVOR 44"" Portable Basketball Hoop System, 4-10 ft Height Adjustable Basketball Goal System with Wheels & PC Shatterproof Backboard & Stable Base for Outdoor Indoor"
579,basketball,https://i5.walmartimages.com/seo/Wilson-Reaction-Pro-Leather-Basketball_dc99d9c0-e3d0-4c90-aac6-5e08f524c333.9dc6aedc187b73470ab1bfcfca564f27.jpeg?odnHeight=180&odnWidth=180&odnBg=fffff,Wilson Reaction Pro Leather Basketball
580,basketball,https://i5.walmartimages.com/asr/672ea5a5-afe8-4b0c-a51a-e9616351fd08.e236f650d4aa884d2e8689da3cfc3706.jpeg?odnHeight=180&odnWidth=180&odnBg=ffffff,"HONGGE 60 in. Portable Basketball Hoop System, 8 - 10 ft. Height Adjustable"
581,basketball,https://i5.walmartimages.com/seo/MODANU-Silent-Basketball-9-5-Orange-Basketball-Dribbling-Indoor-The-Handleshh-Hushhandle-Foam-Indoor-Training-Ball-No-Noise-Sound_2218260e-7d61-4f55-8c16-e3a1eeb451a6.a1ee8a55bf32bbb702e0932c6b41041d.jpeg?odnHeight=180&odnWidth=180&odnBg=fffff,"MODANU Silent Basketball, 9.5"" Orange Silent Basketball Dribbling Indoor, The Handleshh Silent Basketball, Hushhandle Silent Foam Basketball, Indoor Training Foam Ball No Noise No Sound Basketball"
582,basketball,https://i5.walmartimages.com/seo/Basketball-Training-in-a-Box-Size-6_588be9b4-01c4-4c46-8a22-6e2962d1bac0.bc0ce5083513dbb861445f957ee2b396.jpeg?odnHeight=180&odnWidth=180&odnBg=fffff,Basketball Training in a Box (Size 6)
583,basketball,https://i5.walmartimages.com/asr/f2436588-f4d9-4629-aa28-2d870adf2cd0.000fc1a7f1fe7c5c64095cafc4723afe.jpeg?odnHeight=180&odnWidth=180&odnBg=fffff,"Sanwood Light Up Basketball High Elasticity Battery-free PVC High Bright Holographic Basketball for Kids, Classic Toys"
584,basketball,https://i5.walmartimages.com/asr/aa786210-1810-459e-99e7-a0d77a78662b_1.7bc1fc2ea05deb62eb5ad4062cb883c0.jpeg?odnHeight=180&odnWidth=180&odnBg=ffffff,"Ktaxon Portable Basketball Hoop, 6.9ft - 8.5ft Height Adjustable, with Wheels and Shatterproof Backboard"
585,basketball,https://i5.walmartimages.com/seo/Spalding-54-inch-Shatter-proof-Polycarbonate-Exacta-Height-Portable-Basketball-Hoop-System_c1432f78-daf5-4c75-9bc3-0e637efc62d9.69a4bc450c9b24b33a98ae5ba0fbb7a0.jpeg?odnHeight=180&odnWidth=180&odnBg=fffff,Spalding 54 inch Shatter-proof Polycarbonate Exacta Height® Portable Basketball Hoop System
586,basketball,https://i5.walmartimages.com/seo/AND1-Supreme-Grip-Spongetech-Rubber-Basketball-Multicolor-29-5-in_f1b6d4ae-dd14-465a-b971-d6926ef20f15.d434e197b9860d2aad2f228ff6dbf85e.jpeg?odnHeight=180&odnWidth=180&odnBg=fffff,"AND1 Supreme Grip Spongetech Rubber Basketball, Multicolor, 29.5 in"
587,basketball,https://i5.walmartimages.com/asr/623ec3bb-bd54-4acf-a560-9980de861b7b.fa93d5adb6ca2cb516f3889ea0b2154a.jpeg?odnHeight=180&odnWidth=180&odnBg=ffffff,Spalding Graffiti Orange Outdoor Rubber Basketball Ball Official Full Size 7
588,basketball,https://i5.walmartimages.com/seo/Franklin-Sports-Grip-Rite-1000-Official-29-5-Basketball-Brown_e0c45c51-1785-43f1-95df-05a8e6e288ce_1.28cabbb6c6391792276f0ff501ce6b0d.jpeg?odnHeight=180&odnWidth=180&odnBg=fffff,"Franklin Sports Grip-Rite 1000 Official 29.5"" Basketball-Brown"
589,basketball,https://i5.walmartimages.com/seo/Decor-Store-Light-Up-Basketball-High-Elasticity-Battery-free-PVC-High-Bright-Holographic-Basketball-for-Kids_a2d2bf8b-15b4-450c-880a-efc831164419.497987f02657107bf77f96e33790d83b.jpeg?odnHeight=180&odnWidth=180&odnBg=fffff,Decor Store Light Up Basketball High Elasticity Battery-free PVC High Bright Holographic Basketball for Kids
590,basketball,https://i5.walmartimages.com/asr/af287156-a0ba-4fe6-a91a-454c746ca76d.b43d396790f034ad21e7025f194b4bb5.jpeg?odnHeight=180&odnWidth=180&odnBg=ffffff,Spalding Sports 84424 Full Size NBA Street Outdoor Basketball - Quantity of 4
591,basketball,https://i5.walmartimages.com/asr/8ac67ee4-8b5b-4b47-a446-171128af08ce.c415492432c8db20ca408100e279f331.jpeg?odnHeight=180&odnWidth=180&odnBg=ffffff,"Sportime Gradeball Rubber Junior Basketballs, 27 Inches, Assorted Colors, Set of 6"
592,basketball,https://i5.walmartimages.com/asr/e26957b9-54b0-4637-a606-410ea4f9732f_1.5becc49900b4f628b49d4e96f5a5ffc9.jpeg?odnHeight=180&odnWidth=180&odnBg=ffffff,Large Basketball Inflate - Toys - 1 Piece
593,basketball,https://i5.walmartimages.com/asr/abd0fed0-0aaf-4b59-ba3c-2f7e9a4199f4.8f16cc5ab0dbde4e6c491d59af5cbf9f.jpeg?odnHeight=180&odnWidth=180&odnBg=ffffff,"Mikasa National Junior Rubber Basketball, Youth"
594,basketball,https://i5.walmartimages.com/asr/2b434c25-ef1c-43e1-bc42-1d0cea81e78c.3623fd7003b4785eb23baa0592681020.jpeg?odnHeight=180&odnWidth=180&odnBg=ffffff,"Sterling Athletics Aztec Desert Lizard Coyote Superior Grip Indoor/Outdoor Basketball (Size 6 Intermediate 28.5"")"
595,basketball,https://i5.walmartimages.com/asr/b8b6599b-1649-47a0-8706-e59771533d0f.c54597295a53f395efb213969167e4e9.jpeg?odnHeight=180&odnWidth=180&odnBg=ffffff,2 Pcs Mini Inflation Basketball  16 Cm for Baby Outdoor Sports
596,basketball,https://i5.walmartimages.com/asr/02e71709-0cd6-4812-aef9-aae8f5624fa9.60e4ac7ed5ece05f667d72e3786ab55f.jpeg?odnHeight=180&odnWidth=180&odnBg=ffffff,Wilson Toronto Raptors Unsigned 2022-2023 City Edition Collector's Basketball
597,basketball,https://i5.walmartimages.com/asr/78fc2973-000e-4337-80ee-270e39233279.72313d6a6b64d4e8e2b7b333e87e657a.jpeg?odnHeight=180&odnWidth=180&odnBg=ffffff,"Spalding Spiral Dye 29.5"" Basketball"
598,basketball,https://i5.walmartimages.com/seo/Champro-Dura-Grip-Official-Size-Basketball-Charcoal_4abd7666-857d-40dd-801f-c226dce72cba.3b57b2b8e8688233127e90a7c78e0dc4.jpeg?odnHeight=180&odnWidth=180&odnBg=fffff,Champro Dura-Grip Official Size Basketball - Charcoal
599,basketball,https://i5.walmartimages.com/asr/6b10f4ed-b50f-4d38-b81d-fa53c158d89d.a2ad57d3566b6868c499635f4e2655eb.jpeg?odnHeight=180&odnWidth=180&odnBg=ffffff,"Voit 1307030 Lite 80 Prism Intermediate Size Basketballs, Pack of 6"
600,basketball,https://i5.walmartimages.com/asr/b6f7d863-b195-41ae-a430-0b0663524a10.6f7341d81660343cbc92406f8d2e7457.jpeg?odnHeight=180&odnWidth=180&odnBg=ffffff,Champion Sports 2.25 LB Intermediate Size Weighted Basketball
601,basketball,https://i5.walmartimages.com/asr/5ecb2391-9a22-4b18-b5be-313a5a3ea2e5.ffe1d133868eacdd2b4049e2c7b10667.jpeg?odnHeight=180&odnWidth=180&odnBg=ffffff,Zimtown Portable Basketball Hoop Goal System 6.8-8.5ft Adjustable for Kids/Adults Indoor Outdoor
602,basketball,https://i5.walmartimages.com/asr/fb5ab9b6-9812-4175-8400-e3b19011f773.3cb202d050fa4ddc1af6a8db9d757bc2.jpeg?odnHeight=180&odnWidth=180&odnBg=ffffff,Florida State Seminoles Mini Basketball
603,basketball,https://i5.walmartimages.com/asr/44e67030-e1c4-46de-b6ae-f770b681275f.feccf5273d66bd61d7cfd2ca4203da95.jpeg?odnHeight=180&odnWidth=180&odnBg=ffffff,4 pcs  Small Basketball Mini Plastic Basketball Youth Basketball For Toddlers Kids
604,basketball,https://i5.walmartimages.com/asr/5a51f502-bfdd-4a73-97fe-422c94e4b5eb.8b4555aaa66cc8e3540609541ce3dd60.jpeg?odnHeight=180&odnWidth=180&odnBg=ffffff,Spalding TF 3-Ball Travel Basketball Bag - Black
605,basketball,https://i5.walmartimages.com/seo/Millenti-BB0107GD-StreetCred-Gold-Basketball_5950cc40-7bf1-4d1c-aa20-ef8327bdd8f7.0b32b5647f2965a94c21a3e4bac68d2e.jpeg?odnHeight=180&odnWidth=180&odnBg=fffff,Millenti BB0107GD StreetCred Gold Basketball
606,basketball,https://i5.walmartimages.com/seo/UDIYO-Light-Up-Basketball-High-Elasticity-Battery-free-PVC-High-Bright-Holographic-Basketball-for-Kids_a2d2bf8b-15b4-450c-880a-efc831164419.497987f02657107bf77f96e33790d83b.jpeg?odnHeight=180&odnWidth=180&odnBg=fffff,UDIYO Light Up Basketball High Elasticity Battery-free PVC High Bright Holographic Basketball for Kids
607,basketball,https://i5.walmartimages.com/seo/Sanrio-New-Anime-Kawaii-Basketball-Cartoon-Series-Cinnamoroll-Cute-Size-7-Indoor-Anime-Standard-Basketball-Valentine-s-Day-Gifts_f92e7a12-b74e-4d9c-8873-2dd6cff6baab.5a837aae3223957a869142f774d6b504.jpeg?odnHeight=180&odnWidth=180&odnBg=fffff,Sanrio New Anime Kawaii Basketball Cartoon Series Cinnamoroll Cute Size 7 Indoor Anime Standard Basketball Valentine's Day Gifts
608,basketball,https://i5.walmartimages.com/asr/45b562db-5166-46c6-9305-6bdae344bf11.158d2a42b0359ecbbfef043d0d50c0a0.jpeg?odnHeight=180&odnWidth=180&odnBg=ffffff,Mikasa Nat'l JR Rubber Basketball 28.5 pink
609,basketball,https://i5.walmartimages.com/seo/Kuangmi-Clown-Series-Basketball-Weird-Green-Graffiti-Street-Ball-Size7-29-5_6c893d5e-57e1-4a5c-b6ea-9e9eb4927ca2.002a95612995f42f666e81d043034427.jpeg?odnHeight=180&odnWidth=180&odnBg=fffff,"Kuangmi Clown Series Basketball Weird Green Graffiti Street Ball Size7 29.5"""
610,basketball,https://i5.walmartimages.com/seo/Basketball-Glow-in-the-Dark-Basketball-Glowing-Composite-Leather-Luminous-Basketball-Gift-Indoor-Outdoor-Night-Basketball-Size_c93a8c04-7bf8-477f-b790-975e46007b94.1d3daa05234cc7e272644326291eda69.jpeg?odnHeight=180&odnWidth=180&odnBg=fffff,"Basketball, Glow in the Dark Basketball, Glowing Composite Leather Luminous Basketball Gift, Indoor-Outdoor Night Basketball Size"
611,basketball,https://i5.walmartimages.com/seo/AND1-Enigma-Indoor-Outdoor-Intermediate-Premium-Rubber-Basketball-Teal-and-Black-28-5-in_9e7e02c2-a8c1-44aa-b080-cf9049931bc9.7e624106162847c80aaaba448a07d303.jpeg?odnHeight=180&odnWidth=180&odnBg=fffff,"AND1 Enigma Indoor/Outdoor Intermediate Premium Rubber Basketball, Teal and Black, 28.5 in"
612,basketball,https://i5.walmartimages.com/seo/AND1-Graffiti-Printed-Rubber-Basketball-Mint-and-Black-28-5-in_c1693c3e-9715-4b06-a4de-b9ece9a95e95.d2c38ee5c7eaf59283148c05b2ca199e.jpeg?odnHeight=180&odnWidth=180&odnBg=fffff,"AND1 Graffiti Printed Rubber Basketball, Mint and Black, 28.5 in"
613,basketball,https://i5.walmartimages.com/seo/Shulemin-Light-Up-Basketball-High-Elasticity-Battery-free-PVC-High-Bright-Holographic-Basketball-for-Kids_a2d2bf8b-15b4-450c-880a-efc831164419.497987f02657107bf77f96e33790d83b.jpeg?odnHeight=180&odnWidth=180&odnBg=fffff,Shulemin Light Up Basketball High Elasticity Battery-free PVC High Bright Holographic Basketball for Kids
614,basketball,https://i5.walmartimages.com/asr/75bc13a3-9243-4b8b-b17a-2cfa55e50796_1.4a7ff76ad9b1a8940076307e0b6bbbb0.jpeg?odnHeight=180&odnWidth=180&odnBg=ffffff,"Athletic Works Steel Chain Basketball Net, Rust-Proof, Heavy-Duty"
615,basketball,https://i5.walmartimages.com/seo/NOGIS-Silent-Basketball-Hush-Handle-Basketball-Dribbling-Indoor-Hoop-Indoor-Quiet-No-Noise-Uncoated-High-Density-Ball-Low-Noise-Indoor-3-18cm_4926ddb0-bb08-489a-ba7b-f3febf672419.48c42007892f39d4dabb20ab8288c45d.jpeg?odnHeight=180&odnWidth=180&odnBg=fffff,"NOGIS Silent Basketball,Hush Handle Basketball Dribbling Indoor with Basketball Hoop Indoor, Quiet Basketball No Noise,Uncoated High-Density Ball Low Noise Basketball for Indoor（#3-18cm）"
616,basketball,https://i5.walmartimages.com/asr/51f1dc89-ebf0-4b1d-b4eb-961a50b62339.49e9ad5d9322dc8f7d1552b2b5205990.jpeg?odnHeight=180&odnWidth=180&odnBg=ffffff,"Athletic Works Heavy Duty Basketball Net, Professional Quality Nylon (Red White and Blue)"
617,basketball,https://i5.walmartimages.com/asr/8d198c2a-d8da-4f7a-af9a-fef9a6d4f768.cad01f272f7879b8fdac7a257b3d8383.jpeg?odnHeight=180&odnWidth=180&odnBg=ffffff,Lifetime Poolside Adjustable Portable Basketball Hoop - 90742
618,basketball,https://i5.walmartimages.com/seo/Mikasa-Rubber-Basketball-Official-29-5_cee964f0-0cae-4e75-bb03-e3113c604c5e.7d8623cc8cb3bdf7c8e491e92c8dbfa8.jpeg?odnHeight=180&odnWidth=180&odnBg=fffff,"Mikasa Rubber Basketball, Official, 29.5"
619,basketball,https://i5.walmartimages.com/seo/SUGIFT-Portable-Basketball-Hoop-Kids-Height-Adjustable-5-5ft-6-8ft-with-Wheels-Black_2fc59b9a-b95a-4276-8734-518464a4506d.dad5f0b8a50b54c227bb41ca72367f77.jpeg?odnHeight=180&odnWidth=180&odnBg=fffff,SUGIFT Portable Basketball Hoop Kids Height-Adjustable(5.5ft-6.8ft) with Wheels - Black
620,basketball,https://i5.walmartimages.com/seo/Syncfun-Arcade-Basketball-Game-For-Kids-Indoor-Basketball-Hoop-With-4-Balls-Basketball-Goal-For-Kids-Boys-Girls_27484594-dbad-4e6e-a1e7-ac2e9fd44e3e.9c8b9a70b0630f0e03b916df99b56e8b.jpeg?odnHeight=180&odnWidth=180&odnBg=fffff,"Syncfun Arcade Basketball Game For Kids, Indoor Basketball Hoop With 4 Balls, Basketball Goal For Kids Boys Girls"
621,basketball,https://i5.walmartimages.com/seo/Spalding-60-inch-Acrylic-Screw-Jack-Portable-Basketball-Hoop-System_68e84151-aa78-4dbd-b3bf-215cb3ecd9bc.25d78a4a07732d8b54a06a54c5be9974.jpeg?odnHeight=180&odnWidth=180&odnBg=fffff,Spalding 60 inch Acrylic Screw Jack Portable Basketball Hoop System
622,basketball,https://i5.walmartimages.com/seo/Spalding-Rebound-Rubber-Basketball-Color-Brick-Orange-Size-7-NBA-Rebound_79fd937d-9a7a-4157-9706-9dae78c06936.a27dd4223503b927516523613a3b9683.jpeg?odnHeight=180&odnWidth=180&odnBg=fffff,"Spalding Rebound Rubber Basketball (Color: Brick Orange, Size: 7) (NBA Rebound)"
623,basketball,https://i5.walmartimages.com/asr/1186550e-7c24-4baa-922d-b85827807ec2.ab2b64baf8a895473cea8d5f0bd02518.jpeg?odnHeight=180&odnWidth=180&odnBg=ffffff,"Light Up Basketball Night Light - Official Size 7 - Waterproof Glow Basketball with Two High Bright LEDs Perfect Glow in The Dark,Official Size& Weight with Pump for Man Teen Boy for Gift Toys"
624,basketball,https://i5.walmartimages.com/asr/eb85095d-a351-4acc-9c79-f4abef9a50e2.80062cf5f8761b23938778534d9eb5f0.jpeg?odnHeight=180&odnWidth=180&odnBg=ffffff,"MaxKare 44 In. Portable Basketball Hoop System Goals Adjustable Height 7 Ft. 6 In. - 10 Ft. for Adults Teenagers, with 2 Wheels, Strong Base Outdoor Game"
625,basketball,https://i5.walmartimages.com/seo/ESPN-2-Player-EZ-Fold-and-Assemble-Basketball-Game-with-Polycarbonate-Backboard-and-LED-Scoring_a5c98f93-a581-46ae-b8fe-4c9848747f4f_2.49865c19159c12334d540b4a6f4d3d77.jpeg?odnHeight=180&odnWidth=180&odnBg=fffff,ESPN 2 Player EZ Fold and Assemble Basketball Game with Polycarbonate Backboard and LED Scoring
626,basketball,https://i5.walmartimages.com/asr/4d674507-53a9-4fe1-a50e-1dee839d6311_1.d826536b1ef29305609f3b45d2789bc9.jpeg?odnHeight=180&odnWidth=180&odnBg=ffffff,Nike Villanova Wildcats Mini Rubber Basketball
627,basketball,https://i5.walmartimages.com/asr/06559bcd-8eb4-4769-b3e1-9aa7b076c266.709aeb8b4ae69f790fdc692121214aa2.jpeg?odnHeight=180&odnWidth=180&odnBg=ffffff,"MaxKare 44 In. Portable Basketball Hoop, 7.6 ft. - 10 ft. Height Adjustable Stand with Wheels for Youth Kids Indoor Outdoor Use"
628,basketball,https://i5.walmartimages.com/asr/d4fc67ff-71c7-4c85-a911-626b733a5d4c_2.27c6aeb585b15501011be67ec48777a2.png?odnHeight=180&odnWidth=180&odnBg=ffffff,Baden Crossover Indoor/OutdoorBasketball-Black/Green Size 5
629,basketball,https://i5.walmartimages.com/seo/Herrnalise-Basketball-Glow-Dark-Glowing-Composite-Leather-Luminous-Basketball-Gift-Youth-Men-Women-Indoor-Outdoor-Night-With-Net_f8a716dd-35cc-4c5b-bac5-287bead648d4.e052a7fa87b5d16b4d623c431a37a12b.jpeg?odnHeight=180&odnWidth=180&odnBg=fffff,"Herrnalise Basketball, Glow in the Dark Basketball, Glowing Composite Leather Luminous Basketball Gift for Youth, Men, Women, Indoor-Outdoor Night Basketball With Net"
630,basketball,https://i5.walmartimages.com/seo/New-York-Knicks-Wilson-Basketball_1170a705-ac8e-41fc-9730-b8cf67b7f7f3.9743e1265b32ef73234b931eddc24882.jpeg?odnHeight=180&odnWidth=180&odnBg=fffff,New York Knicks Wilson Basketball
631,basketball,https://i5.walmartimages.com/seo/AND1-Enigma-Indoor-Outdoor-Youth-Premium-Rubber-Streetball-Blue-and-Black-27-5_3fde3eff-6555-43ba-aaf5-fe1a2409170f.d36174e53e267fd5907126bf190880d5.jpeg?odnHeight=180&odnWidth=180&odnBg=fffff,"AND1 Enigma Indoor/Outdoor Youth Premium Rubber Streetball, Blue and Black, 27.5"""
632,basketball,https://i5.walmartimages.com/seo/Spalding-54-inch-Shatter-proof-Polycarbonate-Exacta-Height-Portable-Basketball-Hoop-System_c1432f78-daf5-4c75-9bc3-0e637efc62d9.69a4bc450c9b24b33a98ae5ba0fbb7a0.jpeg?odnHeight=180&odnWidth=180&odnBg=fffff,Spalding 54 inch Shatter-proof Polycarbonate Exacta Height® Portable Basketball Hoop System
633,basketball,https://i5.walmartimages.com/seo/Molten-BG3000-Basketball_b2377303-9a79-49b8-adaf-1c976053c842.d343553cd04afe2a4eca5148db548468.jpeg?odnHeight=180&odnWidth=180&odnBg=fffff,Molten BG3000 Basketball
634,basketball,https://i5.walmartimages.com/asr/b93e51f3-11db-4446-afb8-38bb718979b2.c693f58bb0666f83f848f1a4179c4714.jpeg?odnHeight=180&odnWidth=180&odnBg=ffffff,YIYIBYUS LED Basketball Hoop Lights Basketball Rim Night Lamp 16 Color Change Waterproof Outdoor Light Gift for Kids
635,basketball,https://i5.walmartimages.com/asr/a26036a8-9d0b-459c-9793-8d2fe84c0f82.74036bc5430de850a97ae4fb0ab4a35e.jpeg?odnHeight=180&odnWidth=180&odnBg=ffffff,Spalding Shooting Spots
636,basketball,https://i5.walmartimages.com/asr/6d3067a7-38fe-4d87-a446-a300db390361.eee389ce7c54a70baa406a57e3d173c2.jpeg?odnHeight=180&odnWidth=180&odnBg=ffffff,Customized Personalized Nike Jordan Diamond Basketball
637,basketball,https://i5.walmartimages.com/asr/d48fb81d-838a-4070-b1b0-d410c52863ef.0b4f9e2050f80d1d5193ae53ba11802d.jpeg?odnHeight=180&odnWidth=180&odnBg=ffffff,Wilson Houston Rockets Retro Mini Basketball
638,basketball,https://i5.walmartimages.com/asr/59d0fa9a-4119-4c09-9cd3-6069d0a8bc77.cd8b34edb261d8818d2ed95b932bd221.jpeg?odnHeight=180&odnWidth=180&odnBg=fffff,6-Pack of Ball Mini Basketball Blue
639,basketball,https://i5.walmartimages.com/seo/Unisex-Nike-Black-Purdue-Boilermakers-2024-NCAA-Men-s-Basketball-Tournament-March-Madness-Final-Four-Locker-Room_8fa79efb-fbd1-4627-866b-7bcb22bd649c.ac7b0357ea6e355ce13cad99d2ca864c.jpeg?odnHeight=180&odnWidth=180&odnBg=fffff,Unisex Nike  Black Purdue Boilermakers 2024 NCAA Men's Basketball Tournament March Madness Final Four Locker Room
