,category,image_url,title
0,basketball,https://i5.walmartimages.com/seo/Spalding-Super-Tack-Pro-Indoor-and-Outdoor-Basketball-29-5-In_f9c0091f-21c7-4ad9-8384-1ead9a98cc46.4e54e6e5b53ef399e595c59d19113ee0.jpeg?odnHeight=180&odnWidth=180&odnBg=fffff,"Spalding Super Tack Pro Indoor and Outdoor Basketball, 29.5 In."
1,basketball,https://i5.walmartimages.com/seo/Spalding-Max-Grip-TF-Indoor-Outdoor-Basketball-29-5-In_7e6fb21f-03fe-41ab-9b02-56dab4a29366.ffc0a1c9873f7c397ee7c52e4259ccf0.jpeg?odnHeight=180&odnWidth=180&odnBg=fffff,Spalding Max Grip TF Indoor-Outdoor Basketball 29.5 In.
2,basketball,https://i5.walmartimages.com/seo/FlashCatch-Light-Up-Basketball-Glow-Dark-NO-7-Sports-Gifts-For-Boys-Girls-8-12-Year-Old-Kids-Teens-Gift-Ideas-Cool-Boy-Toys-Glowing-Ball-Night-Activi_3cd9826c-6af1-40fc-9ea3-ff9c1a3bfead.7a659ed9f94ecee292a386b3c4e245ad.jpeg?odnHeight=180&odnWidth=180&odnBg=fffff,FlashCatch Light Up Basketball - Glow in the Dark Basketball - NO 7 - Sports Gifts For Boys & Girls 8-12+ Year Old - Kids & Teens Gift Ideas - Cool Boy Toys Glowing Ball Night Activity
3,basketball,https://i5.walmartimages.com/seo/AND1-Fantom-Rubber-Basketball-Black-White-Graffiti-29-5_d650a16d-512f-4b8d-aebf-da7575db82b2.f994a0eccaa85ed48b983eea77151209.jpeg?odnHeight=180&odnWidth=180&odnBg=fffff,"AND1 Fantom Rubber Basketball, Black & White Graffiti, 29.5"""
4,basketball,https://i5.walmartimages.com/seo/Wilson-NBA-DRV-Outdoor-Basketball-29-5-Brown_91c4e623-197f-44ca-afdc-7aecee38acb0.b2d792f6a0713d15976b5850a8d8a610.jpeg?odnHeight=180&odnWidth=180&odnBg=fffff,"Wilson NBA DRV Outdoor Basketball 29.5"" - Brown"
5,basketball,https://i5.walmartimages.com/seo/Spalding-Super-Tack-Pro-Indoor-and-Outdoor-Basketball-29-5-In_f9c0091f-21c7-4ad9-8384-1ead9a98cc46.4e54e6e5b53ef399e595c59d19113ee0.jpeg?odnHeight=180&odnWidth=180&odnBg=fffff,"Spalding Super Tack Pro Indoor and Outdoor Basketball, 29.5 In."
6,basketball,https://i5.walmartimages.com/seo/Spalding-Fast-Break-All-Surface-Blue-Silver-Basketball-29-5_f5544668-8be4-43b6-8420-5640c9def267.5a295ffaa3643423d1a60179e10fab7a.jpeg?odnHeight=180&odnWidth=180&odnBg=fffff,"Spalding Fast Break All Surface Blue/Silver Basketball 29.5"""
7,basketball,https://i5.walmartimages.com/seo/Wilson-NCAA-Street-Shot-Outdoor-Basketball-Official-Size-29-5_e41edc68-d533-445a-8017-9e18bce6d346_1.0d51d0f7eb9c33d54302ac0bbb889dd0.jpeg?odnHeight=180&odnWidth=180&odnBg=fffff,"Wilson NCAA Street Shot Outdoor Basketball, Official Size 29.5"""
8,basketball,https://i5.walmartimages.com/seo/Wilson-NCAA-Final-Four-Edition-Basketball-Official-Size-29-5_12d53046-02f0-474e-b938-ddec147650ba_1.36c752cebb5dcb256078a2bc56ff75fa.jpeg?odnHeight=180&odnWidth=180&odnBg=fffff,"Wilson NCAA Final Four Edition Basketball, Official Size - 29.5"""
9,basketball,https://i5.walmartimages.com/seo/AND1-Fantom-Rubber-Basketball-Black-White-Graffiti-29-5_d650a16d-512f-4b8d-aebf-da7575db82b2.f994a0eccaa85ed48b983eea77151209.jpeg?odnHeight=180&odnWidth=180&odnBg=fffff,"AND1 Fantom Rubber Basketball, Black & White Graffiti, 29.5"""
10,basketball,https://i5.walmartimages.com/seo/AND1-Enigma-Indoor-Outdoor-Intermediate-Premium-Rubber-Basketball-Teal-and-Black-28-5-in_9e7e02c2-a8c1-44aa-b080-cf9049931bc9.7e624106162847c80aaaba448a07d303.jpeg?odnHeight=180&odnWidth=180&odnBg=fffff,"AND1 Enigma Indoor/Outdoor Intermediate Premium Rubber Basketball, Teal and Black, 28.5 in"
11,basketball,https://i5.walmartimages.com/seo/AND1-Graffiti-Printed-Rubber-Basketball-Mint-and-Black-28-5-in_c1693c3e-9715-4b06-a4de-b9ece9a95e95.d2c38ee5c7eaf59283148c05b2ca199e.jpeg?odnHeight=180&odnWidth=180&odnBg=fffff,"AND1 Graffiti Printed Rubber Basketball, Mint and Black, 28.5 in"
12,basketball,https://i5.walmartimages.com/asr/7e6fb21f-03fe-41ab-9b02-56dab4a29366.ffc0a1c9873f7c397ee7c52e4259ccf0.jpeg?odnHeight=180&odnWidth=180&odnBg=ffffff,Spalding Max Grip TF Indoor-Outdoor Basketball 29.5 In.
13,basketball,https://i5.walmartimages.com/asr/9e7e02c2-a8c1-44aa-b080-cf9049931bc9.7e624106162847c80aaaba448a07d303.jpeg?odnHeight=180&odnWidth=180&odnBg=ffffff,"AND1 Enigma Indoor/Outdoor Intermediate Premium Rubber Basketball, Teal and Black, 28.5 in"
14,basketball,https://i5.walmartimages.com/seo/Wilson-NBA-Forge-Indoor-Outdoor-Basketball-Brown-29-5-in_1c2ef0c8-a9d1-4ef4-b648-dd13094a5c6e.c5d507afbd97057ec7b137a771812bcb.png?odnHeight=180&odnWidth=180&odnBg=fffff,"Wilson NBA Forge Indoor/Outdoor Basketball, Brown, 29.5 in."
15,basketball,https://i5.walmartimages.com/seo/Wilson-Evolution-Official-Game-Basketball-29-5_199c2572-2887-4cd4-80f0-48ae4fad9810_1.2dbc454e8ebc7c58f3082e53e78fba81.jpeg?odnHeight=180&odnWidth=180&odnBg=fffff,"Wilson Evolution Official Game Basketball - 29.5"""
16,basketball,https://i5.walmartimages.com/seo/Wilson-NBA-DRV-Pro-Outdoor-Basketball-Brown-29-5-in_a813a234-b5d2-4be0-abe0-1c5f5503a6bc.f0ed86e01cbcb6d95bd27b751097f2e2.png?odnHeight=180&odnWidth=180&odnBg=fffff,"Wilson NBA DRV Pro Outdoor Basketball, Brown, 29.5 in."
17,basketball,https://i5.walmartimages.com/asr/f1b6d4ae-dd14-465a-b971-d6926ef20f15.d434e197b9860d2aad2f228ff6dbf85e.jpeg?odnHeight=180&odnWidth=180&odnBg=ffffff,"AND1 Supreme Grip Spongetech Rubber Basketball, Multicolor, 29.5 in"
18,basketball,https://i5.walmartimages.com/seo/Senston-27-5-Youth-Basketball-for-Kids-Junior-Children-Official-Size-5-Basketball-Ball-School-Kids-Basketball_dc6a525b-9525-4afe-b95a-e78b1691bb97.d251720dc367d1273de3d52a6c9435e6.jpeg?odnHeight=180&odnWidth=180&odnBg=fffff,"Senston 27.5"" Youth Basketball for Kids Junior Children Official Size 5 Basketball Ball School Kids Basketball"
19,basketball,https://i5.walmartimages.com/asr/c1693c3e-9715-4b06-a4de-b9ece9a95e95.d2c38ee5c7eaf59283148c05b2ca199e.jpeg?odnHeight=180&odnWidth=180&odnBg=ffffff,"AND1 Graffiti Printed Rubber Basketball, Mint and Black, 28.5 in"
20,basketball,https://i5.walmartimages.com/seo/Spalding-60-inch-Acrylic-Screw-Jack-Portable-Basketball-Hoop-System_68e84151-aa78-4dbd-b3bf-215cb3ecd9bc.25d78a4a07732d8b54a06a54c5be9974.jpeg?odnHeight=180&odnWidth=180&odnBg=fffff,Spalding 60 inch Acrylic Screw Jack Portable Basketball Hoop System
21,basketball,https://i5.walmartimages.com/seo/Spalding-Rebound-Rubber-Basketball-Color-Brick-Orange-Size-7-NBA-Rebound_79fd937d-9a7a-4157-9706-9dae78c06936.a27dd4223503b927516523613a3b9683.jpeg?odnHeight=180&odnWidth=180&odnBg=fffff,"Spalding Rebound Rubber Basketball (Color: Brick Orange, Size: 7) (NBA Rebound)"
22,basketball,https://i5.walmartimages.com/seo/iFanze-Basketball-Hoop-60-84-Adjustable-Height-Kids-Teenagers-Youth-Junior-33-Portable-Stand-Backboard-Wheels-Goals-Indoor-Outdoor-Play_a8a2962a-0d92-4e40-8019-25239d756db6.20caf36659186e372eff645280b2e603.jpeg?odnHeight=180&odnWidth=180&odnBg=fffff,"iFanze Basketball Hoop with 60''- 84'' Adjustable Height for Kids Teenagers Youth Junior, 33'' Portable Basketball Hoop with Stand & Backboard Wheels for Basketball Goals Indoor Outdoor Play"
23,basketball,https://i5.walmartimages.com/asr/91c4e623-197f-44ca-afdc-7aecee38acb0.b2d792f6a0713d15976b5850a8d8a610.jpeg?odnHeight=180&odnWidth=180&odnBg=ffffff,"Wilson NBA DRV Outdoor Basketball 28.5"" - Brown"
24,basketball,https://i5.walmartimages.com/asr/3fde3eff-6555-43ba-aaf5-fe1a2409170f.d36174e53e267fd5907126bf190880d5.jpeg?odnHeight=180&odnWidth=180&odnBg=ffffff,"AND1 Enigma Indoor/Outdoor Youth Premium Rubber Streetball, Blue and Black, 27.5"""
25,basketball,https://i5.walmartimages.com/seo/Wilson-NBA-Authentic-Indoor-Outdoor-Basketball-Brown-29-5-in_b6219bdc-7f98-44f2-9437-4efa365584c8.8b81ea6936e862adf6204f288d8ba50c.jpeg?odnHeight=180&odnWidth=180&odnBg=fffff,"Wilson NBA Authentic Indoor/Outdoor Basketball, Brown, 29.5 in."
26,basketball,https://i5.walmartimages.com/asr/61512111-6559-4ffb-9193-43684a31df23.a4d8cc3d1ca805987d9bd9ccdbb704ed.jpeg?odnHeight=180&odnWidth=180&odnBg=ffffff,SPLATTER Basketball
27,basketball,https://i5.walmartimages.com/asr/06280d96-d400-4f76-b621-eb669dc72eab.8cb23540851ef3e7f3d0b403386f8b99.jpeg?odnHeight=180&odnWidth=180&odnBg=ffffff,"AND1 Enigma Indoor/Outdoor Competitive Premium Rubber Streetball, 29.5"""
28,basketball,https://i5.walmartimages.com/seo/Spalding-Street-Phantom-29-5-Outdoor-Basketball-Neon-Green-Black_99a09727-7553-4010-8181-a366b95a7628.3c4ec1275904693d5c4f5c64c47a0907.jpeg?odnHeight=180&odnWidth=180&odnBg=fffff,"Spalding Street Phantom 29.5"" Outdoor Basketball - Neon Green/Black"
29,basketball,https://i5.walmartimages.com/seo/Spalding-Varsity-Blue-Green-Outdoor-Basketball-29-5_49e40e4a-ca02-4e6c-ae2b-a018ffe02a83.81c300dcbf3e3c17cbfc10fa6ee38882.jpeg?odnHeight=180&odnWidth=180&odnBg=fffff,"Spalding Varsity Blue/Green Outdoor Basketball 29.5"""
30,basketball,https://i5.walmartimages.com/seo/AND1-Enigma-Indoor-Outdoor-Youth-Premium-Rubber-Streetball-Blue-and-Black-27-5_3fde3eff-6555-43ba-aaf5-fe1a2409170f.d36174e53e267fd5907126bf190880d5.jpeg?odnHeight=180&odnWidth=180&odnBg=fffff,"AND1 Enigma Indoor/Outdoor Youth Premium Rubber Streetball, Blue and Black, 27.5"""
31,basketball,https://i5.walmartimages.com/seo/Spalding-54-inch-Shatter-proof-Polycarbonate-Exacta-Height-Portable-Basketball-Hoop-System_c1432f78-daf5-4c75-9bc3-0e637efc62d9.69a4bc450c9b24b33a98ae5ba0fbb7a0.jpeg?odnHeight=180&odnWidth=180&odnBg=fffff,Spalding 54 inch Shatter-proof Polycarbonate Exacta Height® Portable Basketball Hoop System
32,basketball,https://i5.walmartimages.com/asr/6b937c4f-b7ad-4a0e-9c13-ca3b717681b7.cc3e3b75bc8cb439673204443241ebcf.jpeg?odnHeight=180&odnWidth=180&odnBg=ffffff,"Silent Hoops Premium Foam Basketball - Quiet Indoor Play for Kids, Standard Size"
33,basketball,https://i5.walmartimages.com/seo/MacGregor-Multi-Color-Indoor-or-Outdoor-Junior-Basketball-Youth-Size-27-5-In_76a4688d-f7dc-439c-b7fc-1689703d88ef_1.584ae947a187fe9912e9494325ab3b7e.jpeg?odnHeight=180&odnWidth=180&odnBg=fffff,"MacGregor Multi-Color Indoor or Outdoor Junior Basketball, Youth Size (27.5 In.)"
34,basketball,https://i5.walmartimages.com/seo/Champion-Sports-Junior-Rubber-Basketball-Purple_50164f04-07eb-4806-86a5-f240af929d32.5a92e391859a7bd0934863291b9c6acf.jpeg?odnHeight=180&odnWidth=180&odnBg=fffff,Champion Sports Junior Rubber Basketball Purple
35,basketball,https://i5.walmartimages.com/asr/bc8228a7-1f80-445f-8123-803c418bf82b.405839e5dda853bc317678c4cf9edb27.jpeg?odnHeight=180&odnWidth=180&odnBg=ffffff,"Spalding Street Pink Outdoor Basketball 28.5"""
36,basketball,https://i5.walmartimages.com/asr/0a20464d-bea2-4d5e-bc55-d123ca92bd46.94a3d3b633192cc6ab887f0028f95c86.jpeg?odnHeight=180&odnWidth=180&odnBg=ffffff,"Wilson NBA DRV Pro Gen Green Eco Basketball, Mint, 29.5 in."
37,basketball,https://i5.walmartimages.com/asr/12957ef9-97c7-4813-b560-05dbb9ebad2b.ce2896cc7efbf16d224c5b095741a1a4.jpeg?odnHeight=180&odnWidth=180&odnBg=ffffff,Portable Basketball Hoop Goal Basketball Hoop System Height Adjustable 7 ft. 6 in. - 10 ft. with 44 inch Indoor Outdoor PVC Backboard Material
38,basketball,https://i5.walmartimages.com/asr/df7beb6e-bec9-4130-83f2-4d76d5daaf35.4a2c6b337abce585c61fdc6474ab8965.png?odnHeight=180&odnWidth=180&odnBg=ffffff,"Wilson WNBA Authentic Outdoor Basketball, Orange/White, 28.5 in."
39,basketball,https://i5.walmartimages.com/asr/7bc18b6d-e3e1-4ba0-a336-4362fcd7b092.a23e12b655dbc124dc74f3d985f63274.jpeg?odnHeight=180&odnWidth=180&odnBg=ffffff,"S&S Worldwide Official Size S-500 Composite Basketball for Competitive Play Indoors and Outdoors.  29.5"" Circumference."
40,basketball,https://i5.walmartimages.com/asr/68e84151-aa78-4dbd-b3bf-215cb3ecd9bc.25d78a4a07732d8b54a06a54c5be9974.jpeg?odnHeight=180&odnWidth=180&odnBg=ffffff,Spalding 60 inch Acrylic Screw Jack Portable Basketball Hoop System
41,basketball,https://i5.walmartimages.com/seo/Spalding-Pro-Tack-Indoor-and-Outdoor-Basketball-29-5-In_564f32bd-40a4-4ea6-a723-634f59ded167.222b9a4eb7f9c13c5ce6890f11a98c02.jpeg?odnHeight=180&odnWidth=180&odnBg=fffff,Spalding Pro Tack Indoor and Outdoor Basketball 29.5 In.
42,basketball,https://i5.walmartimages.com/seo/XEOVHV-Silent-Basketball-2024-Newest-Foam-Basketball-Indoor-Training-Ball-Uncoated-High-Density-Ball-Low-Noise-Various-Activities_3ad44340-0708-4785-a002-7cef586a868c.e1af1aed5e751b66c9e61831aae4a400.jpeg?odnHeight=180&odnWidth=180&odnBg=fffff,"XEOVHV Silent Basketball,2024 Newest Foam Basketball Indoor Training Ball, Uncoated High-Density Foam Ball Low Noise Basketball Training for Various Indoor Activities"
43,basketball,https://i5.walmartimages.com/seo/Spalding-Grip-Control-TF-Indoor-and-Outdoor-Basketballs-29-5-In_1870265a-a17a-4c78-9a2a-154b5b1d7e83.a4b1d8f8a0035f03c5c7aadc3e4f79df.jpeg?odnHeight=180&odnWidth=180&odnBg=fffff,Spalding Grip Control TF Indoor and Outdoor Basketballs 29.5 In.
44,basketball,https://i5.walmartimages.com/asr/3cd9826c-6af1-40fc-9ea3-ff9c1a3bfead.7a659ed9f94ecee292a386b3c4e245ad.jpeg?odnHeight=180&odnWidth=180&odnBg=ffffff,FlashCatch Light Up Basketball - Glow in the Dark Basketball - NO 7 - Sports Gifts For Boys & Girls 8-12+ Year Old - Kids & Teens Gift Ideas - Cool Boy Toys Glowing Ball Night Activity
45,basketball,https://i5.walmartimages.com/asr/8d0a15d6-8d28-43c8-9bad-dda0f0a06148.8eb5c7cb8aa8fe0646526119eeb9f908.jpeg?odnHeight=180&odnWidth=180&odnBg=ffffff,"Wilson NCAA Evo NXT Replica 29.5"" Basketball - Size 7"
46,basketball,https://i5.walmartimages.com/asr/0ef3e482-68e6-4873-bc3b-9b98fec420dc_1.ea1e52f9adaea78292b32907ba9a3deb.jpeg?odnHeight=180&odnWidth=180&odnBg=ffffff,"Wilson NCAA Showcase Basketball, Official - 29.5"""
47,basketball,https://i5.walmartimages.com/asr/c1432f78-daf5-4c75-9bc3-0e637efc62d9.69a4bc450c9b24b33a98ae5ba0fbb7a0.jpeg?odnHeight=180&odnWidth=180&odnBg=ffffff,Spalding 54 inch Shatter-proof Polycarbonate Exacta Height Portable Basketball Hoop System
48,basketball,https://i5.walmartimages.com/asr/530e256e-c1c5-427c-88bb-3f219445de22.8bed9aef2a1e5d57367cd1b719101950.jpeg?odnHeight=180&odnWidth=180&odnBg=ffffff,"Wilson NCAA Legend Basketball, Pink Camo, Size 5"
49,basketball,https://i5.walmartimages.com/seo/Lifetime-Adjustable-Portable-Basketball-Hoop-46-inch-Polycarbonate-90584_f1984704-ec20-451b-9d30-75e5b3ff95cf.8fbd21e5ff050de8b4f6ff2c196699b9.jpeg?odnHeight=180&odnWidth=180&odnBg=fffff,"Lifetime Adjustable Portable Basketball Hoop, 46 inch Polycarbonate (90584)"
50,basketball,https://i5.walmartimages.com/seo/Champion-Sports-Size-7-Rubber-Basketball-Blue_59154d39-978a-45eb-827b-4c8550a6ae46_1.8c0ce3f678d6cdeb1c5f49e184cdf1fc.jpeg?odnHeight=180&odnWidth=180&odnBg=fffff,Champion Sports Size 7 Rubber Basketball Blue
51,basketball,https://i5.walmartimages.com/seo/Wilson-NBA-DRV-Outdoor-Mini-Basketball-Brown_eef16891-8d85-4d94-aa23-b24eff6f5547.0c37278b1d75928c5ac56631cc5a48bf.jpeg?odnHeight=180&odnWidth=180&odnBg=fffff,"Wilson NBA DRV Outdoor Mini Basketball, Brown"
52,basketball,https://i5.walmartimages.com/seo/Lifetime-Adjustable-Portable-Basketball-Hoop-44-inch-HDPE-Plastic-Impact-90759_a7aa5d03-79ac-4b31-9c83-8c9fabcf90a0.898a9199c3a84b539ebc4a2596861e70.jpeg?odnHeight=180&odnWidth=180&odnBg=fffff,"Lifetime Adjustable Portable Basketball Hoop, 44 inch HDPE Plastic Impact® (90759)"
53,basketball,https://i5.walmartimages.com/asr/98bab129-76a0-465b-9a1d-2a6e76c96f77.b4d626572096a0c27591c898add37d6d.jpeg?odnHeight=180&odnWidth=180&odnBg=ffffff,"Wilson ICON 29.5"" Basketball"
54,basketball,https://i5.walmartimages.com/asr/54ed0aec-e62b-4dd9-86fd-8a54f1ac370a.f7fcd3a2eb8e5954f84f3508dbf53439.jpeg?odnHeight=180&odnWidth=180&odnBg=ffffff,MRBEAST BASKETBALL
55,basketball,https://i5.walmartimages.com/seo/AND1-Enigma-Indoor-Outdoor-Intermediate-Premium-Rubber-Basketball-Teal-and-Black-28-5-in_9e7e02c2-a8c1-44aa-b080-cf9049931bc9.7e624106162847c80aaaba448a07d303.jpeg?odnHeight=180&odnWidth=180&odnBg=fffff,"AND1 Enigma Indoor/Outdoor Intermediate Premium Rubber Basketball, Teal and Black, 28.5 in"
56,basketball,https://i5.walmartimages.com/seo/AND1-Graffiti-Printed-Rubber-Basketball-Mint-and-Black-28-5-in_c1693c3e-9715-4b06-a4de-b9ece9a95e95.d2c38ee5c7eaf59283148c05b2ca199e.jpeg?odnHeight=180&odnWidth=180&odnBg=fffff,"AND1 Graffiti Printed Rubber Basketball, Mint and Black, 28.5 in"
57,basketball,https://i5.walmartimages.com/asr/114215ff-49cb-4cb1-9712-f608349100ec.b0d801e2c85bd1cb287ca4f4b94e5ff1.jpeg?odnHeight=180&odnWidth=180&odnBg=ffffff,Spalding Eco-Composite 32 inch Telescoping Portable Basketball Hoop System
58,basketball,https://i5.walmartimages.com/asr/da9ea87c-59e3-475a-83b1-ef951be026fd.8fd846d2196aa33ad1d339d0eb006d28.jpeg?odnHeight=180&odnWidth=180&odnBg=ffffff,Wilson NBA Signature Series Indoor/Outdoor Basketball
59,basketball,https://i5.walmartimages.com/seo/Ktaxon-45-53-Pool-Basketball-Hoop-Poolside-Basketball-Goal-for-Kids-and-Adult-Blue_414cff60-e9f6-4963-961c-00c6a075a143.80df7a0f3df78001063b994c0a675ec0.jpeg?odnHeight=180&odnWidth=180&odnBg=fffff,"Ktaxon 45"" - 53"" Pool Basketball Hoop, Poolside Basketball Goal for Kids and Adult, Blue"
60,basketball,https://i5.walmartimages.com/seo/Senston-Basketball-29-5-with-Pump-Basketball-Size-6-Youth-Aldult-Street-Basketball-Game_d089c92f-3ee9-4715-a639-7db3084389ce.bb3746968d479686246f9a5afb161cb3.jpeg?odnHeight=180&odnWidth=180&odnBg=fffff,"Senston Basketball 29.5"" with Pump,Basketball Size 6 Youth Aldult Street Basketball Game"
61,basketball,https://i5.walmartimages.com/asr/4b3821ac-8a92-41db-a053-a8f641a6d660.b824df5548cd687e1dd98fca7a128459.jpeg?odnHeight=180&odnWidth=180&odnBg=ffffff,"Wilson WNBA DRV Outdoor Basketball, Teal, 28.5 in."
62,basketball,https://i5.walmartimages.com/seo/A-Plus-Collectibles-Glow-Dark-Official-Space-Flight-1-Leather-Game-Basketball-Indoor-Outdoor-Court-Full-Size-Kids-Adult-7-29-5-Glow_416492da-b4fc-48e7-9678-cd942dcea04f.e373fe229fb5e58fac4ca36a1a56e6ca.jpeg?odnHeight=180&odnWidth=180&odnBg=fffff,"A Plus Collectibles Glow in the Dark Official Space Flight 1 Leather Game Basketball, Indoor/Outdoor Court, Full Size Kids & Adult Size 7, 29.5"" (Glow)"
63,basketball,https://i5.walmartimages.com/seo/Voit-Enduro-CB5-Indoor-Outdoor-Basketball-Rookie-Size-25-5_8999d487-1ccc-4d36-a537-aef0123c3a19.273518fd01ee774f773979e22d0de3b6.jpeg?odnHeight=180&odnWidth=180&odnBg=fffff,"Voit® Enduro CB5 Indoor/Outdoor Basketball Rookie Size (25.5"")"
64,basketball,https://i5.walmartimages.com/seo/Spalding-Lay-Up-Mini-Outdoor-Blue-Green-Basketball-22_fd90b072-dfb2-4978-8692-582b0773ed4c.124d8aa8e4ddc8429cfba7614db4949d.jpeg?odnHeight=180&odnWidth=180&odnBg=fffff,"Spalding Lay-Up Mini Outdoor Blue/Green Basketball 22"""
65,basketball,https://i5.walmartimages.com/seo/Spalding-60-inch-Acrylic-Screw-Jack-Portable-Basketball-Hoop-System_68e84151-aa78-4dbd-b3bf-215cb3ecd9bc.25d78a4a07732d8b54a06a54c5be9974.jpeg?odnHeight=180&odnWidth=180&odnBg=fffff,Spalding 60 inch Acrylic Screw Jack Portable Basketball Hoop System
66,basketball,https://i5.walmartimages.com/seo/Spalding-Rebound-Rubber-Basketball-Color-Brick-Orange-Size-7-NBA-Rebound_79fd937d-9a7a-4157-9706-9dae78c06936.a27dd4223503b927516523613a3b9683.jpeg?odnHeight=180&odnWidth=180&odnBg=fffff,"Spalding Rebound Rubber Basketball (Color: Brick Orange, Size: 7) (NBA Rebound)"
67,basketball,https://i5.walmartimages.com/asr/4c4f50d8-fca3-4624-bd52-7a7836f4603d.b9d52dc95394481f55d746b0d76d743f.png?odnHeight=180&odnWidth=180&odnBg=ffffff,"Achort Reflective Basketball, Size 7 Holographic Glowing Basketball with Carry Bag & Pump"
68,basketball,https://i5.walmartimages.com/asr/a1c79a12-ef45-4236-b00a-09d133e2a342.f7a94c2a1954118abe58ab9731509da1.jpeg?odnHeight=180&odnWidth=180&odnBg=ffffff,Wilson Sporting Goods 2092317 29.5 in. NCAA Legend Official Basketball
69,basketball,https://i5.walmartimages.com/seo/Wilson-NBA-Authentic-Outdoor-Basketball-Brown-Size-29-5-in_d126769c-61de-4d60-a4f5-a4d0606c20a2.4f93cf106d3b661d43e95e01f768c627.jpeg?odnHeight=180&odnWidth=180&odnBg=fffff,"Wilson NBA Authentic Outdoor Basketball, Brown, Size 29.5 in."
70,basketball,https://i5.walmartimages.com/asr/b808ac48-5823-4c79-aa54-7ac9b613a376.f1eb915edf8c50ba4c01c506b71f8fd9.jpeg?odnHeight=180&odnWidth=180&odnBg=ffffff,"DDI 1940869 9"" Neon Rainbow Playground Basketball Case of 36"
71,basketball,https://i5.walmartimages.com/seo/Spalding-Marble-Series-Multi-Color-Outdoor-Basketball-28-5_2d5140d3-52d4-450c-9aa1-4f640ea940a8.f03b2502e1ac45c83251acd6848bb3e3.jpeg?odnHeight=180&odnWidth=180&odnBg=fffff,"Spalding Marble Series Multi-Color Outdoor Basketball 28.5"""
72,basketball,https://i5.walmartimages.com/asr/c1c599d0-4d02-45a5-967a-2e6ebacc116d.18c485b268600a3f5f3be2f73a952fa7.jpeg?odnHeight=180&odnWidth=180&odnBg=ffffff,"Molten B7G4500 Composite FIBA Basketball Official Size 7 - 29.5"", Ivory color."
73,basketball,https://i5.walmartimages.com/seo/QDRAGON-Mini-Basketball-Hoop-Door-Indoor-3-Balls-Inflator-Breakaway-Rim-Toy-Gifts-Kids-Adults-Suit-Bedroom-Office-Outdoor-White-Red_190977c0-dc84-4a8a-948e-4cafcdb5df09.dfafaa4a31cd4693f6e36b4b5bb2e0f6.png?odnHeight=180&odnWidth=180&odnBg=fffff,"QDRAGON Mini Basketball Hoop for Door, Basketball Hoop Indoor, Mini Hoop with 3 Balls/Inflator/Breakaway Rim, Basketball Toy Gifts for Kids and Adults, Suit for Bedroom/Office/Outdoor, White with Red"
74,basketball,https://i5.walmartimages.com/asr/673eca31-7256-45dd-9036-3573734a254a.baa4cc9a3fe94aff4c1d25d08bbe0248.jpeg?odnHeight=180&odnWidth=180&odnBg=ffffff,Spalding High Bounce Spaldeen TF Mini Basketball - Orange
75,basketball,https://i5.walmartimages.com/seo/AND1-Enigma-Indoor-Outdoor-Youth-Premium-Rubber-Streetball-Blue-and-Black-27-5_3fde3eff-6555-43ba-aaf5-fe1a2409170f.d36174e53e267fd5907126bf190880d5.jpeg?odnHeight=180&odnWidth=180&odnBg=fffff,"AND1 Enigma Indoor/Outdoor Youth Premium Rubber Streetball, Blue and Black, 27.5"""
76,basketball,https://i5.walmartimages.com/seo/Spalding-54-inch-Shatter-proof-Polycarbonate-Exacta-Height-Portable-Basketball-Hoop-System_c1432f78-daf5-4c75-9bc3-0e637efc62d9.69a4bc450c9b24b33a98ae5ba0fbb7a0.jpeg?odnHeight=180&odnWidth=180&odnBg=fffff,Spalding 54 inch Shatter-proof Polycarbonate Exacta Height® Portable Basketball Hoop System
77,basketball,https://i5.walmartimages.com/seo/Midwest-Pro-League-Basketball_a22301eb-60fd-49dc-af06-cac8496ed7de.a1efe798a7520573e1271612818a6fd4.jpeg?odnHeight=180&odnWidth=180&odnBg=fffff,Midwest Pro League Basketball
78,basketball,https://i5.walmartimages.com/seo/Wilson-NCAA-Killer-Crossover-Basketball-Intermediate-28-5_40909233-5d4f-4aaf-9837-c46d023b6815_1.0fda382fbf20207fbfa5ae9246bead84.jpeg?odnHeight=180&odnWidth=180&odnBg=fffff,"Wilson NCAA Killer Crossover Basketball, Intermediate - 28.5"""
79,basketball,https://i5.walmartimages.com/seo/Spalding-27-5-Rookie-Gear-Youth-Indoor-Outdoor-Basketball-Brown_5a7e94a8-560a-4331-bc7b-0b6f1a40c3b6.6469556f3030c5aaa81ac5af3d2a6275.jpeg?odnHeight=180&odnWidth=180&odnBg=fffff,"Spalding 27.5"" Rookie Gear Youth Indoor/Outdoor Basketball - Brown"
80,basketball,https://i5.walmartimages.com/asr/2fb3ef7e-0a12-4acc-87a4-72f0575db9a6.3174ec04bef4e0ddf0dc61b5c3726d08.jpeg?odnHeight=180&odnWidth=180&odnBg=ffffff,"Kids Mini Basketball Hoop SetOver The Door Basketball Hoop with Electronic Scoreboard, Mini Basketball Hoop for Bedroom Office WallBasketball Toys Gifts for Boys Teens Adults 3 4 5 6 7 8 9 10 11"
81,basketball,https://i5.walmartimages.com/asr/07422339-45f2-46f8-bcb6-801ee4ff6e6b.7b6a8fcd6e92f8e90d5e95b401cdeba6.jpeg?odnHeight=180&odnWidth=180&odnBg=ffffff,"Nike Baller Basketball Full Size (29.5"", Ages 13+) Amber/Black/Metallic Platinum"
82,basketball,https://i5.walmartimages.com/asr/2cdd1a8b-2ee2-4b99-81b4-6162c5267516.3510e2d5c2981db8fc3737d29fd5b5e3.jpeg?odnHeight=180&odnWidth=180&odnBg=ffffff,Customized Personalized Nike Jordan Legacy Black and Gold Basketball
83,basketball,https://i5.walmartimages.com/seo/Champion-Sports-Mini-Rubber-Basketball-Orange_3ab32829-facf-4638-a6d1-2de8c0e3a004.f8c255d644c25698f2165cf356fb96bc.jpeg?odnHeight=180&odnWidth=180&odnBg=fffff,Champion Sports Mini Rubber Basketball Orange
84,basketball,https://i5.walmartimages.com/seo/Molten-2010-Basketball_3b6b0794-597e-41fb-9d9f-33029556b66d.a83b334589d305aa332dc8bcd7144e34.jpeg?odnHeight=180&odnWidth=180&odnBg=fffff,Molten 2010 Basketball
85,basketball,https://i5.walmartimages.com/asr/54418689-e61b-4ed6-9978-39b87cc65b5b_2.211b79e820ad3f4935efc95c64a9376c.jpeg?odnHeight=180&odnWidth=180&odnBg=ffffff,Unique Sports Dribble Specs Basketball Training Aid
86,basketball,https://i5.walmartimages.com/asr/bb0d3915-95b6-460c-b29e-60227f65f12b.47bfc9e2beeba265e41a0f897d32700c.jpeg?odnHeight=180&odnWidth=180&odnBg=ffffff,"iFanze Portable Basketball Hoop Goal 5ft-7ft Adjustable, Indoor Outdoor Basketball Hoop System with 33"" Shatterproof Backboard and Stand Wheels for Kids Teenagers Youth Junior, Black"
87,basketball,https://i5.walmartimages.com/seo/Basketball-Holographic-Glowing-Basketball-Indoor-Outdoor-Size-5-27-5-Reflective-Composite-Leather-Gift-Boys-Girls-Night-Game_93906424-e5ba-420c-8406-7911caf870ed.f60eb395635e55ee8bb5d736a29b370c.jpeg?odnHeight=180&odnWidth=180&odnBg=fffff,"Basketball, Holographic Glowing Basketball Indoor Outdoor Size 5 (27.5""), Reflective Glowing Composite Leather Basketball Gift for Boys Girls Night Game"
88,basketball,https://i5.walmartimages.com/seo/Nike-Elite-All-Court-2-0-Basketball_5bb20091-5ab5-4a6c-a68e-f8bc1f7de6bb.d6ee0d2649aa77907f29ef4a3189febb.jpeg?odnHeight=180&odnWidth=180&odnBg=fffff,Nike Elite All Court 2.0 Basketball
89,basketball,https://i5.walmartimages.com/seo/Baden-Skilcoach-Shooter-s-Training-Basketball-Size-6_2587d8df-702f-4442-80c8-fd415d4f139c.7fde40dd8e552884dde153b31b025257.png?odnHeight=180&odnWidth=180&odnBg=fffff,Baden Skilcoach Shooter's Training Basketball-Size 6
90,basketball,https://i5.walmartimages.com/asr/5a6ee7ec-3e0b-4757-8d93-f7d2fcb25095.1d8b20f7146d644f2305bc67f502c289.jpeg?odnHeight=180&odnWidth=180&odnBg=ffffff,"Wilson NBA DRV Plus Vibe Outdoor Basketball, Blue/Orange, 29.5 in."
91,basketball,https://i5.walmartimages.com/asr/18978947-d9ee-41ad-a543-be7e138f871c.5dacccf938418bcc864d16647bd01e76.jpeg?odnHeight=180&odnWidth=180&odnBg=ffffff,"SHAQ Official Sized Basketball (29.5"") - Black and Yellow"
