,category,image_url,title
0,outdoor_toys,https://i5.walmartimages.com/seo/Bounce-Pro-7-Foot-My-First-Trampoline-Hexagon-Ages-3-10-for-Kids-Blue-Green_9782613a-1ea0-4dd6-9fa5-e3be80071a53_1.601e4b529ada62266020a7b2d3ed8b89.jpeg?odnHeight=180&odnWidth=180&odnBg=fffff,"Bounce Pro 7-Foot My First Trampoline Hexagon (Ages 3-10) for Kids, Blue/Green"
1,outdoor_toys,https://i5.walmartimages.com/seo/Dinosaur-Planet-Kids-Sand-Water-Table-Toddlers-3-Tier-Play-Toys-Toddlers-Kids-Activity-Sensory-Tables-Outside-Beach-Toddler-Boys-Girls-Age-1-3-3-5-Gi_90b32438-92af-4e5e-b33b-f67adb41fb39.ba760b73b7fed13dd748f1425dea9b22.jpeg?odnHeight=180&odnWidth=180&odnBg=fffff,"Dinosaur Planet Kids Sand Water Table for Toddlers, 3-Tier Sand and Water Play Table Toys for Toddlers Kids, Activity Sensory Tables Outside Beach Toys for Toddler Boys Girls Age 1-3 3-5 Gift"
2,outdoor_toys,https://i5.walmartimages.com/seo/Fisher-Price-69-x-68-x-53-Bouncesational-Indoor-Bouncer-with-Built-in-Pump_9b01797d-d160-4126-992e-540ede47b10d.7161da1e29bd1d3a30c5cc0a7abdf58a.jpeg?odnHeight=180&odnWidth=180&odnBg=fffff,Fisher Price 69'' x 68'' x 53'' Bouncesational Indoor Bouncer with Built-in Pump
3,outdoor_toys,https://i5.walmartimages.com/seo/Hot-Bee-Hover-Soccer-Hockey-Ball-Set-2-in-1-LED-Rechargeable-Soccer-with-2-Goals-Indoor-Outdoor-Games-Toys-for-Kids-Boys-Girls-Ages-3_b12c617d-02a1-4049-bb1e-695dac53e58d.46df1f692958e855b164b49261db0026.jpeg?odnHeight=180&odnWidth=180&odnBg=fffff,"Hot Bee Hover Soccer Hockey Ball Set, 2 in 1 LED Rechargeable Soccer with 2 Goals Indoor/Outdoor Games Toys for Kids Boys Girls Ages 3+"
4,outdoor_toys,https://i5.walmartimages.com/asr/8464154a-64b3-43cb-a2a8-0280e8a89f9f.30eac26c98c97dc1ca669d17ce7284b0.jpeg?odnHeight=180&odnWidth=180&odnBg=ffffff,"Maxx Bubbles Super Bubble Jet,  Includes 4oz Solution, Bubble Blowing Machine Ages 3+"
5,outdoor_toys,https://i5.walmartimages.com/asr/d6d42c13-860b-4288-87b1-32b89e1872cb_1.50fa4c556b33df494155a4242c759282.jpeg?odnHeight=180&odnWidth=180&odnBg=ffffff,Funrise - Gazillion Bubble Rush
6,outdoor_toys,https://i5.walmartimages.com/asr/18ec6d2d-713f-4540-a923-e91e7facd221.eda80fa68777bea4a683499212a390ea.png?odnHeight=180&odnWidth=180&odnBg=ffffff,"Play Day Red Hopper, Outdoor Yard Games, Ages 3-12"
7,outdoor_toys,https://i5.walmartimages.com/asr/0c6eebd2-1849-48c9-998e-9a8a30fcf1d5_3.e52bb54c175fc578ecd133622e71b601.jpeg?odnHeight=180&odnWidth=180&odnBg=ffffff,"Play Day Toss & Catch Game, 2 Discs & 1 Ball, Child Ages 3+"
8,outdoor_toys,https://i5.walmartimages.com/asr/9e2cda40-b073-4120-99c9-d10f15632234.5c8d9ceee4377f415f3c0d152e6b33e2.jpeg?odnHeight=180&odnWidth=180&odnBg=ffffff,"Play Day Hopscotch Rings, Kid's Outdoor Sports, Ages 3-99"
9,outdoor_toys,https://i5.walmartimages.com/asr/f4894f92-a830-4914-b96e-412e445df6ba.c7781db55d80db0d8ea0cf452c7c36d2.png?odnHeight=180&odnWidth=180&odnBg=ffffff,"Play Day 5-in-1 Sports Set, Active Games for Young Children, Ages 3-99"
10,outdoor_toys,https://i5.walmartimages.com/seo/Gazillion-Bubbles-Tornado_f5ee5406-2778-4b96-852a-03867361d2c3.83a1be19b0ba7b66214a7355a9102ba7.jpeg?odnHeight=180&odnWidth=180&odnBg=fffff,Gazillion Bubbles Tornado
11,outdoor_toys,https://i5.walmartimages.com/asr/0b8386ff-f514-4555-85a2-e5fba5c77816.e79d983308859efed74b09ae82cdd116.jpeg?odnHeight=180&odnWidth=180&odnBg=ffffff,"Dinosaur Planet Sand Water Table for Toddlers, 4 in 1 Sand Table and Water Play Table, Kids Table Activity Sensory Play Table Beach Sand Water Toy for Outdoor Backyard for Toddlers Age 2-4 Gift"
12,outdoor_toys,https://i5.walmartimages.com/asr/c73342e5-4496-4c1e-8b92-e706d9dd5570.b20404fa23d5370693c1302673d218b6.jpeg?odnHeight=180&odnWidth=180&odnBg=ffffff,"Play Day Googly Toss Game, Plastic, 8 Pieces = 2 Target Boards and 6 Googly Balls"
13,outdoor_toys,https://i5.walmartimages.com/asr/6fa41156-2085-4f6e-ba31-2b653f4f5d8a_1.95de20414430b17b8905f8d7d36e384c.jpeg?odnHeight=180&odnWidth=180&odnBg=ffffff,"Play Day Bubble Maker Stick Toy with 30 Ounce Bubble Solution, 6 Pack, Multiple Colors, Child Ages 3+"
14,outdoor_toys,https://i5.walmartimages.com/asr/e0bfa5d3-7643-4d9b-bb1a-29ddf9b57521.32d62a631a964469a8313ca59cde96d3.jpeg?odnHeight=180&odnWidth=180&odnBg=ffffff,"Little Tikes Huge 24' L x 12' W x 7' H Inflatable Sports Bouncer Backyard Soccer & Basketball Court and Blower, Fits up to 8 Kids, Outdoor Sports Toy Kids Boys Girls Ages 3-8"
15,outdoor_toys,https://i5.walmartimages.com/seo/Yexmas-Sand-Water-Table-Toddlers-3-1-Play-Table-Kids-Activity-Sensory-Beach-Toy-Outdoor-Backyard-Toddlers-Gift_1d09f88a-dfba-439f-845e-d4a380390001.278bdc59d3cc338e993f9388b97d79e0.jpeg?odnHeight=180&odnWidth=180&odnBg=fffff,"Yexmas Sand Water Table for Toddlers, 3 in 1 Sand Table and Water Play Table, Kids Table Activity Sensory Play Table Beach Sand Water Toy for Outdoor Backyard for Toddlers Gift"
16,outdoor_toys,https://i5.walmartimages.com/seo/Step2-All-Around-Playtime-Patio-with-Canopy-with-16-Play-Accessories-Playhouse-Kids-Outdoor-Toys_df1f92f8-c6d5-408f-91d0-5934f5382801.920c817f5a8b8b0ca5f86aaa103800b4.jpeg?odnHeight=180&odnWidth=180&odnBg=fffff,Step2 All-Around Playtime Patio with Canopy with 16 Play Accessories Playhouse Kids Outdoor Toys
17,outdoor_toys,https://i5.walmartimages.com/asr/21db4738-c8c8-411a-be62-07514a91c7d6.7f0c2e100da27d2f7b8f4117e8a35be0.jpeg?odnHeight=180&odnWidth=180&odnBg=ffffff,"STAR WARS GROGU BUBBLE MACHINE, includes bubble solution"
18,outdoor_toys,https://i5.walmartimages.com/asr/e8098340-6f8c-43dd-ad3b-30e2817363b3.3b660fececc3f27bf7a9e8a631bc665d.jpeg?odnHeight=180&odnWidth=180&odnBg=ffffff,"Backyard Waterpark Sprinkler Water Toy for Kids, Fun Outdoor Water Play with Dump Buckets and Splash Wheel Water Toys for Backyard"
19,outdoor_toys,https://i5.walmartimages.com/seo/Syncfun-Bubble-Lawn-Mower-Machine-Summer-Outdoor-Games-Toys-Kids-Toddler-3-6-Years-Old-Maker-Push-Toy-Boys-Girls-Birthday-Gifts-Blue_385e39cb-e86d-4cda-aa67-0dab82e7bc94.4f285072a3b482ab23b178ffd2cbdda3.jpeg?odnHeight=180&odnWidth=180&odnBg=fffff,"Syncfun Bubble Lawn Mower, Bubble Machine Summer Outdoor Games Toys for Kids Toddler 3-6 Years Old, Bubble Maker Push Toy Boys Girls Birthday Gifts - Blue"
20,outdoor_toys,https://i5.walmartimages.com/seo/Toys-3-Year-Old-Kids-Battery-Operated-Electric-Train-Boys-Girls-Toddlers-Light-Music-Effect-Early-Educational-Birthday-Gear-Toy-Children_1462ed2f-d9d7-48f3-bd24-f3f4f0bfbe2f.ca663c84801a8b5b12ea37af3b5c8a67.jpeg?odnHeight=180&odnWidth=180&odnBg=fffff,"Toys for 3+ Year Old Kids, Battery Operated Electric Train Toys for Boys Girls Toddlers with Light & Music Effect, Early Educational Birthday Gear Train Toy for Children"
21,outdoor_toys,https://i5.walmartimages.com/asr/c0773e94-23ab-41e8-b2fc-784a4f65b461.e784ac9af453f4f3b4126d6d1cea5358.jpeg?odnHeight=180&odnWidth=180&odnBg=ffffff,"Play Day Push N Bubble Mower Toy with 4oz Solution, Children Ages 2+"
22,outdoor_toys,https://i5.walmartimages.com/asr/137de74e-e5ae-42b8-936a-679289922083.c47136ca39b485e472634cb8f2f6adf5.jpeg?odnHeight=180&odnWidth=180&odnBg=ffffff,"Play Day Bubble Leaf Blower, Battery Operated, Bubble Blowing Toy, For ages 3+"
23,outdoor_toys,https://i5.walmartimages.com/asr/687a1af0-0669-4b9c-b74d-925550bc1c06.b09de31a1295d4942e7c00fe5c60587a.jpeg?odnHeight=180&odnWidth=180&odnBg=ffffff,"Little Tikes Hoop It Up Play Center Ball Pit Value Pack, Kids Ages 3 and up"
24,outdoor_toys,https://i5.walmartimages.com/asr/fd79d35c-0a83-43ed-955f-bd2e883f8105.c249fb6c9703de2b3776f0ce4390c86f.jpeg?odnHeight=180&odnWidth=180&odnBg=ffffff,"Bluescape Multi-Color Inflatable Pool and Beach Ball 13"", Child Unisex, Ages 2+"
25,outdoor_toys,https://i5.walmartimages.com/asr/623b8eb4-16af-4fc1-a72e-6d5b6f8727a4.63d7da928464b1a75591183907cab17f.jpeg?odnHeight=180&odnWidth=180&odnBg=ffffff,"Playday 8pk 4oz Bubbles, 8 Pack, 4 Colors, Pink, Red, Orange, Green"
26,outdoor_toys,https://i5.walmartimages.com/asr/bd8a664a-005d-4568-a44f-830093ca15b2.a334a297a76c40c73c00dfa204a0d0c3.jpeg?odnHeight=180&odnWidth=180&odnBg=ffffff,"Play Day Inflatable Body Bumpers, Bumper Game for Young Children, Ages 3+"
27,outdoor_toys,https://i5.walmartimages.com/asr/bd7dcb49-caf1-4c33-9e32-f2fbea25260b.531bc39dc34abed7098c943f99d985fc.jpeg?odnHeight=180&odnWidth=180&odnBg=ffffff,"Play Day Boom Racket Game Red & Blue, 4 Piece Outdoor Sports Toy, Children Ages 3+"
28,outdoor_toys,https://i5.walmartimages.com/asr/123a3e2b-dfb4-4085-a021-96018aa4c55b.af5042067556d57823218c7c51a7cb70.jpeg?odnHeight=180&odnWidth=180&odnBg=ffffff,Gazillion Burstin' Bubble Cloud
29,outdoor_toys,https://i5.walmartimages.com/seo/Best-Choice-Products-Kids-3-in-1-Outdoor-Convertible-Wood-Activity-Sand-Water-Picnic-Table-w-Umbrella-Green_6ae6ad47-f57f-409c-af45-6bdd6a857f8e.6d7c9964e91f8aa3ea69bf097f566352.jpeg?odnHeight=180&odnWidth=180&odnBg=fffff,Best Choice Products Kids 3-in-1 Outdoor Convertible Wood Activity Sand & Water Picnic Table w/ Umbrella - Green
30,outdoor_toys,https://i5.walmartimages.com/seo/Toddlers-Water-Table-Waterfall-Maze-like-Wall-Double-Sided-Sand-Kids-32-PCS-Outdoor-Toys-Age-3-8-Activity-Sensory-Summer-Boys-Girls-Ages-4-8_15dfd686-a1a5-4476-a94b-02133d55717e.62309ac8607698f9d2a8e03bcce2e723.jpeg?odnHeight=180&odnWidth=180&odnBg=fffff,"Toddlers Water Table Waterfall Maze-like Wall - Double-Sided Water Sand Table for Kids, 32 PCS Outdoor Toys for Toddlers Age 3-8, Activity Sensory Table Summer Toys for Boys Girls Ages 4-8"
31,outdoor_toys,https://i5.walmartimages.com/asr/6eb430fa-d70a-41f5-8864-5033621663fe.cbd8e3250bf1d87e88e18396197f446d.jpeg?odnHeight=180&odnWidth=180&odnBg=ffffff,"Play Day Foldable Soccer Set, Beginner Sports Soccer Game, Children Ages 3+"
32,outdoor_toys,https://i5.walmartimages.com/asr/6a593483-fffa-400d-aefa-35e142fb9240.c6fb614c860aea96a9c03d050566f933.jpeg?odnHeight=180&odnWidth=180&odnBg=ffffff,"Banzai Jr. Duck Duck Splash 48"" Outdoor Summer Water Play Mat, Ages 18 Months +"
33,outdoor_toys,https://i5.walmartimages.com/asr/9b01797d-d160-4126-992e-540ede47b10d.7161da1e29bd1d3a30c5cc0a7abdf58a.jpeg?odnHeight=180&odnWidth=180&odnBg=ffffff,Fisher Price 69'' x 68'' x 53'' Bouncesational Indoor Bouncer with Built-in Pump
34,outdoor_toys,https://i5.walmartimages.com/seo/Hot-Bee-Hover-Soccer-Ball-Set-with-2-Goals-3-in-1-LED-Soccer-Hockey-Bowling-Set-Indoor-Outdoor-Toys-Gifts-for-Kids-Boys-Girls-Ages-3_fffc7948-9e07-42a9-a692-aa6392a3fd55.f1cdf6903f795ebc676d10dc16c0adc4.jpeg?odnHeight=180&odnWidth=180&odnBg=fffff,"Hot Bee Hover Soccer Ball Set with 2 Goals, 3-in-1 LED Soccer Hockey Bowling Set Indoor/Outdoor Toys Gifts for Kids Boys Girls Ages 3+"
35,outdoor_toys,https://i5.walmartimages.com/asr/62692514-d918-4527-8b98-23270c5527a6.74eab0aa2cfd171b00a4e82a4128fd76.jpeg?odnHeight=180&odnWidth=180&odnBg=ffffff,"Play Day Bubble Barrage, Includes 4oz Solution & Drip Tray - Unisex, Children Ages 3+"
36,outdoor_toys,https://i5.walmartimages.com/asr/f5ee5406-2778-4b96-852a-03867361d2c3.83a1be19b0ba7b66214a7355a9102ba7.jpeg?odnHeight=180&odnWidth=180&odnBg=ffffff,Gazillion Bubbles Tornado
37,outdoor_toys,https://i5.walmartimages.com/asr/01f044eb-f831-4bdc-835f-7b29a7db6915_1.5393aba204d3f410e5c398df1174378c.jpeg?odnHeight=180&odnWidth=180&odnBg=ffffff,"Little Tikes TotSports Kids T-Ball Set with Bat and 2 Balls, Ages 18 Months to 4 Years"
38,outdoor_toys,https://i5.walmartimages.com/asr/820f0b35-6f0f-4cd8-be1d-fc2b38eec7d9.41da324d92f03804acd6cbb86b61081c.jpeg?odnHeight=180&odnWidth=180&odnBg=ffffff,"Basketball Goal for Kids, Outdoor Indoor Basketball Hoop Arcade Game with 6 Balls with Pump, Basketball Shooting System for Toddlers and Children, Sports Toys for 3-6 Year Old Boys Girls Gifts, W17910"
39,outdoor_toys,https://i5.walmartimages.com/seo/Wisairt-Bubble-Lawn-Mower-Bubble-Machine-Kids-Toddlers-Outdoor-Summer-Garden-Push-Toy-Toys-Birthday-Gift-Preschool-Boy-Girl-2-Pink-White_de504f3e-6f80-4ea5-86dc-1049552274aa.54a912b3f415fc86bf59f38e4ad4015b.jpeg?odnHeight=180&odnWidth=180&odnBg=fffff,"Wisairt Bubble Lawn Mower,Bubble Machine for Kids Toddlers, Outdoor Summer Garden Push Toy Bubble Toys Birthday Gift for Preschool Boy or Girl 2+(Pink & White)"
40,outdoor_toys,https://i5.walmartimages.com/asr/90b32438-92af-4e5e-b33b-f67adb41fb39.ba760b73b7fed13dd748f1425dea9b22.jpeg?odnHeight=180&odnWidth=180&odnBg=ffffff,"Dinosaur Planet Kids Sand Water Table for Toddlers, 3-Tier Sand and Water Play Table Toys for Toddlers Kids, Activity Sensory Tables Outside Beach Toys for Toddler Boys Girls Age 1-3 3-5 Gift"
41,outdoor_toys,https://i5.walmartimages.com/seo/5-1-Toddler-Slide-Swing-Set-Kids-Playground-Climber-Playset-Basketball-Hoop-Freestanding-Combination-Indoor-Outdoor-Toys-Babies-Teens-Pink_e76c5cad-24df-4757-a288-524de875ab71.02375db9b5cb433af433899c86b834d8.jpeg?odnHeight=180&odnWidth=180&odnBg=fffff,"5 in 1 Toddler Slide and Swing Set, Kids Playground Climber Slide Playset with Basketball Hoop Freestanding Combination, Indoor & Outdoor Toys for Babies Kids Teens, Pink"
42,outdoor_toys,https://i5.walmartimages.com/asr/5fa01365-95e8-4748-a637-e99d6ff88583.396369ce93619ff3c309ea9c670b0c23.jpeg?odnHeight=180&odnWidth=180&odnBg=ffffff,"Bluescape Blue 10 ft Family Inflatable Swimming Pool, Round, Age 6 & up, Unisex"
43,outdoor_toys,https://i5.walmartimages.com/asr/3ddc876f-8aa5-4e44-9b9b-6f5a469bce83.a484aab638d6ebd6bc29091bb3d27e39.jpeg?odnHeight=180&odnWidth=180&odnBg=ffffff,"Play Day Mini Sports Balls, 4-Pack, Rubber Baseball, Basketball, Football, and Soccer Ball, Ages 3+"
44,outdoor_toys,https://i5.walmartimages.com/asr/f5657db8-44ef-4584-98de-bd98d3e8ad4f.e61daf5ef5df0e92430d55448af9dd6a.jpeg?odnHeight=180&odnWidth=180&odnBg=ffffff,"Play Day Bubble Stick, Blue, 5 fl oz, for Child Age 3+"
45,outdoor_toys,https://i5.walmartimages.com/asr/d5a190f2-1c2e-4365-aa3e-13631ce2d990.fac64292c8a868cb61ececfb6a45c587.jpeg?odnHeight=180&odnWidth=180&odnBg=ffffff,Play Day  Glider Plane  Highly Durable  15 Inch Wingspan
46,outdoor_toys,https://i5.walmartimages.com/asr/c3c09854-82e0-4318-8bac-b58a79c427f7.d411fab755e949e3c41cb8b8f21efa81.jpeg?odnHeight=180&odnWidth=180&odnBg=ffffff,"Play Day Bubble Blast Solution, 32 fl oz Bottle, Orange"
47,outdoor_toys,https://i5.walmartimages.com/asr/d495151f-553f-4a53-b5a7-64142326883a.687dc606a78ac9239f8b6d1d38a45cbd.jpeg?odnHeight=180&odnWidth=180&odnBg=ffffff,"Play Day Bubble Spinning Pinwheel Wand, Plastic, Indoors & Outdoor Use - Unisex, Kids Ages 3+"
48,outdoor_toys,https://i5.walmartimages.com/asr/13125da7-d4fb-4952-a65b-f0d36ed34036.68c26167211864bfa118941b152b62fa.jpeg?odnHeight=180&odnWidth=180&odnBg=ffffff,Way To Celebrate Bunny Pink Bubble Machine. Ages 3 and up.
49,outdoor_toys,https://i5.walmartimages.com/asr/3ddc876f-8aa5-4e44-9b9b-6f5a469bce83.a484aab638d6ebd6bc29091bb3d27e39.jpeg?odnHeight=180&odnWidth=180&odnBg=ffffff,"Play Day Mini Sports Balls, 4-Pack, Rubber Baseball, Basketball, Football, and Soccer Ball, Ages 3+"
50,outdoor_toys,https://i5.walmartimages.com/asr/f5657db8-44ef-4584-98de-bd98d3e8ad4f.e61daf5ef5df0e92430d55448af9dd6a.jpeg?odnHeight=180&odnWidth=180&odnBg=ffffff,"Play Day Bubble Stick, Blue, 5 fl oz, for Child Age 3+"
51,outdoor_toys,https://i5.walmartimages.com/asr/51269322-a518-42dc-9395-0f57b27f8b8b.34aff60a05cadd8b81655813b58b6f34.jpeg?odnHeight=180&odnWidth=180&odnBg=ffffff,"Play Day Jar of Fun, Total 30 Piece, Kids Games, Physical Activities, for Child Ages 3+"
52,outdoor_toys,https://i5.walmartimages.com/asr/c7415f2e-2c36-4b73-b11e-561e1d11457a.4c4e40888b2d5682279afeeb16d4a54e.jpeg?odnHeight=180&odnWidth=180&odnBg=ffffff,"Disney Minnie Mouse Plastic Indoor,Outdoor Playhouse with Easy Assembly"
53,outdoor_toys,https://i5.walmartimages.com/asr/2b62f719-4897-4c2b-a026-cf111f8841ec.37df201080ef09360a470bfe2765592f.png?odnHeight=180&odnWidth=180&odnBg=ffffff,"Buncha' Bubbles Blaster - Blue, for Child Ages 3+"
54,outdoor_toys,https://i5.walmartimages.com/asr/d4bcd9bd-02bc-4a4c-ab8b-1e0e4405cbf4.0d79819a1d82c25e083c52856d64fa26.jpeg?odnHeight=180&odnWidth=180&odnBg=ffffff,"Play Day Bubble Jet, Includes 4oz Bubble Solution - Unisex, Children Ages 3+"
55,outdoor_toys,https://i5.walmartimages.com/seo/Little-Tikes-TotSports-Kids-T-Ball-Set-with-Bat-and-2-Balls-Ages-18-Months-to-4-Years_01f044eb-f831-4bdc-835f-7b29a7db6915_1.5393aba204d3f410e5c398df1174378c.jpeg?odnHeight=180&odnWidth=180&odnBg=fffff,"Little Tikes TotSports Kids T-Ball Set with Bat and 2 Balls, Ages 18 Months to 4 Years"
56,outdoor_toys,https://i5.walmartimages.com/seo/Syncfun-Bubble-Lawn-Mower-Machine-Summer-Outdoor-Games-Toys-Kids-Toddler-3-6-Years-Old-Maker-Push-Toy-Boys-Girls-Birthday-Gifts-Pink_d193111c-9c24-4eff-98bf-1016cf59be21.b6a962b5b4d00e5f29b5c97bc54ae66e.jpeg?odnHeight=180&odnWidth=180&odnBg=fffff,"Syncfun Bubble Lawn Mower, Bubble Machine Summer Outdoor Games Toys for Kids Toddler 3-6 Years Old, Bubble Maker Push Toy Boys Girls Birthday Gifts - Pink"
57,outdoor_toys,https://i5.walmartimages.com/asr/e1cf9d40-ad45-49b5-bae6-a5c0fbee1c48.2e336668d9903d5eaff5acaffa793adb.jpeg?odnHeight=180&odnWidth=180&odnBg=ffffff,"Nerf Super Soaker Minecraft Trident Water Blaster, Pull Back Plunger Handle, Outdoor Kids Water Toy for Boys and Girls Ages 6 7 8 9 10 and Up, Only At Walmart"
58,outdoor_toys,https://i5.walmartimages.com/seo/Meromore-68-Splash-Pad-for-Kids-and-Adults-Outdoor-Lawn-Games-Water-Play-Toy-Mat-Blue_d8335f69-6ac0-4e52-9386-643c8835d802.c461f17165ccb8413e107c5be3b19ebb.jpeg?odnHeight=180&odnWidth=180&odnBg=fffff,"Meromore 68"" Splash Pad for Kids and Adults Outdoor Lawn Games Water Play Toy Mat, Blue"
59,outdoor_toys,https://i5.walmartimages.com/seo/Little-Tikes-Cape-Cottage-House-Pink-Pretend-Playhouse-for-Girls-Boys-Kids-2-8-Years-Old_4806e75c-7451-4c62-9844-ad1d805eaff7.ff5998e8f9bd3befa4b65d495eafe8a5.jpeg?odnHeight=180&odnWidth=180&odnBg=fffff,"Little Tikes Cape Cottage House, Pink - Pretend Playhouse for Girls Boys Kids 2-8 Years Old"
60,outdoor_toys,https://i5.walmartimages.com/asr/0fb8ff02-aa43-4309-b421-630ce9a145d5.668f943da3e6751b9e2ad8ce8cfccfc7.jpeg?odnHeight=180&odnWidth=180&odnBg=ffffff,TP Toys Explorer.  Jungle Gym Outdoor Playset with Sandbox and Platform Tent.  Black Edition.  Ages 3-6
61,outdoor_toys,https://i5.walmartimages.com/seo/Costway-4-in-A-Row-Giant-Game-Set-w-Basketball-Hoop-for-Family-Orange_14c70222-adf6-4b9d-b5fd-516dec39c346.b71db37edefca60108acb4b63fc74e36.jpeg?odnHeight=180&odnWidth=180&odnBg=fffff,Costway 4-in-A Row Giant Game Set w/Basketball Hoop for Family Orange
62,outdoor_toys,https://i5.walmartimages.com/asr/ea3a3587-fe69-4c4a-b402-d73d41f99a39.c17844b895c580a84460cf053d613c8a.jpeg?odnHeight=180&odnWidth=180&odnBg=ffffff,"Play Day Light Up Bubble Blaster, Green, Children Ages 3+"
63,outdoor_toys,https://i5.walmartimages.com/seo/Kinetic-Sand-Mini-Sand-Pail_75a0baab-187b-4bbd-826d-ad91e64ec7d4.267ea98a2d155c0fb2693f328be409b3.jpeg?odnHeight=180&odnWidth=180&odnBg=fffff,Kinetic Sand Mini Sand Pail
64,outdoor_toys,https://i5.walmartimages.com/seo/Syncfun-Bubble-Lawn-Mower-Machine-Summer-Outdoor-Games-Toys-Kids-Toddler-3-6-Years-Old-Maker-Push-Toy-Boys-Girls-Birthday-Gifts-Blue_385e39cb-e86d-4cda-aa67-0dab82e7bc94.4f285072a3b482ab23b178ffd2cbdda3.jpeg?odnHeight=180&odnWidth=180&odnBg=fffff,"Syncfun Bubble Lawn Mower, Bubble Machine Summer Outdoor Games Toys for Kids Toddler 3-6 Years Old, Bubble Maker Push Toy Boys Girls Birthday Gifts - Blue"
65,outdoor_toys,https://i5.walmartimages.com/seo/Hot-Bee-Hover-Soccer-Hockey-Ball-Set-2-in-1-LED-Rechargeable-Soccer-with-2-Goals-Indoor-Outdoor-Games-Toys-for-Kids-Boys-Girls-Ages-3_b12c617d-02a1-4049-bb1e-695dac53e58d.46df1f692958e855b164b49261db0026.jpeg?odnHeight=180&odnWidth=180&odnBg=fffff,"Hot Bee Hover Soccer Hockey Ball Set, 2 in 1 LED Rechargeable Soccer with 2 Goals Indoor/Outdoor Games Toys for Kids Boys Girls Ages 3+"
66,outdoor_toys,https://i5.walmartimages.com/seo/Best-Choice-Products-Kids-3-in-1-Outdoor-Convertible-Wood-Activity-Sand-Water-Picnic-Table-w-Umbrella-Green_6ae6ad47-f57f-409c-af45-6bdd6a857f8e.6d7c9964e91f8aa3ea69bf097f566352.jpeg?odnHeight=180&odnWidth=180&odnBg=fffff,Best Choice Products Kids 3-in-1 Outdoor Convertible Wood Activity Sand & Water Picnic Table w/ Umbrella - Green
67,outdoor_toys,https://i5.walmartimages.com/asr/ac0dc0e8-c735-412a-a1ba-12832f2ec81e.c5766857d9e29dd2ccc16fffaf826159.jpeg?odnHeight=180&odnWidth=180&odnBg=ffffff,"Play Day Jumbo Racket Sports Game, 5 Piece Set, Red, Children Ages 4+"
68,outdoor_toys,https://i5.walmartimages.com/asr/a25bac1f-93a0-421f-a157-11a0362fd8be.7075e3c2d44a27df8cce3ca9c8db75c1.jpeg?odnHeight=180&odnWidth=180&odnBg=ffffff,"Banzai Surf N' Splash Water Park, Length: 14 ft 5 in, Width: 10 ft 7 in, Height: 7 ft 11 in, Inflatable Outdoor Backyard Water Slide Splash Toy"
69,outdoor_toys,https://i5.walmartimages.com/asr/8a6b6851-15d3-43d1-9abd-7f15e9b10cc7.73c6fe060ebc22f2fea8dfcb9c4a3297.jpeg?odnHeight=180&odnWidth=180&odnBg=ffffff,"Play Day 3 Ring Shark Pool, Blue"
70,outdoor_toys,https://i5.walmartimages.com/asr/3381c969-d0b0-4b7b-9df5-8ba3376a5caa.ab02e382deb6cc085ef2d7050ccfde65.jpeg?odnHeight=180&odnWidth=180&odnBg=ffffff,"Hover Soccer, LED, Kids Sports, Ages 3+ by MinnARK"
71,outdoor_toys,https://i5.walmartimages.com/asr/15dfd686-a1a5-4476-a94b-02133d55717e.62309ac8607698f9d2a8e03bcce2e723.jpeg?odnHeight=180&odnWidth=180&odnBg=ffffff,"Toddlers Water Table Waterfall Maze-like Wall - Double-Sided Water Sand Table for Kids, 32 PCS Outdoor Toys for Toddlers Age 3-8, Activity Sensory Table Summer Toys for Boys Girls Ages 4-8"
72,outdoor_toys,https://i5.walmartimages.com/asr/df8948b5-0333-4dda-8d9e-87ddf59fe84a.7c068e5baef35707b2800a228f7c05c9.jpeg?odnHeight=180&odnWidth=180&odnBg=ffffff,"Bluescape Rainbow Unicorn Play Center, Kids Splash Pool with Sprinkler, Toys & Slide, Age 2 & up, Unisex"
73,outdoor_toys,https://i5.walmartimages.com/asr/06a19326-da1b-4b53-bdd7-4ab4887f2c3e.531939c4653dc57e86013013a4657f43.jpeg?odnHeight=180&odnWidth=180&odnBg=ffffff,"Little Tikes Adventure Rocket Space Astronaut for Kids, Boys, Girls, 2-6 Years Old"
74,outdoor_toys,https://i5.walmartimages.com/asr/91e51a8d-f272-4e98-b61c-241e7bf8ce55.f0631782725801813771a46231a8fbe3.jpeg?odnHeight=180&odnWidth=180&odnBg=ffffff,"Stomp Rocket Original Ultra Rocket Launcher for Kids, Soars 200 Ft, 3 Rockets and Adjustable Launcher, Gift for Boys and Girls Ages 5 and up"
75,outdoor_toys,https://i5.walmartimages.com/seo/Step2-Neat-Tidy-Cottage-II-Brown-Playhouse-Plastic-Kids-Outdoor-Toy_50101a55-c1ea-41f7-812e-297dbb282d69.9b085155c03fe6cae7e9613966543332.jpeg?odnHeight=180&odnWidth=180&odnBg=fffff,Step2 Neat & Tidy Cottage II Brown Playhouse Plastic Kids Outdoor Toy
76,outdoor_toys,https://i5.walmartimages.com/seo/Toddlers-Water-Table-Waterfall-Maze-like-Wall-Double-Sided-Sand-Kids-32-PCS-Outdoor-Toys-Age-3-8-Activity-Sensory-Summer-Boys-Girls-Ages-4-8_15dfd686-a1a5-4476-a94b-02133d55717e.62309ac8607698f9d2a8e03bcce2e723.jpeg?odnHeight=180&odnWidth=180&odnBg=fffff,"Toddlers Water Table Waterfall Maze-like Wall - Double-Sided Water Sand Table for Kids, 32 PCS Outdoor Toys for Toddlers Age 3-8, Activity Sensory Table Summer Toys for Boys Girls Ages 4-8"
77,outdoor_toys,https://i5.walmartimages.com/asr/6e9d7dc2-7cbc-4c49-84ad-4ec15670bb44.5fcd10bdf8fa351485574d4826bb442f.jpeg?odnHeight=180&odnWidth=180&odnBg=ffffff,Bubble Gun Bubble Maker Electric Large Bubble Blaster Bubble Machine Toys for Boys Girls 3-6-12 Years
78,outdoor_toys,https://i5.walmartimages.com/seo/Step2-Neat-Tidy-Cottage-II-Brown-Playhouse-Plastic-Kids-Outdoor-Toy_50101a55-c1ea-41f7-812e-297dbb282d69.9b085155c03fe6cae7e9613966543332.jpeg?odnHeight=180&odnWidth=180&odnBg=fffff,Step2 Neat & Tidy Cottage II Brown Playhouse Plastic Kids Outdoor Toy
79,outdoor_toys,https://i5.walmartimages.com/asr/ab7c453f-c6d0-423f-8704-42ec03ab1e4a.53e6108f03dafa265e82d618c0c78c47.jpeg?odnHeight=180&odnWidth=180&odnBg=ffffff,"EastPoint Sports 3-in-1 Tailgate Game Set - Cornhole, Ladderball, Washer Toss"
80,outdoor_toys,https://i5.walmartimages.com/seo/Giant-Inflatable-Tank-Toys-Ride-On-Pool-Float-Kids-Adults-1-Pack-Blow-Up-Floating-Lounger-Functional-Pump-Action-Water-Cannon-Ages-5_f1fd5fd7-9135-4e11-af33-de0ac6777734.ff39e2e715cdf3ecc57f99259be2b227.jpeg?odnHeight=180&odnWidth=180&odnBg=fffff,"Giant Inflatable Tank Toys Ride On Pool Float for Kids & Adults (1 Pack), Blow Up Tank Pool Floating Inflatable Lounger with Functional Pump-Action Water Cannon for Ages 5+"
81,outdoor_toys,https://i5.walmartimages.com/seo/Little-Tikes-Cape-Cottage-Playhouse-with-Working-Door-Windows-and-Shutters-Tan_5690b53d-4cb7-4e4c-adc4-3f8e3d362037.4fdf9c29f24f9fc8906033199108492d.jpeg?odnHeight=180&odnWidth=180&odnBg=fffff,"Little Tikes Cape Cottage Playhouse with Working Door, Windows, and Shutters - Tan"
82,outdoor_toys,https://i5.walmartimages.com/seo/Little-Tikes-Cape-Cottage-Pretend-Playhouse-for-Kids-Indoor-Outdoor-with-Working-Door-and-Windows-for-Toddlers-Ages-2-Years-Blue_124e9ff0-9131-4b2d-be2b-191f8fe56f90.44cf65e71dd62429667ac359d72eb0de.jpeg?odnHeight=180&odnWidth=180&odnBg=fffff,"Little Tikes Cape Cottage Pretend Playhouse for Kids, Indoor Outdoor, with Working Door and Windows, for Toddlers Ages 2+ Years, Blue"
83,outdoor_toys,https://i5.walmartimages.com/asr/bee11b6e-294a-44fc-8049-78fb014cbe77.5b63d19ec54d838be4e4bacdc7693d62.jpeg?odnHeight=180&odnWidth=180&odnBg=ffffff,Step2 Waterpark Wonders Two-Tier Blue Plastic Outdoor Toy and Water Table for Toddler with Umbrella
84,outdoor_toys,https://i5.walmartimages.com/seo/WisToyz-Bubble-Machine-Blower-500-Bubbles-Per-Minute-Automatic-Maker-Outdoor-Toys-Toddlers-Kids-Boys-Girls-Bath-Toys-Machine-Birthday-Wedding-Party_f2d1d1a7-6b7d-4832-80d4-b13508fda5fd.ccabd67588f05e63c9389fc16fc6adce.jpeg?odnHeight=180&odnWidth=180&odnBg=fffff,"WisToyz Bubble Machine, Bubble Blower 500+ Bubbles Per Minute, Automatic Bubble Maker, Outdoor Toys for Toddlers Kids Boys Girls, Kids Bubble Bath Toys, Bubble Machine Toys for Birthday Wedding Party"
