,category,image_url,title
669,outdoor_toys,https://i5.walmartimages.com/seo/Syncfun-Diving-Gems-Pool-Toys-16-Big-Colorful-Diamonds-with-Pirate-Treasure-Chest-Little-Mermaid-Swim-Dive-Diving-Toy-for-Kids-Toddlers_32af86e4-3a0e-4b19-b945-85757ed3e670.01afb2b4ed9881721d3684571857b78f.jpeg?odnHeight=180&odnWidth=180&odnBg=fffff,"Syncfun Diving Gems Pool Toys, 16 Big Colorful Diamonds with Pirate Treasure Chest, Little Mermaid Swim Dive Diving Toy for Kids Toddlers"
670,outdoor_toys,https://i5.walmartimages.com/asr/f154de01-9015-4047-853d-0802dae4d38b.227ba841b002c563f213daa4cbbeeced.jpeg?odnHeight=180&odnWidth=180&odnBg=ffffff,"Fofana Ninja Warrior Obstacle Course for Kids  32-Piece Backyard Playset for Ages 6+ - 9 Obstacles, 65 ft Slackline"
671,outdoor_toys,https://i5.walmartimages.com/seo/Hot-Bee-Hover-Soccer-Hockey-Ball-Set-2-in-1-LED-Rechargeable-Soccer-with-2-Goals-Indoor-Outdoor-Games-Toys-for-Kids-Boys-Girls-Ages-3_b12c617d-02a1-4049-bb1e-695dac53e58d.46df1f692958e855b164b49261db0026.jpeg?odnHeight=180&odnWidth=180&odnBg=fffff,"Hot Bee Hover Soccer Hockey Ball Set, 2 in 1 LED Rechargeable Soccer with 2 Goals Indoor/Outdoor Games Toys for Kids Boys Girls Ages 3+"
672,outdoor_toys,https://i5.walmartimages.com/seo/Best-Choice-Products-Kids-3-in-1-Outdoor-Convertible-Wood-Activity-Sand-Water-Picnic-Table-w-Umbrella-Green_6ae6ad47-f57f-409c-af45-6bdd6a857f8e.6d7c9964e91f8aa3ea69bf097f566352.jpeg?odnHeight=180&odnWidth=180&odnBg=fffff,Best Choice Products Kids 3-in-1 Outdoor Convertible Wood Activity Sand & Water Picnic Table w/ Umbrella - Green
673,outdoor_toys,https://i5.walmartimages.com/asr/601c4149-db6b-4777-acdd-31353cedb278.d380b23c61dd3058c978ee909c380839.jpeg?odnHeight=180&odnWidth=180&odnBg=ffffff,"Aqua 4-in-1 Deluxe Monterey Hammock Pool Float for Adults, Orange/Teal Stripe"
674,outdoor_toys,https://i5.walmartimages.com/seo/Nerf-Minecraft-Stormlander-Dart-Blasting-Hammer-Fires-3-Darts-Includes-3-Nerf-Elite-Darts-Pull-Back-Priming-Handle_1d2dcfbf-e26e-4e37-a35a-1e5eea3eef46.87b29c26d9dfa227f4726eaffb1f9b66.jpeg?odnHeight=180&odnWidth=180&odnBg=fffff,"Nerf Minecraft Stormlander Dart-Blasting Hammer, Fires 3 Darts, Includes 3 Nerf Elite Darts, Pull-Back Priming Handle"
675,outdoor_toys,https://i5.walmartimages.com/asr/b7880dc9-e011-4b9a-91ac-f499db8a9d2e.e7f738c10b01c71e2c7c15c4d77267b8.jpeg?odnHeight=180&odnWidth=180&odnBg=ffffff,GIANT Inflatable Float Rubber Ducky Duck ~ Birthday Pool Toy Party Outdoor Fun
676,outdoor_toys,https://i5.walmartimages.com/asr/860d7173-46f3-4763-9d2c-14fbb1bbe321.b2b387d95fc05296ed009c423e43a997.jpeg?odnHeight=180&odnWidth=180&odnBg=ffffff,"Banzai Home Run Splash Baseball Slide Kids 14 feet x 14 feet Backyard Summer Fun, Ages 5+"
677,outdoor_toys,https://i5.walmartimages.com/asr/37b5c929-7033-479e-a17e-a59ab4111b6e.b0cb276d0e17e589c18dccf2fe369628.jpeg?odnHeight=180&odnWidth=180&odnBg=ffffff,"HopeRock Bubble Machine for Kids, Gifts for Kids Girls Boys Toddlers 3 4 5 6 7+ Years, LED Light Indoor/Outdoor Bubble Maker for Party Birthday Gifts."
678,outdoor_toys,https://i5.walmartimages.com/seo/Move2Play-Hilariously-Interactive-Toy-Basketball-Music-Sound-Effects-Ball-Toddlers-Birthday-Gift-Boys-Girls-1-2-3-Years-Old_62d5b9c4-de8a-40f9-a2f1-158c501c9a1f.3be5ac5f4d231ed3e61c81675b8c4f7a.jpeg?odnHeight=180&odnWidth=180&odnBg=fffff,"Move2Play, Hilariously Interactive Toy Basketball with Music and Sound Effects, Ball for Toddlers, Birthday Gift for Boys and Girls 1, 2, 3+ Years Old"
679,outdoor_toys,https://i5.walmartimages.com/asr/a99fd2d2-d829-4bcf-badc-731dca3dbcba.1faaa5f16d3a2393c4899efb9988bb9e.jpeg?odnHeight=180&odnWidth=180&odnBg=ffffff,"JOYMOR 8-in-1 Inflatable Water Slide Park w/ Splash & Deep Pool, , Climbing Wall, Giant Blow up Bounce House for Kids Backyard Party Age 3-12 (Included 750w Blower), Plastic, Child"
680,outdoor_toys,https://i5.walmartimages.com/seo/Sand-Water-Table-Toddles-Outdoor-Play-Toys-Toddlers-Kids-Activity-Tables-Beach-Outside-Backyard-Age-3-5_6280c62d-16a2-4677-8545-366525dc6297.9e10fc2b41560aadc343d9766646fc47.jpeg?odnHeight=180&odnWidth=180&odnBg=fffff,"Sand Water Table for Toddles, Outdoor Sand and Water Play Table Toys for Toddlers Kids, Water Activity Tables Beach Toys for Outside Backyard for Toddlers Age 3-5"
681,outdoor_toys,https://i5.walmartimages.com/seo/Step2-Neat-Tidy-Cottage-II-Brown-Playhouse-Plastic-Kids-Outdoor-Toy_50101a55-c1ea-41f7-812e-297dbb282d69.9b085155c03fe6cae7e9613966543332.jpeg?odnHeight=180&odnWidth=180&odnBg=fffff,Step2 Neat & Tidy Cottage II Brown Playhouse Plastic Kids Outdoor Toy
682,outdoor_toys,https://i5.walmartimages.com/seo/Toddlers-Water-Table-Waterfall-Maze-like-Wall-Double-Sided-Sand-Kids-32-PCS-Outdoor-Toys-Age-3-8-Activity-Sensory-Summer-Boys-Girls-Ages-4-8_15dfd686-a1a5-4476-a94b-02133d55717e.62309ac8607698f9d2a8e03bcce2e723.jpeg?odnHeight=180&odnWidth=180&odnBg=fffff,"Toddlers Water Table Waterfall Maze-like Wall - Double-Sided Water Sand Table for Kids, 32 PCS Outdoor Toys for Toddlers Age 3-8, Activity Sensory Table Summer Toys for Boys Girls Ages 4-8"
683,outdoor_toys,https://i5.walmartimages.com/asr/de1f485c-a291-453a-a87d-969fd646ec58.90cb640b6642ea4df56d521d62c4d59d.jpeg?odnHeight=180&odnWidth=180&odnBg=ffffff,"Kinetic Sand Shimmer, Mermaid Treasure"
684,outdoor_toys,https://i5.walmartimages.com/asr/239abfdf-3ddb-4d17-a226-4a783fd3f1a6.bab594c964dda82297f5eec71c1c503f.jpeg?odnHeight=180&odnWidth=180&odnBg=ffffff,"Veeboto 6-in-1 Swing Sets, 440lbs Heavy Duty A-Frame Metal Outdoor Swing Set, Adjustable Kids Swing Seat/Ground Stakes for Backyard Playground & Park"
685,outdoor_toys,https://i5.walmartimages.com/asr/740b94a5-b875-4e84-82fb-51d8286e9319.1970bda9af313fe5ffbc080ff88bf351.jpeg?odnHeight=180&odnWidth=180&odnBg=ffffff,"Qaba 3 in 1 Toddler Swing and Slide Set, Kids Slide with Climber, Ultra-Safety, Basketball Hood, Baby Playground Set, Fun Indoor/Outdoor Playset Exercise Toy for Ages 1.5-3"
686,outdoor_toys,https://i5.walmartimages.com/asr/0d65cae0-faf2-4a7e-8821-0e02d3a7fd96.6ab3f6b229f11681dd20dc2287a1d153.jpeg?odnHeight=180&odnWidth=180&odnBg=ffffff,"Melissa & Doug Lemonade Stand Play Tent With Beanbag Game, Easy to Assemble, for Toddlers, Preschoolers, and Kids Ages 3+"
687,outdoor_toys,https://i5.walmartimages.com/asr/14de54e1-349b-458a-bbc3-4a099a6ab5eb.99e37e6510022f2213b1d0560f6c4a41.jpeg?odnHeight=180&odnWidth=180&odnBg=ffffff,"The Grab Football Make One Handed Catches, Game of Catch and Throw Football Toy Adults Leather"
688,outdoor_toys,https://i5.walmartimages.com/asr/a883af5c-cab6-4314-b56b-9436c6ef8640.f33f811044209929cde2013202e1b44d.jpeg?odnHeight=180&odnWidth=180&odnBg=ffffff,"Freecat Dinosaur Outdoor Shooting Target Toys, 2 Pack Dinosaur Toys for 3 4 5 6 Years Old Boys Kids, Kids Dart Board with 18 Sticky Balls, Indoor Outdoor Games Birthday Christmas Toys Gifts for Kids"
689,outdoor_toys,https://i5.walmartimages.com/asr/718b02eb-8ea0-4af5-ab05-21da4cb4505a.431dded1073c275a7e2f297ff829cc4f.jpeg?odnHeight=180&odnWidth=180&odnBg=ffffff,"Lifetime Kid's Outdoor 7 ft. 3 in. H and 7 ft. 9 in. W Metal Climbing Tower, Blue and Lime Green (90994)"
690,outdoor_toys,https://i5.walmartimages.com/asr/efb629a9-835a-4424-8644-2ba11e18bcb1.9f21ed1298221f8b022b6ca68368148c.jpeg?odnHeight=180&odnWidth=180&odnBg=ffffff,"10-Foot Rectangular Inflatable Family Pool, Blue, Ages 6 and Up, Unisex"
691,outdoor_toys,https://i5.walmartimages.com/asr/63c4bb45-625d-407c-83ad-c80ef0e166a9.fc13d1463158ccac5f41aa828445265f.jpeg?odnHeight=180&odnWidth=180&odnBg=ffffff,"ThrillZoo Waterpark Heavy Duty 39ft Trampoline Sprinkler for Kids and Adults, Outdoor Water Game Toys for Kids Games, Play, Exercise, Summer Fun"
692,outdoor_toys,https://i5.walmartimages.com/asr/499592b5-fdca-4bd4-9b98-4e60838308ce.1f8faffbc38a7ebf0673ad282b8ae2d2.jpeg?odnHeight=180&odnWidth=180&odnBg=ffffff,Costway Inflatable Bounce House Kids Slide Jumping Castle Pool with Balls & Bag
693,outdoor_toys,https://i5.walmartimages.com/asr/e60a4c3a-9e8b-4905-9024-b25edbfab129.d7a2bd715a6ff1a704cfac0ed229eb4d.jpeg?odnHeight=180&odnWidth=180&odnBg=ffffff,Play Day Battery Operated Mushroom Bubble Blower Toy
694,outdoor_toys,https://i5.walmartimages.com/asr/6c645a81-0052-4362-9841-59051652b839.ca40f9ee04bdd520746fc6da036e3eb0.jpeg?odnHeight=180&odnWidth=180&odnBg=ffffff,"Victoria Inflatable Ring Toss Pool Game, Floating Pool Toy with 4 Pcs Rings for Party Games, Pool Beach Toys"
695,outdoor_toys,https://i5.walmartimages.com/seo/SKD-Blaster-Gel-Ball-20000-Beads-High-Speed-Powerful-Automatic-Splatter-LED-100FT-Range-15R-S-150-FPS-Water-Bead-Electric-Toys-Summer-Outdoor-Gifts_aa64535e-6ae8-41eb-adcb-3bdaf0f37d85.994f9856f69694ab7bff4cfa81ac9417.jpeg?odnHeight=180&odnWidth=180&odnBg=fffff,SKD Blaster Gel Ball Blaster with 20000 Beads High Speed Powerful Automatic Splatter with LED 100FT Range 15R/S 150+ FPS Water Bead Electric Toys Summer Outdoor Gifts
696,outdoor_toys,https://i5.walmartimages.com/asr/6bf05689-2e91-48e5-8f27-a6f0b5a87832.b1572685e6b933609d84f158a357aca5.jpeg?odnHeight=180&odnWidth=180&odnBg=ffffff,Little Tikes Jr. Jump 'n Slide Bouncer - Inflatable Jumper Bounce House
697,outdoor_toys,https://i5.walmartimages.com/asr/cb352036-2566-4bb1-9462-9bfc33e2bfe3.f1ea1720c574bc46d661a4674c8cfa4b.jpeg?odnHeight=180&odnWidth=180&odnBg=ffffff,"Kess Drop Dots Rainbow Swirl Toy Bouncy Ball, 85mm (1 count)"
698,outdoor_toys,https://i5.walmartimages.com/asr/3440546a-37ed-4d77-a471-b1d5ce308771.1ccc9ea3e2c8fdef6fa5fa705d87bf0e.jpeg?odnHeight=180&odnWidth=180&odnBg=ffffff,"Qhomic Inflatable Water Slide with Spray Pool, 2 Water Guns, Climbing Wall, Basketball Hoop, and Inflatable Bounce House with UL Air Blower, (Gift for Kids), Polyester, Child, Teen, Toddler"
699,outdoor_toys,https://i5.walmartimages.com/asr/e52964e5-ebac-47bf-a227-e7ac33de449f.4f01f358992f134eba7dba9882c33516.jpeg?odnHeight=180&odnWidth=180&odnBg=ffffff,"Prextex Super Water Shooters, 4 Pack for Kids Summer Toy Water Squirter Water Blaster Gun, Outdoor"
700,outdoor_toys,https://i5.walmartimages.com/seo/HARPPA-2-in-1-Pikler-Triangle-Set-Montessori-Climbing-Toys-for-Toddlers-1-6-Years-Natural-Wood_2aa6aacd-1373-4ade-898d-588e95460a79.5a669c0ae74fac578141c3a55abd2f7d.jpeg?odnHeight=180&odnWidth=180&odnBg=fffff,"HARPPA 2 in 1 Pikler Triangle Set, Montessori Climbing Toys for Toddlers 1-6 Years, Natural Wood"
701,outdoor_toys,https://i5.walmartimages.com/seo/Ghostbusters-Mini-Puft-Popper-Blaster-Action-Ghostbusters-Afterlife-Roleplay_f834afbb-9dcb-46ed-8dcd-28f62cafb0f8.6301852d4b608dbc3dd0dbf717f18ed3.jpeg?odnHeight=180&odnWidth=180&odnBg=fffff,Ghostbusters Mini-Puft Popper Blaster Action Ghostbusters: Afterlife Roleplay
702,outdoor_toys,https://i5.walmartimages.com/seo/Gel-Ball-Blaster-Ammo-7-8mm-20-000-Water-Beads-with-Pineapple-Bottle-for-Replace-Magazine-for-Age_c84da0b0-3cc0-491f-b01e-681864c871b4.91084ebc7e16d8464279ec87a7d82b9b.png?odnHeight=180&odnWidth=180&odnBg=fffff,"Gel Ball Blaster Ammo (7-8mm 20,000 Water Beads) with Pineapple Bottle  for Replace Magazine for Age"
703,outdoor_toys,https://i5.walmartimages.com/asr/70ec1e59-c381-44fc-b319-6079b87a84f5.135562774c3f183ef8cc553533dc80b9.png?odnHeight=180&odnWidth=180&odnBg=ffffff,X-Shot Insanity Manic Plastic Dart Blaster
704,outdoor_toys,https://i5.walmartimages.com/asr/5af67e1d-3ffb-42b8-a20c-e301687dedbe.47a1286d3600e112c88212481e6482dc.jpeg?odnHeight=180&odnWidth=180&odnBg=ffffff,"Big Papi's Signature 25"" Tball Bat with -11 Drop, 9"" Glove, and TBall Bundle"
705,outdoor_toys,https://i5.walmartimages.com/asr/2b9e7eb5-448c-4ee3-8d48-0c9519212573.a675c606c04f591278846152558b86af.jpeg?odnHeight=180&odnWidth=180&odnBg=ffffff,"Nerf Fortnite BASR-L Blaster, Includes 12 Official Darts, Kids Toy for Boys and Girls for Ages 8+"
706,outdoor_toys,https://i5.walmartimages.com/seo/Gazillion-Bubbles-Tornado_f5ee5406-2778-4b96-852a-03867361d2c3.83a1be19b0ba7b66214a7355a9102ba7.jpeg?odnHeight=180&odnWidth=180&odnBg=fffff,Gazillion Bubbles Tornado
707,outdoor_toys,https://i5.walmartimages.com/seo/Little-Tikes-TotSports-Kids-T-Ball-Set-with-Bat-and-2-Balls-Ages-18-Months-to-4-Years_01f044eb-f831-4bdc-835f-7b29a7db6915_1.5393aba204d3f410e5c398df1174378c.jpeg?odnHeight=180&odnWidth=180&odnBg=fffff,"Little Tikes TotSports Kids T-Ball Set with Bat and 2 Balls, Ages 18 Months to 4 Years"
708,outdoor_toys,https://i5.walmartimages.com/asr/3737ed2c-acb9-46fa-89ad-c7681cff0540.c67981e600b83240c2490c74f6bf5cef.jpeg?odnHeight=180&odnWidth=180&odnBg=ffffff,Step2 Ball Buddies Adventure Center Blue Plastic Water Table for Toddlers
709,outdoor_toys,https://i5.walmartimages.com/asr/fd494c6a-55ed-4d8e-9fe5-50b3a094538d.08119a9332b6f34ce44e93694c06f783.jpeg?odnHeight=180&odnWidth=180&odnBg=ffffff,"Bubble Gun with 3 Pack Bubble Liquid, Bubble Machine with Colorful Lights for Toddlers with 360-Degree Leak-Proof Design, Automatic Bubble Guns for Kids, Party Favors, Birthday Gift"
710,outdoor_toys,https://i5.walmartimages.com/asr/e7778ef5-3b73-4da9-b8e7-21e28003e8f4.848c95844610a50a971ea139743b8169.png?odnHeight=180&odnWidth=180&odnBg=ffffff,Platports 10ft Kids Slide for Backyard Indoor Slide Playground Outdoor Toys
711,outdoor_toys,https://i5.walmartimages.com/seo/5-1-Toddler-Slide-Swing-Set-Child-Playground-Climber-Freestanding-Playset-Basketball-Hoop-Play-Combination-Babies-Indoor-Outdoor-Pink_673d72c2-96a5-4a25-8d55-3e89509b5d3a.f938dba8f43fac82f134e366246de0a2.jpeg?odnHeight=180&odnWidth=180&odnBg=fffff,"5 in 1 Toddler Slide and Swing Set, Child Playground Climber Freestanding Slide Playset with Basketball Hoop Play Combination for Babies Indoor and Outdoor, Pink"
712,outdoor_toys,https://i5.walmartimages.com/seo/AOKESI-Bubble-Gun-69-Holes-Bubbles-Rocket-Launcher-Gun-Machine-Colorful-Light-Solution-Kids-Adults-Big-Boom-Maker-Toys-Wedding-Outdoor-Party-Gift_3c71aeff-0ad6-49b2-ba86-6ed35cb6d0b9.e2a8809ab1c33097b35821b34f5ea690.jpeg?odnHeight=180&odnWidth=180&odnBg=fffff,"AOKESI Bubble Gun, 69 Holes Bubbles Rocket Launcher Gun Machine with Colorful Light, Bubble Solution for Kids Adults, Big Rocket Boom Bubble Maker Gun Toys for Wedding Outdoor Party Gift"
713,outdoor_toys,https://i5.walmartimages.com/asr/21e232fe-0697-46e6-9eba-ce64a7c3244b.2fa8e02e505dc52eaac068692956d194.jpeg?odnHeight=180&odnWidth=180&odnBg=ffffff,"Basketball Hoop for Toddlers Kids Baby,5 in 1 Kids Sports Activity Center Adjustable Height - Kids Basketball Hoop,Soccer,Goal Sports Birthday Gifts Toys for Toddler 1 2 3 Indoor Outdoor"
714,outdoor_toys,https://i5.walmartimages.com/asr/ee815874-1c11-45a1-9137-a86da8b22c08.c3a082a92304b64b0d785f9605de4359.jpeg?odnHeight=180&odnWidth=180&odnBg=ffffff,"Beefunni Basketball Hoop for Kids, Outdoor Basketball Toys with Scoreboard, Portable Indoor Play Backyard Games for Boys Girls Age 3-8 Christmas Gifts Toys"
715,outdoor_toys,https://i5.walmartimages.com/asr/1201df08-2567-427d-9fa5-328d27715a36.5cdf9cbddac32114ef28a8dfa10ccead.jpeg?odnHeight=180&odnWidth=180&odnBg=ffffff,"Coleman Power Steel Swim Vista Series II 20' x 10' x 48"" Oval Metal Frame Above Ground Pool Set"
716,outdoor_toys,https://i5.walmartimages.com/seo/Syncfun-Bubble-Lawn-Mower-Machine-Summer-Outdoor-Games-Toys-Kids-Toddler-3-6-Years-Old-Maker-Push-Toy-Boys-Girls-Birthday-Gifts-Blue_385e39cb-e86d-4cda-aa67-0dab82e7bc94.4f285072a3b482ab23b178ffd2cbdda3.jpeg?odnHeight=180&odnWidth=180&odnBg=fffff,"Syncfun Bubble Lawn Mower, Bubble Machine Summer Outdoor Games Toys for Kids Toddler 3-6 Years Old, Bubble Maker Push Toy Boys Girls Birthday Gifts - Blue"
717,outdoor_toys,https://i5.walmartimages.com/seo/Best-Choice-Products-Kids-3-in-1-Outdoor-Convertible-Wood-Activity-Sand-Water-Picnic-Table-w-Umbrella-Green_6ae6ad47-f57f-409c-af45-6bdd6a857f8e.6d7c9964e91f8aa3ea69bf097f566352.jpeg?odnHeight=180&odnWidth=180&odnBg=fffff,Best Choice Products Kids 3-in-1 Outdoor Convertible Wood Activity Sand & Water Picnic Table w/ Umbrella - Green
718,outdoor_toys,https://i5.walmartimages.com/asr/c8d41011-ffb9-4ec7-932d-7a48f9c276ff.02c4274bef2053cfd8a132e34bd865c1.png?odnHeight=180&odnWidth=180&odnBg=ffffff,JoyX 2-Pack Blaster Toy Guns with 60 Foam Darts - Ultimate Kids' Battle Pack Christmas Edition
719,outdoor_toys,https://i5.walmartimages.com/asr/1e7a3860-5224-486b-a9ae-286fc5762d17.7c4d6e614660ffd711c6cd13358e380a.jpeg?odnHeight=180&odnWidth=180&odnBg=ffffff,Gymax Outdoor Play house and Slide Set for Kids w/ 7 PCS Toy Set & Waterproof Cover Pink
720,outdoor_toys,https://i5.walmartimages.com/asr/de48d78b-61aa-42b0-90f7-f2738458444f.e5e0892963f6920d36ad6a2d790b94ba.jpeg?odnHeight=180&odnWidth=180&odnBg=ffffff,Baby Swimming Pool Float Boat Inflatable Baby Pool Toys with UPF 50+ Canopy Kids Water Toys Beach Suit for Toddler Light Blue
721,outdoor_toys,https://i5.walmartimages.com/asr/d94c825d-cdeb-4cdf-8e8f-8b1311377ed7.f411a2fef947e01cbf397467d47e42ed.jpeg?odnHeight=180&odnWidth=180&odnBg=ffffff,Costway Floating Island Inflatable Swimming Pool Float Lounge Raft with Canopy SPF50+ Retractable Detachable Sunshade with Two Cup Holders White
722,outdoor_toys,https://i5.walmartimages.com/asr/62996faa-539f-4841-bd87-4b1f42dc3005.3381b94bd2a4f8012507da489e9b71e1.jpeg?odnHeight=180&odnWidth=180&odnBg=fffff,"Growsly 2 Bow and Arrow, Kids Archery Set with LED Flash Lights Includes 14 Suction Cups Arrows and Target, Outdoor Toys Gifts for Age 4 5 6 7 8-12 Year Old Boys Girls, Green and Purple"
723,outdoor_toys,https://i5.walmartimages.com/asr/e0c6b713-6350-4318-96c0-643e0cdae873.78e343f2c27ba7a9987c438b21f9c39d.jpeg?odnHeight=180&odnWidth=180&odnBg=ffffff,"Bestway Power Steel 31'4"" x 16' x 52"" Rectangular Above Ground Pool Set"
724,outdoor_toys,https://i5.walmartimages.com/asr/afc29f78-8c8d-40c3-8d4d-19a2c8330658_1.f544ea33b4a470d5072459a04e50c780.jpeg?odnHeight=180&odnWidth=180&odnBg=ffffff,"Adventure Force Scorpion Rotating Barrel Auto Gatling Dart Blaster, Green - Compatible with NERF Foam Darts"
725,outdoor_toys,https://i5.walmartimages.com/asr/73110267-0e26-4c0c-a80a-4f27cf011eb5.5d8beb0585820478d68b8526864e81c8.jpeg?odnHeight=180&odnWidth=180&odnBg=ffffff,"Play Day Pool Splash Balls 4-Pack Kids Bath Beach Lake Summer Water Fun, Multi-color, Ages 3+"
726,outdoor_toys,https://i5.walmartimages.com/seo/Toddlers-Water-Table-Waterfall-Maze-like-Wall-Double-Sided-Sand-Kids-32-PCS-Outdoor-Toys-Age-3-8-Activity-Sensory-Summer-Boys-Girls-Ages-4-8_15dfd686-a1a5-4476-a94b-02133d55717e.62309ac8607698f9d2a8e03bcce2e723.jpeg?odnHeight=180&odnWidth=180&odnBg=fffff,"Toddlers Water Table Waterfall Maze-like Wall - Double-Sided Water Sand Table for Kids, 32 PCS Outdoor Toys for Toddlers Age 3-8, Activity Sensory Table Summer Toys for Boys Girls Ages 4-8"
727,outdoor_toys,https://i5.walmartimages.com/seo/Little-Tikes-Cape-Cottage-House-Pink-Pretend-Playhouse-for-Girls-Boys-Kids-2-8-Years-Old_4806e75c-7451-4c62-9844-ad1d805eaff7.ff5998e8f9bd3befa4b65d495eafe8a5.jpeg?odnHeight=180&odnWidth=180&odnBg=fffff,"Little Tikes Cape Cottage House, Pink - Pretend Playhouse for Girls Boys Kids 2-8 Years Old"
728,outdoor_toys,https://i5.walmartimages.com/asr/154a8860-f86d-4318-bd06-7ef3cdae2927.8d289338461f1958d975cdba8a292265.png?odnHeight=180&odnWidth=180&odnBg=ffffff,"X-Shot Hyper Gel Pellet Refill Pack (20,000 Hyper Gel Pellets) for Ages 8-99"
729,outdoor_toys,https://i5.walmartimages.com/asr/7c32b306-62a7-4e74-b671-dba639ffb013_1.7eed7994b3bb982cac28fba7e7ffb024.jpeg?odnHeight=180&odnWidth=180&odnBg=ffffff,Spikeball Standard Replacement Balls (2 Pieces)
730,outdoor_toys,https://i5.walmartimages.com/seo/Clearance-Kids-Slide-Indoor-Outdoor-Freestanding-Toddler-Playground-Slipping-Climber-Toy-Playset-Basketball-Hoop-Ball_64dde61a-ec4f-43d8-824b-c6d0ca8e240e.f6e7cae42955d9ec7eb2c0b5a9441cb5.jpeg?odnHeight=180&odnWidth=180&odnBg=fffff,"Clearance! Kids Slide for Indoor and Outdoor, Freestanding Slide for Toddler Playground Slipping Slide Climber Toy Playset with Basketball Hoop & Ball"
731,outdoor_toys,https://i5.walmartimages.com/asr/dceaf27b-0e0b-4cff-b323-82e9bb74909d_1.9b503216ae9a663794f38db47d68f4f0.jpeg?odnHeight=180&odnWidth=180&odnBg=ffffff,Costway Air Blower Pump Fan 735 Watt 1.0HP For Inflatable Bounce House Bouncy Castle
732,outdoor_toys,https://i5.walmartimages.com/asr/1f790c6c-b99b-4c2e-99fa-251bcef61cb4_1.a482e9456b82e0041a057c283dcd928e.jpeg?odnHeight=180&odnWidth=180&odnBg=ffffff,Costway Kids Inflatable Water Slide Park with Climbing Wall Water Cannon and Splash Pool
733,outdoor_toys,https://i5.walmartimages.com/seo/Tcwhniev-Princess-Tent-Girls-Large-Playhouse-Kids-Castle-Play-Star-Lights-Toy-Children-Indoor-Outdoor-Games-51-2-x-39-4-47-2-Pink_79e75cba-6834-48c6-ac67-9c3bfb3fee13.4329854968069203f6044fbc3e13695e.jpeg?odnHeight=180&odnWidth=180&odnBg=fffff,"Tcwhniev Princess Tent Girls Large Playhouse Kids Castle Play Tent with Star Lights Toy for Children Indoor and Outdoor Games, 51.2 x 39.4 x 47.2,Pink"
734,outdoor_toys,https://i5.walmartimages.com/asr/b8ec3d32-e82f-4c99-ad09-f988c9639762.f8b48d312266e3a63a25a99144641dec.jpeg?odnHeight=180&odnWidth=180&odnBg=ffffff,"Nerf Pro Gelfire Dual Wield Pack, 2 Blasters, 5000 Gelfire Rounds, 2x 100 Round Integrated Hoppers, 2 Eyewear"
735,outdoor_toys,https://i5.walmartimages.com/asr/77440844-693d-4be5-8da5-16070f6ea90a.89a6d61de86b7993189f027d78f9987a.jpeg?odnHeight=180&odnWidth=180&odnBg=ffffff,"CIPTON Light up Flying Disc - Solid, Rotary, and Blinking LED Light Frisbee Modes - 9.5 inch"
736,outdoor_toys,https://i5.walmartimages.com/seo/Teepee-Tent-for-Kids-Natural-Cotton-Canvas-Teepee-Play-Tent-White-Pink-Toys-for-Girls-Boys-Indoor-Outdoor-Playing_7984bbf0-0666-42c9-b534-0c8531663e4c.10dcfb4be6d1f85e02cece86b49292ce.jpeg?odnHeight=180&odnWidth=180&odnBg=fffff,"Teepee Tent for Kids, Natural Cotton Canvas Teepee Play Tent White/Pink, Toys for Girls/Boys Indoor & Outdoor Playing"
737,outdoor_toys,https://i5.walmartimages.com/asr/6b6729cd-c035-439d-bfd4-612f88728587.7c12d550d43c0deb21ea16ed2a45fb7f.jpeg?odnHeight=180&odnWidth=180&odnBg=ffffff,"Constructive Playthings Outdoor Lawn Care and Gardening Toys for Kids, Great Outdoor Toys for Kids, Unisex, Green"
738,outdoor_toys,https://i5.walmartimages.com/asr/1ae76c6e-4f66-414c-84db-f8f54937fd04_1.4e8264f646d3717ce9f67536bf8851ea.jpeg?odnHeight=180&odnWidth=180&odnBg=ffffff,"Adventure Force 200 Dart Blaster Refill Pack, Foam"
739,outdoor_toys,https://i5.walmartimages.com/seo/Ant-Class-Bubble-Lawn-Mower-Lawn-Mower-Bubble-Machine-for-Toddlers-Outdoor-Gardening-Push-Toys-with-Lights-Birthday-Toys-Gifts-Pink_00ad52be-6ca5-4b47-96c4-a7fff83c298f.6fb61e8730bb92698aae80f2858981df.jpeg?odnHeight=180&odnWidth=180&odnBg=fffff,"Ant Class Bubble Lawn Mower, Lawn Mower Bubble Machine for Toddlers, Outdoor Gardening Push Toys with Lights, Birthday Toys Gifts, Pink"
740,outdoor_toys,https://i5.walmartimages.com/seo/BATE-7-in-1-Giant-Inflatable-Bounce-House-Kids-Bounce-House-Jumping-Castle-Slide-w-Ball-Pit-with-Blower-for-Kids-Indoor-Outdoor-Party-Family-Fun_10694732-e22f-465c-8008-2b55217527c6.cf98361260fc51288fd13376ae1a837b.jpeg?odnHeight=180&odnWidth=180&odnBg=fffff,BATE  7 in 1 Giant  Inflatable Bounce HouseKids Bounce House Jumping Castle Slide w Ball Pit/with Blower for Kids Indoor Outdoor Party Family Fun
741,outdoor_toys,https://i5.walmartimages.com/asr/2d40b254-1527-40ae-835d-53c523f8b10c.6b6bd55d52ddb9e05527d23daf561e9d.jpeg?odnHeight=180&odnWidth=180&odnBg=ffffff,Kid's Timmy Turtle Swimming Pool Boat for Children LT2719TT
742,outdoor_toys,https://i5.walmartimages.com/seo/HopeRock-Hover-Soccer-Ball-Toys-with-LED-Lights-and-Foam-Bumper-Christmas-Birthday-Gifts-for-3-8-Year-Old-Boys-Girls_f90297e1-4f34-4acf-a733-717fd3d96dd4.eda851fc01865e0f854785225cb99392.jpeg?odnHeight=180&odnWidth=180&odnBg=fffff,"HopeRock Hover Soccer Ball Toys, with LED Lights and Foam Bumper Christmas Birthday Gifts for 3- 8 Year Old Boys Girls"
743,outdoor_toys,https://i5.walmartimages.com/asr/982689b1-18e6-43c7-8aba-dc658c245c78.0872873e74cdc39f91a6d2d5a8f10a42.jpeg?odnHeight=180&odnWidth=180&odnBg=ffffff,Cocomelon 4oz. Bubble Wand. Ages 3 and Up
744,outdoor_toys,https://i5.walmartimages.com/seo/Kids-Outdoor-Toys-YCFUN-Leaf-Blower-Play-Gardening-Toy-for-Kids-Boys-Girls-Preschool-Pretend-Play-for-Kids-Toddlers-Girls-Boys-Red_d81b7905-3cde-46cc-ab2f-0c4f4926b592.43e51bc8c191b324b972b872538d806a.jpeg?odnHeight=180&odnWidth=180&odnBg=fffff,"Kids Outdoor Toys, YCFUN Leaf Blower Play Gardening Toy for Kids Boys Girls, Preschool Pretend Play for Kids Toddlers Girls Boys, Red"
745,outdoor_toys,https://i5.walmartimages.com/asr/d6e2e69d-e453-4936-8a4d-86f7989fdf04.4ed82fbb532b337a76432e6cdf1dafa1.jpeg?odnHeight=180&odnWidth=180&odnBg=ffffff,Scentos Fruity Scented 3 Count 1oz Easter Themed Bottles - Great Easter Basket Stuffer - Age 3+ - Bubble Blowing Toy
746,outdoor_toys,https://i5.walmartimages.com/seo/GPX-Laser-Tag-Set-of-4-Blasters-and-4-Vests_88e3bc42-5947-4efa-b693-6ac1729f6675.5ab74b83ee58426ee1514270609f5862.jpeg?odnHeight=180&odnWidth=180&odnBg=fffff,GPX Laser Tag Set of 4 Blasters and 4 Vests
747,outdoor_toys,https://i5.walmartimages.com/asr/aa18d7a5-f619-490e-ad5c-44aaed22cc37.4686b9c5af95ea9224de3292802d5944.jpeg?odnHeight=180&odnWidth=180&odnBg=ffffff,"Point Games The Boomer Basketball Hoop Game, Indoor or Outdoor Arcade Sport Toy, Easy to Install, Fun and Entertaining for all Ages"
748,outdoor_toys,https://i5.walmartimages.com/asr/28dc4280-711c-4b00-a1a4-a60a5a3e2291.08584dd27bc7c520ff7520821777b8fa.png?odnHeight=180&odnWidth=180&odnBg=ffffff,"Dude Perfect Sticky Tic Tac Toe, Target Toss Game"
749,outdoor_toys,https://i5.walmartimages.com/asr/aaad742e-a232-41b8-a4d4-841b0d22aed2.a4c74f3551d9031135a3b29cba9a5efb.jpeg?odnHeight=180&odnWidth=180&odnBg=ffffff,"US Silica Snow White Comfortable Play Sand for Sand Tables, White, 50lb Bag"
750,outdoor_toys,https://i5.walmartimages.com/asr/ce371805-6f76-450c-bdc9-8861c3ddd988.4785fb3821cd12d24f851b8c3729acca.jpeg?odnHeight=180&odnWidth=180&odnBg=ffffff,"JoyStone 2 in 1 Kids Basketball Hoop, Toddler Basketball Hoop Indoor Mini Adjustable Poolside Basketball Goals with Ball Pump for Boys Girls Outdoor Toys"
