,category,image_url,title
254,outdoor_toys,https://i5.walmartimages.com/asr/a528e9e7-0175-46af-be86-734e957b7c54.5154527a71b2abe90428498632c1cefd.jpeg?odnHeight=180&odnWidth=180&odnBg=ffffff,Pressman Unsolved Case Files: Avery & Zoey Gardner -  - Crime Solving Party Game
255,outdoor_toys,https://i5.walmartimages.com/asr/c85c2330-24f3-4183-b069-3817b4554520.72a77f0e7c7bca42217b9b12bad1a9d0.jpeg?odnHeight=180&odnWidth=180&odnBg=ffffff,Water Toy Plastic Kids outside Toys for Toddlers Beach Plaything Child
256,outdoor_toys,https://i5.walmartimages.com/seo/Fisher-Price-69-x-68-x-53-Bouncesational-Indoor-Bouncer-with-Built-in-Pump_9b01797d-d160-4126-992e-540ede47b10d.7161da1e29bd1d3a30c5cc0a7abdf58a.jpeg?odnHeight=180&odnWidth=180&odnBg=fffff,Fisher Price 69'' x 68'' x 53'' Bouncesational Indoor Bouncer with Built-in Pump
257,outdoor_toys,https://i5.walmartimages.com/seo/Step2-Sweetheart-Pink-Toddler-Playhouse-Plastic-Kids-Outdoor-Toy_2359b3a6-181f-461e-b34f-f0370277f4b8_1.fdd0c3bafa6c3a38f4ded2e8bd2a0a4f.jpeg?odnHeight=180&odnWidth=180&odnBg=fffff,Step2 Sweetheart Pink Toddler Playhouse Plastic Kids Outdoor Toy
258,outdoor_toys,https://i5.walmartimages.com/asr/e5c18291-b46e-4fe3-8150-081875bba419.8012959bba631b90f8c74db343fcd958.jpeg?odnHeight=180&odnWidth=180&odnBg=ffffff,Nerf Super Soaker Storm Ball Sling and Soak by WowWee  High Velocity Band and Soft Launch Cup Slingshot with 2 Water Absorbent Splash-on-Contact Storm Balls
259,outdoor_toys,https://i5.walmartimages.com/asr/6ebe9c38-1446-4921-9561-e60db4493d02.d3d92c5c8c5cd98ee36cc8b7c0899a67.png?odnHeight=180&odnWidth=180&odnBg=ffffff,X-Shot Water Fast-Fill Epic Orange Water Blaster by ZURU
260,outdoor_toys,https://i5.walmartimages.com/seo/Carluck-Bubble-Lawn-Mower-Lawn-Mower-Bubble-Machine-for-Toddlers-Outdoor-Gardening-Push-Toys-Birthday-Gifts-Toys-for-1-2-3-4-5-Years-Old-Boys-Girls_dc045dbb-b1fb-43b8-a720-dddb0b6741a9.8c1b9add2a8d9a5a949d4a823efe3617.jpeg?odnHeight=180&odnWidth=180&odnBg=fffff,"Carluck Bubble Lawn Mower,Lawn Mower Bubble Machine for Toddlers,Outdoor Gardening Push Toys,Birthday Gifts Toys for 1 2 3 4 5 Years Old Boys Girls"
261,outdoor_toys,https://i5.walmartimages.com/asr/d7de80f3-9082-42fd-969e-730dad8df037.7ddf0f3d25cb60fdbb5774bd6d0c556d.jpeg?odnHeight=180&odnWidth=180&odnBg=ffffff,Boomerang Sports Plaything Toy Outdoor Toys for Children Kids Oudoor Gift Boys
262,outdoor_toys,https://i5.walmartimages.com/asr/b5b6c22d-0e85-4b0c-a428-3cd499c42469.a1bc94e93118c7f1c9d0ffe91284657d.jpeg?odnHeight=180&odnWidth=180&odnBg=ffffff,"Nerf Elite 2.0 Eaglepoint RD-8 Blaster -- 8-Dart Drum, Detachable Scope and Barrel, 16 Nerf Darts, Bolt Action"
263,outdoor_toys,https://i5.walmartimages.com/asr/9de18d79-89f4-4921-8f90-da579cd608d9.aa1d57d8a83c9f177bd4a32d82736148.jpeg?odnHeight=180&odnWidth=180&odnBg=ffffff,"Coleman Power Steel 22' x 52"" Round Metal Frame Above Ground Pool Set"
264,outdoor_toys,https://i5.walmartimages.com/asr/17bfbc08-15c8-44e3-b1bd-e438c32faf9e.0b8ea01f1832b1109853614a51c0bb02.jpeg?odnHeight=180&odnWidth=180&odnBg=ffffff,Beach Toys Girl Toys Outdoor Recreation Toy Outdoor Toys for Kids Funny Game Toy Boomerang Outdoor Leisure Major Eva Child
265,outdoor_toys,https://i5.walmartimages.com/asr/5796dd45-98f2-413a-9465-21f39f443957.40063658fc83c4072500f49d36a90b3f.jpeg?odnHeight=180&odnWidth=180&odnBg=ffffff,"Bubble Machine Automatic Bubble Blower for Kids & Toddlers, Bubble Maker Plug-in or Batteries Bubble Toys for Outdoor Birthday Party"
266,outdoor_toys,https://i5.walmartimages.com/asr/66df084b-2f95-4131-ba4c-54a6156a11f4.94d01cca508f9cc2205b8907802b8502.jpeg?odnHeight=180&odnWidth=180&odnBg=ffffff,"Stomp Racers Air Powered Race Cars by Stomp Rocket, Single Racer Pack - Stomp Racers Toy Car Launcher - Fun Backyard & Outdoor Multi-Player Kids Toys Gifts for Boys, Girls & Toddlers"
267,outdoor_toys,https://i5.walmartimages.com/seo/TOBBI-6-in-1-Toddler-Slide-and-Swing-Set-Climber-Slide-for-Kids-age-1-8-Indoor-Outdoor-Playground-Toy-Gift-W-Basketball-Hoop-Football-Gate_58313562-ddcf-4713-aaa2-a070ea47a22e.9d39d4d6cbb56ef5338967d7ba2ac079.jpeg?odnHeight=180&odnWidth=180&odnBg=fffff,TOBBI 6 in 1 Toddler Slide and Swing Set Climber Slide for Kids age 1-8 Indoor Outdoor Playground Toy Gift W/ Basketball Hoop & Football Gate
268,outdoor_toys,https://i5.walmartimages.com/seo/Kinetic-Sand-The-Original-Moldable-Sensory-Play-Sand-Toys-For-Kids-Purple-2-lb-Resealable-Bag-Ages-3_a29a45d1-04b6-4f10-9c9f-d95d3900415d.7b366057ed5f9561c3bcead51ab70a64.jpeg?odnHeight=180&odnWidth=180&odnBg=fffff,"Kinetic Sand, The Original Moldable Sensory Play Sand Toys For Kids, Purple, 2 lb. Resealable Bag, Ages 3+"
269,outdoor_toys,https://i5.walmartimages.com/asr/46ab94f6-17c7-46a0-8a8d-6f905ed435f1.fce9392e387ce3cc6bb2a29a0ba29a25.jpeg?odnHeight=180&odnWidth=180&odnBg=ffffff,"Little Tikes FOAMO Foam Bubble Machine - Outdoor Party Fun for Kids and Adults with Easy Setup & Cleanup, Hours of Continuous Foam Bubble Making Fun, Hypoallergenic and Non-Toxic"
270,outdoor_toys,https://i5.walmartimages.com/asr/47b51763-0520-4f8d-8984-018958191e12.551494d4502027780c679bbaaa93ed03.jpeg?odnHeight=180&odnWidth=180&odnBg=ffffff,Ozark Trail Adult Unisex Multicolor Cooler Float
271,outdoor_toys,https://i5.walmartimages.com/asr/966c9fc2-cfcb-4c0b-af3d-5fdb3f333931.0c1a79c40b14e5f49e7f62edf3c77689.jpeg?odnHeight=180&odnWidth=180&odnBg=ffffff,Bazooka Summer Toys for Kids outside Childrens Rocket Launcher Toddler Plastic
272,outdoor_toys,https://i5.walmartimages.com/seo/JOYIN-Kids-Arcade-Basketball-Game-Set-4-Balls-Hoop-Indoor-Outdoor-Sport-Play-Easy-Up-Air-Pump-Included-Ideal-Games-Competition_bfbe9d43-d2d1-4b07-a537-d719d51fd6a5.59c783d2a28b14298fc527565f5de1ae.jpeg?odnHeight=180&odnWidth=180&odnBg=fffff,JOYIN Kids Arcade Basketball Game Set with 4 Balls and Hoop for Kids Indoor Outdoor Sport Play - Easy Set Up - Air Pump Included - Ideal for Games and Competition
273,outdoor_toys,https://i5.walmartimages.com/seo/DGOO-49FT-Sprinkler-Outdoor-Summer-Toys-For-Kids-Outside_1b714c9b-d9d2-4cc3-b960-2a4c32069022.5988df7471c1554194ebffe1618a4ba3.jpeg?odnHeight=180&odnWidth=180&odnBg=fffff,DGOO 49FT Sprinkler Outdoor Summer Toys For Kids Outside
274,outdoor_toys,https://i5.walmartimages.com/seo/GIKPAL-120-Jungle-Gym-4-in-1-Dome-Climber-Hammock-Swing-Kids-Outdoor-Play-Equipment-Supports-1000lbs-Jungle-Gym-Anti-Rust-Easy-Assembly-Yellow-Green_874a3e20-7bd2-4b05-8d6b-d40664537a13.d4dd84caf829fb8c9a9c8392d5f266bb.jpeg?odnHeight=180&odnWidth=180&odnBg=fffff,"GIKPAL 120""Jungle Gym,4-in-1 Dome Climber with Hammock &Swing for Kids Outdoor Play Equipment, Supports up to 1000lbs Jungle Gym, Anti-Rust, Easy Assembly, Yellow+ Green"
275,outdoor_toys,https://i5.walmartimages.com/seo/DGOO-49FT-Sprinkler-Outdoor-Summer-Toys-For-Kids-Outside_1b714c9b-d9d2-4cc3-b960-2a4c32069022.5988df7471c1554194ebffe1618a4ba3.jpeg?odnHeight=180&odnWidth=180&odnBg=fffff,DGOO 49FT Sprinkler Outdoor Summer Toys For Kids Outside
276,outdoor_toys,https://i5.walmartimages.com/asr/4937429a-dcd6-4daf-969e-0444d864d2a1.94fb6fc377c37590144a5d4b02413bc3.jpeg?odnHeight=180&odnWidth=180&odnBg=ffffff,"KORIMEFA 8 in 1 Kids Slide Set with Climber, Toddler Climber Slide Play Set with Basketball Hoop, Tunnel, Toddler Playground Outdoor Indoor layground Slide Playset Age 1+"
277,outdoor_toys,https://i5.walmartimages.com/asr/0f406d5a-d9d5-4c7d-88e6-df56d8b42a5d_1.9b71406c154ebc447dd03163369b481e.jpeg?odnHeight=180&odnWidth=180&odnBg=ffffff,"Little Tikes Jump 'n Slide 9'x12' Inflatable Bouncer, Inflatable Bounce House with Slide and Blower, Multicolor- Indoor Outdoor Toy for Kids Girls Boys Ages 3 4 5+"
278,outdoor_toys,https://i5.walmartimages.com/seo/JOYIN-22-5ft-Water-Slides-2-Bodyboards-Lawn-Slide-Summer-Slip-Waterslides-Toy-Build-Sprinkler-Backyard-Outdoor-Fun-Kids_af7b1fca-a459-4514-b3c7-3f24129fb519.a84801d8b8a878a1f827f05d548b9180.jpeg?odnHeight=180&odnWidth=180&odnBg=fffff,"JOYIN 22.5ft Water Slides and 2 Bodyboards, Lawn Water Slide Summer Slip Waterslides Water Toy with Build in Sprinkler for Backyard Outdoor Water Fun for Kids"
279,outdoor_toys,https://i5.walmartimages.com/asr/db05a456-6b92-4f6d-a311-89fe50d74acf.1c0735870f3e7817c8e0d3478f80eac7.jpeg?odnHeight=180&odnWidth=180&odnBg=ffffff,Toys Outdoor Bowling outside Toy Outdoor Kids Play Equipment Bowling Toy Travel Child
280,outdoor_toys,https://i5.walmartimages.com/asr/b3edce7c-9edb-4126-a901-dbd940138304.fae68787d425bdf04140cbf311d516a8.jpeg?odnHeight=180&odnWidth=180&odnBg=ffffff,Step2 Naturally Playful Storybook Brown Cottage Playhouse Plastic Kids Outdoor Toy
281,outdoor_toys,https://i5.walmartimages.com/asr/feb7636b-1cc7-4fc3-86a2-40f1f49e2642.ca66ecb148b41a5f73fe8316cbac0af1.jpeg?odnHeight=180&odnWidth=180&odnBg=ffffff,"Kid Odyssey Shooting Game Toy for Kids, Digital Targets with 2 Foam Dart Blaster, Outdoor Game Toys Gifts for 5, 6, 7, 8, 9, 10+ Year Old Boys"
282,outdoor_toys,https://i5.walmartimages.com/seo/Step2-Neat-Tidy-Cottage-II-Brown-Playhouse-Plastic-Kids-Outdoor-Toy_50101a55-c1ea-41f7-812e-297dbb282d69.9b085155c03fe6cae7e9613966543332.jpeg?odnHeight=180&odnWidth=180&odnBg=fffff,Step2 Neat & Tidy Cottage II Brown Playhouse Plastic Kids Outdoor Toy
283,outdoor_toys,https://i5.walmartimages.com/seo/Step2-Charming-Cottage-Brown-Toddler-Plastic-Playhouse-for-Kids-Outdoor-Toys_607a7f20-2391-4943-aa30-6e0683cdf9e6.e9b196b2c6c040aa4c40f5450459e3be.jpeg?odnHeight=180&odnWidth=180&odnBg=fffff,Step2 Charming Cottage Brown Toddler Plastic Playhouse for Kids Outdoor Toys
284,outdoor_toys,https://i5.walmartimages.com/asr/49caeca8-0916-4820-8227-2c275d0c0bf1.8ed1f7a60ffb7849af8763f2ab6c6ede.jpeg?odnHeight=180&odnWidth=180&odnBg=ffffff,"Nerf Pro Grip Classic Foam Football, Easy to Catch and Throw, Indoor Outdoor"
285,outdoor_toys,https://i5.walmartimages.com/asr/51608b01-021e-47b9-97f1-125371128cd9.51dc1918ca84e6da58b8c8020b36cc0a.jpeg?odnHeight=180&odnWidth=180&odnBg=ffffff,"HotBee Bubble Machine, Automatic Bubble Blower with 16000+ Bubbles/Min, Portable Bubble Machine for Kids Toddlers, 360 Rotatable Bubble Maker, Outdoor Toys for Parties, Birthday, Wedding,Christmas"
286,outdoor_toys,https://i5.walmartimages.com/asr/2a491ddc-2689-4f23-9164-f50fa4d81f68.6cdf971b5434687c8af412b80afd3ada.jpeg?odnHeight=180&odnWidth=180&odnBg=ffffff,Coleman Power Steel 18 x 48 Round Metal Frame Above Ground Pool Set
287,outdoor_toys,https://i5.walmartimages.com/asr/d62fa634-5185-4e7c-b292-9c55cf66c7c4.6f485f90700a1742bf52cb3a5ef240b6.jpeg?odnHeight=180&odnWidth=180&odnBg=ffffff,Grow'n up Climb & Slide  Play Gym Outdoor/Indoor Use. Ages 1.5 Years to 4 Years
288,outdoor_toys,https://i5.walmartimages.com/seo/ArtCreativity-Toy-Bubble-Machine-Blowing-Lawn-Mower-Outdoor-Toy-For-Kids-Bubble-Solution-Included_c75352d3-8cdb-4bab-b346-7b6b76419742.fae3aaa628af49a4f5a9879c508f9744.jpeg?odnHeight=180&odnWidth=180&odnBg=fffff,"ArtCreativity Toy Bubble Machine Blowing Lawn Mower Outdoor Toy For Kids, Bubble Solution Included"
289,outdoor_toys,https://i5.walmartimages.com/asr/0d851a95-eaa3-4ab6-bace-4373d43e4b0b.0e6ee3970ec2e195cac6fea2e7e8b453.jpeg?odnHeight=180&odnWidth=180&odnBg=ffffff,"Huge Wave Bubble Blower, 3000+ Bubbles per Minute, Automatic Bubble Machine for Kids' Bubble Toy Fun, Indoor and Outdoor Christmas Party Birthday Wedding Use"
290,outdoor_toys,https://i5.walmartimages.com/asr/55cddd48-b926-41a3-b239-f92ebadc83d1.7bdac53f894b9fbf827b5e727b838bed.jpeg?odnHeight=180&odnWidth=180&odnBg=ffffff,"Play Day LED Archery, Lighted Bow and Arrow for Young Children, Kids Sports, Ages 3+"
291,outdoor_toys,https://i5.walmartimages.com/seo/Zing-Air-Hunterz-Z-Curve-Bow-Precision-Archery-Set-for-Outdoor-Adventures-and-Target-Practice-Multicolor_60794c55-7599-4bef-b251-ac5b6acc5ce9.d3d79930d036fafb975d700e86270354.jpeg?odnHeight=180&odnWidth=180&odnBg=fffff,"Zing Air Hunterz Z-Curve Bow: Precision Archery Set for Outdoor Adventures and Target Practice, Multicolor"
292,outdoor_toys,https://i5.walmartimages.com/seo/Step2-Wonderball-Toddler-Fun-House-Playhouse-Kids-Outdoor-Toys_9096fcf9-8a05-45a4-a7e7-79a130c72aa4.78f0306a461e3c1359d574f4e746f9c8.jpeg?odnHeight=180&odnWidth=180&odnBg=fffff,Step2 Wonderball Toddler Fun House Playhouse Kids Outdoor Toys
293,outdoor_toys,https://i5.walmartimages.com/seo/Little-Tikes-TotSports-Kids-T-Ball-Set-with-Bat-and-2-Balls-Ages-18-Months-to-4-Years_01f044eb-f831-4bdc-835f-7b29a7db6915_1.5393aba204d3f410e5c398df1174378c.jpeg?odnHeight=180&odnWidth=180&odnBg=fffff,"Little Tikes TotSports Kids T-Ball Set with Bat and 2 Balls, Ages 18 Months to 4 Years"
294,outdoor_toys,https://i5.walmartimages.com/asr/4b384d75-b3a1-45b4-97cb-b6299af75c9b.37082522b40d79fc22b286db411a0293.jpeg?odnHeight=180&odnWidth=180&odnBg=ffffff,Best Choice Products Set of 4 Infrared Laser Tag Blaster Set for Kids & Adults w/ Multiplayer Mode
295,outdoor_toys,https://i5.walmartimages.com/asr/cc6433e8-c066-42fa-a177-7ae1fac4de2a.1db703d57732f6d647d72332f0861b0f.jpeg?odnHeight=180&odnWidth=180&odnBg=ffffff,3 in 1 Sports Zone
296,outdoor_toys,https://i5.walmartimages.com/asr/43d85583-6a27-4d03-b00b-d4436a333e30.02ea735df3f7eb93c33660faf207fed3.jpeg?odnHeight=180&odnWidth=180&odnBg=ffffff,"Aqua Noodle Pool Chair, Inflatable Luxury Mesh Float for Teens & Adults, Blue, 200 Lbs. Max Weight"
297,outdoor_toys,https://i5.walmartimages.com/seo/Bubble-Guns-Kids-Space-Machine-Toddlers-Leak-Proof-Design-Blaster-LED-Blower-Party-Favors-Summer-Toy-Outdoors-Activity-Gift-Boys-Girls-Blue_8e90b635-e02e-4a83-b026-d035172bab5a.888a833ea1180004b8b8f445d18a4000.jpeg?odnHeight=180&odnWidth=180&odnBg=fffff,"Bubble Guns for Kids, Space Bubble Machine for Toddlers, Leak Proof Design, Bubble Blaster with LED, Bubble Blower for Party Favors, Summer Toy, Outdoors Activity, Gift for Boys and Girls(Blue)"
298,outdoor_toys,https://i5.walmartimages.com/seo/Kinetic-Sand-The-Original-Moldable-Sensory-Play-Sand-Toys-For-Kids-Purple-2-lb-Resealable-Bag-Ages-3_a29a45d1-04b6-4f10-9c9f-d95d3900415d.7b366057ed5f9561c3bcead51ab70a64.jpeg?odnHeight=180&odnWidth=180&odnBg=fffff,"Kinetic Sand, The Original Moldable Sensory Play Sand Toys For Kids, Purple, 2 lb. Resealable Bag, Ages 3+"
299,outdoor_toys,https://i5.walmartimages.com/asr/345e264b-6749-4fa0-82fd-58349b4d6f59.e2a5ba069e7dca7e61dd6659b6ff7d17.jpeg?odnHeight=180&odnWidth=180&odnBg=ffffff,John Deere Bubble-N-Go Toy Lawn Mower Automatic Bubble Machine No Batteries Required Age 3+ Years
300,outdoor_toys,https://i5.walmartimages.com/asr/8e8f3e14-b4d5-4e51-986d-5fcec488ab50.579204e9f9536305411a34e7b086efd5.jpeg?odnHeight=180&odnWidth=180&odnBg=ffffff,"Qhomic 146''x 132'' x 82'' Inflatable Bounce Houses for Kids 3-12 with Blower Double Slide Climbing Wall and Ball Pit/Large Pool Outdoor/Indoor Bouncy House, PVC, Child, Teen, Toddler, Tween, Adult"
301,outdoor_toys,https://i5.walmartimages.com/asr/832fbebe-c569-4583-8e14-29c54dcb2b3c.47363e585ee1a9e685dfc366232b1de3.jpeg?odnHeight=180&odnWidth=180&odnBg=ffffff,Toy Childrens Toys outside Throw and Catch Ball Outdoor for Parent-child
302,outdoor_toys,https://i5.walmartimages.com/seo/Syncfun-Bubble-Lawn-Mower-Machine-Summer-Outdoor-Games-Toys-Kids-Toddler-3-6-Years-Old-Maker-Push-Toy-Boys-Girls-Birthday-Gifts-Pink_d193111c-9c24-4eff-98bf-1016cf59be21.b6a962b5b4d00e5f29b5c97bc54ae66e.jpeg?odnHeight=180&odnWidth=180&odnBg=fffff,"Syncfun Bubble Lawn Mower, Bubble Machine Summer Outdoor Games Toys for Kids Toddler 3-6 Years Old, Bubble Maker Push Toy Boys Girls Birthday Gifts - Pink"
303,outdoor_toys,https://i5.walmartimages.com/seo/Step2-Sweetheart-Pink-Toddler-Playhouse-Plastic-Kids-Outdoor-Toy_2359b3a6-181f-461e-b34f-f0370277f4b8_1.fdd0c3bafa6c3a38f4ded2e8bd2a0a4f.jpeg?odnHeight=180&odnWidth=180&odnBg=fffff,Step2 Sweetheart Pink Toddler Playhouse Plastic Kids Outdoor Toy
304,outdoor_toys,https://i5.walmartimages.com/asr/8c8aba7f-5d28-4548-8488-c540a28c3b94.51d5efe9d480d9c011a19c3770659be7.jpeg?odnHeight=180&odnWidth=180&odnBg=ffffff,"Hot Bee Bubble Machine -132/73/36 Holes Bubble Blower, Bubble Maker Toy for Kids Age 5 6 7 8 9 10 11 , Summer Toy Gift for Outdoor Indoor Birthday Wedding Party"
305,outdoor_toys,https://i5.walmartimages.com/seo/KORIMEFA-8-1-Kids-Slide-Set-Climber-Toddler-Climber-Play-Basketball-Hoop-Tunnel-Playground-Outdoor-Indoor-Layground-Playset-Age-1_66cd5b20-ae9e-469f-9c22-28417a5f45d0.efe26cd6e8d819062f9a983c31a4fab2.jpeg?odnHeight=180&odnWidth=180&odnBg=fffff,"KORIMEFA 8 in 1 Kids Slide Set with Climber, Toddler Climber Slide Play Set with Basketball Hoop, Tunnel, Toddler Playground Outdoor Indoor Layground Slide Playset Age 1+"
306,outdoor_toys,https://i5.walmartimages.com/asr/610ccbdc-93fe-4f1c-8240-bb0022686822.1a431e4a70b0de85733ba32b3a5e4ca1.jpeg?odnHeight=180&odnWidth=180&odnBg=ffffff,"Play Day Bump N Go Bubble Blowing Dino-Lights, Sounds & Movement, Children Ages 3+"
307,outdoor_toys,https://i5.walmartimages.com/seo/Step2-Rain-Showers-Splash-Pond-Blue-Plastic-Water-Table-for-Toddlers_f96aa38d-9f03-4ff3-a87c-87149b78516e.f45485257727d16339b189e44f94e2c5.jpeg?odnHeight=180&odnWidth=180&odnBg=fffff,Step2 Rain Showers Splash Pond Blue Plastic Water Table for Toddlers
308,outdoor_toys,https://i5.walmartimages.com/asr/87fbe533-804d-498b-add3-7780fc3fc147.3f2ef34ec6f249a8b8fb33cb1ef07d97.jpeg?odnHeight=180&odnWidth=180&odnBg=ffffff,"Nerf Fortnite HR Rotating Bolt Action Kids Toy Blaster fr Boys and Girls with 6 Darts, Only At Walmart"
309,outdoor_toys,https://i5.walmartimages.com/asr/6ebe9c38-1446-4921-9561-e60db4493d02.d3d92c5c8c5cd98ee36cc8b7c0899a67.png?odnHeight=180&odnWidth=180&odnBg=ffffff,X-Shot Water Fast-Fill Epic Orange Water Blaster by ZURU
310,outdoor_toys,https://i5.walmartimages.com/seo/JOYIN-2-Bubble-Guns-Bottles-Refill-Solution-10-oz-Total-Kids-Blower-Blaster-Party-Favors-Summer-Toy-Outdoors-Activity-Easter-Birthday-Gift_8bf25cbe-d8fd-46a9-9e0f-512b73dfa369.c78f6091fe95fd4465bc46b4c6391309.jpeg?odnHeight=180&odnWidth=180&odnBg=fffff,"JOYIN 2 Bubble Guns with 2 Bottles Bubble Refill Solution (10 oz Total) for Kids, Bubble Blower for Bubble Blaster Party Favors, Summer Toy, Outdoors Activity, Easter, Birthday Gift"
311,outdoor_toys,https://i5.walmartimages.com/asr/a05e15d8-fa09-4baf-92d3-1cedc2ee9ff1.c01522eedc672c645cfb37d5b8f9684c.jpeg?odnHeight=180&odnWidth=180&odnBg=ffffff,X-Shot Insanity Berzerko (48 Darts) by ZURU Plastic Dart Blaster for Ages 8 & up
312,outdoor_toys,https://i5.walmartimages.com/asr/e78fee7d-3210-4aac-921c-cb92059b6ee2.8a489453fef195900e0d5c0d5a0f3470.jpeg?odnHeight=180&odnWidth=180&odnBg=ffffff,X-Shot Insanity Motorized Rage Fire (72 Darts) by ZURU Plastic Dart Blaster for Ages 8 & up
313,outdoor_toys,https://i5.walmartimages.com/asr/5796dd45-98f2-413a-9465-21f39f443957.40063658fc83c4072500f49d36a90b3f.jpeg?odnHeight=180&odnWidth=180&odnBg=ffffff,"Bubble Machine Automatic Bubble Blower for Kids & Toddlers, Bubble Maker Plug-in or Batteries Bubble Toys for Outdoor Birthday Party"
314,outdoor_toys,https://i5.walmartimages.com/asr/73c56186-98a5-48fd-aa37-e4e55bae7a47.b76bf74529e5d729e2095fe3651c5357.png?odnHeight=180&odnWidth=180&odnBg=ffffff,"Nerf Elite Junior Flyer Foam Kids Toy Blaster with 5 Darts, Only At Walmart"
315,outdoor_toys,https://i5.walmartimages.com/seo/JOYIN-2-Bottles-Bubbles-Refill-Solutions-64-oz-up-5-Gallon-Big-Bubble-Solution-OZ-Concentrated-Machine-Gun-Wand-Fluid-Summer-Easter-Toys-Green_e275c0f3-2cb5-4bf7-a35a-e3d2096879f7.67ca89af481c057ae573d60b7a37b8e4.jpeg?odnHeight=180&odnWidth=180&odnBg=fffff,"JOYIN 2 Bottles Bubbles Refill Solutions 64 oz (up to 5 Gallon) Big Bubble Solution 64 OZ Concentrated Bubble Solution for Bubble Machine, Gun, Wand Refill Fluid Summer, Easter Toys (Green)"
316,outdoor_toys,https://i5.walmartimages.com/seo/Adventure-Force-Clash-Force-Combo-Ages-8-Years-and-up_1b69b5f0-7ecc-4b41-a95e-b069889a3b86.4cdff8281e16959e0e1ed7deac8a4cda.jpeg?odnHeight=180&odnWidth=180&odnBg=fffff,"Adventure Force Clash Force Combo, Ages 8 Years and up"
317,outdoor_toys,https://i5.walmartimages.com/seo/Dart-Board-Games-Kids-Ideal-Indoor-Party-28-3Inches-Safe-16-Sticky-Balls-Best-Sport-Toys-Gifts-3-4-5-6-7-8-9-Years-Old-Boys-Girls_16402ec6-fdf2-4a8b-822d-d6942d637960.09a6fe4ebd5121de955d2e252d0a3225.jpeg?odnHeight=180&odnWidth=180&odnBg=fffff,"Dart Board Games for Kids,Ideal Indoor and Party Games 28.3Inches Safe Dart Board with 16 Sticky Balls, Best Sport Toys Gifts for 3 4 5 6 7 8 9+ Years Old Boys and Girls"
318,outdoor_toys,https://i5.walmartimages.com/asr/40fb0fc3-d11e-4ace-9d4a-a91f0febd045.74af945127b9bd87e8d13fc7c4bb84ea.jpeg?odnHeight=180&odnWidth=180&odnBg=ffffff,JBee Ctrl Bubble Machine for Toddlers Bubble Gun 132 & 73 Holes Electric Bubble Maker Toys for Boys Girls 3-6-12 Years Bubble Blower with Colorful Lights for Indoor Outdoor Wedding Birthday Party Toys
319,outdoor_toys,https://i5.walmartimages.com/asr/1eb5e486-5053-40ae-9dd2-98e7a8ca29dd.f069e299138ae2b3ecb0e3927aef82e3.jpeg?odnHeight=180&odnWidth=180&odnBg=ffffff,Bluey! Bubble Wand. Includes 4 Fluid Ounces of Premium Bubble Solution. Ages 3 and Up.
320,outdoor_toys,https://i5.walmartimages.com/asr/ca8842a5-480a-480a-b0c2-31397e83d87d.bd200abb9533c77abbefe1c3ceec0830.jpeg?odnHeight=180&odnWidth=180&odnBg=ffffff,"Bubble Machine,20000+ Bubbles Per Minute Bubble Machine for Kids and Toddlers,550ML Large Capacity Bubble Blower,Bubble Maker Machine for Parties Wedding Birthday-Indoor & Outdoor"
321,outdoor_toys,https://i5.walmartimages.com/asr/98690e87-6129-466c-b0c1-7d4eff4cf00c.87dab5666decdc6e78a8e082163cc05e.jpeg?odnHeight=180&odnWidth=180&odnBg=ffffff,Nerf Elite 2.0 Double Punch Motorized Kids Toy Blaster for Boys and Girls with 50 Darts
322,outdoor_toys,https://i5.walmartimages.com/asr/419ddd79-62d4-4c20-bc05-7b45062fe8eb.31bc32d34341c06b6487ed91a7575ccf.jpeg?odnHeight=180&odnWidth=180&odnBg=ffffff,"Qhomic Inflatable Bounce House for Toddlers with Blower, Children's Castle with Bouncing Slides, Climbing Wall, Bouncing Area, Basketball Hoop, Water Gun, Inflatable Water Slide with Football Area"
323,outdoor_toys,https://i5.walmartimages.com/asr/fc9162e0-2f65-42e4-b69d-02ab793a82db.2aedaa8279d481c89fd7994854b19249.jpeg?odnHeight=180&odnWidth=180&odnBg=ffffff,"Bluescape Dino Inflatable Play Center, Kiddie Pool with Sprinkler, Toys & Slide, Age 2 & up, Unisex"
324,outdoor_toys,https://i5.walmartimages.com/asr/fd8c0572-8d9b-4830-9ce6-35e301f27cf8.dfa6fc233ff46ca84e3c390b9c62cfa1.jpeg?odnHeight=180&odnWidth=180&odnBg=ffffff,"SwimSchool Adjustable Child Arm Pool Inflatable Floaties, Size Medium/Large, Unisex, Multi-Color (40-80 lbs.)"
325,outdoor_toys,https://i5.walmartimages.com/seo/National-Geographic-Play-Sand-6-lbs-of-Sand-with-Castle-Molds-Purple-A-Fun-Sensory-Sand-Activity_5ec11dcb-a683-453a-a0a1-e939f9c25981_2.00c0c528f5b0a5bd225a5ac5c850ec7f.jpeg?odnHeight=180&odnWidth=180&odnBg=fffff,National Geographic Play Sand - 6 lbs of Sand with Castle Molds (Purple) - A Fun Sensory Sand Activity
326,outdoor_toys,https://i5.walmartimages.com/seo/VANLOFE-Bubble-Makers-Electric-Bubble-Wands-Machine-Bubble-Maker-Automatic-Blower-Outdoor-Toy-for-Kids_ae2024b0-0f2d-46a9-a758-ff3a956f05d9_1.3f98ad20efafde06b86b83de686df037.jpeg?odnHeight=180&odnWidth=180&odnBg=fffff,VANLOFE Bubble Makers Electric Bubble Wands Machine Bubble Maker Automatic Blower Outdoor Toy for Kids
327,outdoor_toys,https://i5.walmartimages.com/asr/10a1b816-d5aa-46cb-baac-af5a65369f0a.fc0193fbd55b7a18171ceb23b905a28b.jpeg?odnHeight=180&odnWidth=180&odnBg=ffffff,Gymax Inflatable Bounce House Kids Jumping Playhouse Indoor & Outdoor (Blower Not Included)
328,outdoor_toys,https://i5.walmartimages.com/seo/Hot-Bee-Hover-Soccer-Hockey-Ball-Set-2-in-1-LED-Rechargeable-Soccer-with-2-Goals-Indoor-Outdoor-Games-Toys-for-Kids-Boys-Girls-Ages-3_b12c617d-02a1-4049-bb1e-695dac53e58d.46df1f692958e855b164b49261db0026.jpeg?odnHeight=180&odnWidth=180&odnBg=fffff,"Hot Bee Hover Soccer Hockey Ball Set, 2 in 1 LED Rechargeable Soccer with 2 Goals Indoor/Outdoor Games Toys for Kids Boys Girls Ages 3+"
329,outdoor_toys,https://i5.walmartimages.com/seo/Little-Tikes-TotSports-Kids-T-Ball-Set-with-Bat-and-2-Balls-Ages-18-Months-to-4-Years_01f044eb-f831-4bdc-835f-7b29a7db6915_1.5393aba204d3f410e5c398df1174378c.jpeg?odnHeight=180&odnWidth=180&odnBg=fffff,"Little Tikes TotSports Kids T-Ball Set with Bat and 2 Balls, Ages 18 Months to 4 Years"
330,outdoor_toys,https://i5.walmartimages.com/asr/2f1e1bf0-c679-479c-9ca5-6a7684eddfd2.076fa56ef30c88e5d66faffc8c32329d.jpeg?odnHeight=180&odnWidth=180&odnBg=ffffff,All-Pro Passer Robotic Quarterback
331,outdoor_toys,https://i5.walmartimages.com/asr/9782613a-1ea0-4dd6-9fa5-e3be80071a53_1.601e4b529ada62266020a7b2d3ed8b89.jpeg?odnHeight=180&odnWidth=180&odnBg=ffffff,"Bounce Pro 7-Foot My First Trampoline Hexagon (Ages 3-10) for Kids, Blue/Green"
332,outdoor_toys,https://i5.walmartimages.com/asr/8a8d46ab-398e-4812-bc1e-d11685f13c0b_1.564eda35a7ec46cd6d4572bdece0f09e.jpeg?odnHeight=180&odnWidth=180&odnBg=ffffff,"Little Tikes Hide & Seek Climber, Indoor Outdoor Slide and Climbing Playset for Kids Ages 2-5"
333,outdoor_toys,https://i5.walmartimages.com/asr/7e9e272f-293a-4451-962f-223233be8394.a8e51f381a2d8e6e030c7afedefaed7b.jpeg?odnHeight=180&odnWidth=180&odnBg=ffffff,"HopeRock Hover Soccer Hockey Ball, 2-in-1 Hover Hockey Soccer Ball Toy Set, Indoor Outdoor Sports Game Toy Gifts for 3 -12 Years Boy Girl"
334,outdoor_toys,https://i5.walmartimages.com/asr/de1bfc75-743c-4373-9079-a56544138ff5.3244d3065f59d29bd13a3f11de3f1857.jpeg?odnHeight=180&odnWidth=180&odnBg=ffffff,Step2 Naturally Playful Red Plastic Sandbox and Toddler Outdoor Toy
335,outdoor_toys,https://i5.walmartimages.com/asr/9095e62d-d216-469e-b5d5-4cf33fa84340.e29c0853aab7500ff2de8b686571a337.png?odnHeight=180&odnWidth=180&odnBg=ffffff,"Ozark Trail Summer Oasis 4-Person Inflatable Island 10' x 6' x 23"", Adult, Unisex"
