,category,image_url,title
499,outdoor_toys,https://i5.walmartimages.com/asr/8c26ff09-2e9d-4766-a223-07f3eb362038.2f7e91b86ee988750bc3ff95ef863690.jpeg?odnHeight=180&odnWidth=180&odnBg=ffffff,"Kid Odyssey Bubble Machine for Kids, Automatic Electric Bubble Wand Maker Blower for Girls Princess , Musical & Light Up Bubble Toys for Toddlers Girls"
500,outdoor_toys,https://i5.walmartimages.com/asr/30749fe9-cecd-44d6-a249-417eb265ee2a.b39c35e2f03e9ad2d32b73cc7e4de450.jpeg?odnHeight=180&odnWidth=180&odnBg=ffffff,NETNEW Upgraded Bubble Gun Bubble Makers Toys for Boys Girls 3-6 Years with LED Lights and solution supply bag (feeding solution automatically) Bubble Blower
501,outdoor_toys,https://i5.walmartimages.com/asr/45cc08b7-dc76-4228-9e55-660a44540129.c13f37524d210b7c8129dee7741133c9.jpeg?odnHeight=180&odnWidth=180&odnBg=ffffff,Costway Children Kids Junior Folding Climber Play Slide Indoor Outdoor Toy Easy Store
502,outdoor_toys,https://i5.walmartimages.com/asr/908aaa4b-66e0-459c-8594-1f882ee61ed6.8b0d22b5d57369c6e36d4dd07f521dd2.jpeg?odnHeight=180&odnWidth=180&odnBg=ffffff,"Nerf Elite 2.0 Kids Toy Blaster Refill Pack with 70 Darts, Only At Walmart"
503,outdoor_toys,https://i5.walmartimages.com/asr/50582c6e-bc36-4d0c-ac8a-539ef02a4ee0_1.c6378072ae1cfd86c339c1954d590e73.jpeg?odnHeight=180&odnWidth=180&odnBg=ffffff,"8-Foot Round 3D Transparent Quick Set Above Ground Pool with 2 Pairs of 3D Goggles, Ages 6 and Up, Unisex"
504,outdoor_toys,https://i5.walmartimages.com/asr/9b474a93-40c2-4456-99aa-6ae6ed45e897.d8c22c28d84af9aeae7b5f0dfe65ed52.jpeg?odnHeight=180&odnWidth=180&odnBg=ffffff,Kinetic Sand Hidden Treasure
505,outdoor_toys,https://i5.walmartimages.com/seo/4-in-1-Sand-Water-Table-Sandbox-Table-Beach-Toy-Kids-Activity-Sensory-Play-Toy-Outdoor-Backyard-Toddlers-Age-3-6_a60f5405-8bfe-4ff4-b32f-7bed04130e43.c659ac365734512cd21b6ff6a5bab82e.jpeg?odnHeight=180&odnWidth=180&odnBg=fffff,"4-in-1 Sand Water Table, Sandbox Table with Beach Sand Water Toy, Kids Table Activity Sensory Play Table Sand Water Toy for Outdoor Backyard for Toddlers Age 3-6"
506,outdoor_toys,https://i5.walmartimages.com/asr/06c54c35-3a7f-4b5e-92ac-55539b8035b4.b27493802c192bcdb12dfbab68006a7c.jpeg?odnHeight=180&odnWidth=180&odnBg=ffffff,Maxx Bubbles Bubble-N-Go Kids Toy Mower with Refill Solution Pink
507,outdoor_toys,https://i5.walmartimages.com/seo/Spiderman-Inflatable-Pool-Toys-Swin-Set-for-Ages-3_b5f7db0d-1bdc-4ff9-8e02-c8551b7f9785.fab1e43111e2217b6a67a1ffeb055b55.jpeg?odnHeight=180&odnWidth=180&odnBg=fffff,"Spiderman Inflatable Pool Toys Swin Set, for Ages 3+"
508,outdoor_toys,https://i5.walmartimages.com/asr/fd1bcdf2-8e44-443e-a140-24e8deb048c2.03a313be5386ae7d45b7b2328cd9a457.jpeg?odnHeight=180&odnWidth=180&odnBg=ffffff,ToyVelt Bubble Lawn Mower for Kids - Automatic Bubble Machine with Music Sounds Best Toys for Toddlers Plus 4 x Bottles of Solution & 4 x Sticks - for Boys & Girls Ages 2-12 Years Old
509,outdoor_toys,https://i5.walmartimages.com/asr/dc0e7604-d550-4261-9f47-26b8fd4402ac.5255f8abd2a9744baa95175282f4b032.jpeg?odnHeight=180&odnWidth=180&odnBg=ffffff,"Fun Little Toys 10 Pcs Giant Catchable Bubble Wands Set with Bubble Solution, Big Bubble Maker with Tray, Fun Outdoor Playtime Activity Summer Toy Set, Birthday Party Favors for Kids and Adults"
510,outdoor_toys,https://i5.walmartimages.com/asr/208ec746-434f-4192-ad36-86f9f7ede96b.d14e04f224c8a6239737aae9028f6b3f.jpeg?odnHeight=180&odnWidth=180&odnBg=ffffff,"Disney Mickey Mouse Plastic Indoor,Outdoor Playhouse with Easy Assembly"
511,outdoor_toys,https://i5.walmartimages.com/asr/7e63f6f9-d5c9-4884-91ec-c253f2a95547.fad4b91830bb6fa3ef57351017b5db50.jpeg?odnHeight=180&odnWidth=180&odnBg=ffffff,"Ixir Sprinkler for Kids, Splash Pad, and Wading Pool for Learning  Childrens Sprinkler Pool, 68 Inflatable Water Toys  from A to Z Outdoor Swimming Pool for Babies and Toddlers"
512,outdoor_toys,https://i5.walmartimages.com/seo/Step2-Neat-Tidy-Cottage-II-Brown-Playhouse-Plastic-Kids-Outdoor-Toy_50101a55-c1ea-41f7-812e-297dbb282d69.9b085155c03fe6cae7e9613966543332.jpeg?odnHeight=180&odnWidth=180&odnBg=fffff,Step2 Neat & Tidy Cottage II Brown Playhouse Plastic Kids Outdoor Toy
513,outdoor_toys,https://i5.walmartimages.com/seo/Step2-Charming-Cottage-Brown-Toddler-Plastic-Playhouse-for-Kids-Outdoor-Toys_607a7f20-2391-4943-aa30-6e0683cdf9e6.e9b196b2c6c040aa4c40f5450459e3be.jpeg?odnHeight=180&odnWidth=180&odnBg=fffff,Step2 Charming Cottage Brown Toddler Plastic Playhouse for Kids Outdoor Toys
514,outdoor_toys,https://i5.walmartimages.com/asr/9bbeefa4-4f10-40ae-a90d-85654c6cd9e2_1.1f9cec370f5278ca03342fbda1f2e2c2.jpeg?odnHeight=180&odnWidth=180&odnBg=ffffff,Little Tikes Gas N Go Mower Toddler Push Toy - For Kids Boys Girls Ages 1.5 Years and Older
515,outdoor_toys,https://i5.walmartimages.com/seo/32-Holes-Bubble-Machine-Children-s-Automatic-Bubble-Gun-Gatling-Electric-Soap-Bubble-Toys_9f72a694-c42b-43b3-97ca-167b8c23569e.5c3459c9a917683cfdbed17b1473cc9e.jpeg?odnHeight=180&odnWidth=180&odnBg=fffff,"32 Holes Bubble Machine Children's Automatic Bubble Gun, Gatling Electric Soap Bubble Toys"
516,outdoor_toys,https://i5.walmartimages.com/seo/Ktaxon-Kids-Inflatable-Bouncer-House-Jumper-Castle-with-350W-Air-Blower-for-2-to-8-Years-Old-Childrens_4f089920-3416-444c-83f7-dc993471b346_1.2a1413d112edef21c2a1f34a0bb86327.jpeg?odnHeight=180&odnWidth=180&odnBg=fffff,Ktaxon Kids Inflatable Bouncer House Jumper Castle with 350W Air Blower for 2 to 8 Years Old Childrens
517,outdoor_toys,https://i5.walmartimages.com/asr/5351c5df-27a2-425d-a53c-94d3dc7e6c5a.ce4053e9ee564b0ac938e99d4dad1ea1.jpeg?odnHeight=180&odnWidth=180&odnBg=ffffff,"JOYIN 72PCS Mini Bubble Wands Bulk, Summer Toy, Party Favor, Birthdays, Photo Prop Decorations, Gift, Circle & Heart Shapes for Kids"
518,outdoor_toys,https://i5.walmartimages.com/asr/9447b173-7232-4838-98ab-cefdd0a6669f.7e45afa73c1379efcf76b6e167cf9126.jpeg?odnHeight=180&odnWidth=180&odnBg=ffffff,Kid Odyssey Water Table for Toddlers 1 to 3 Year Old Outdoor Boys Girls Sand Water Beach Toys - Small
519,outdoor_toys,https://i5.walmartimages.com/asr/2030b6fb-1cfd-4ca6-bf68-6a676107224c.9f939993679f3fd21ce350f12e382242.jpeg?odnHeight=180&odnWidth=180&odnBg=ffffff,Play Day Kids Sand & Water Wheel Tower with Shovel & Rake  Beach Sand Water Toy
520,outdoor_toys,https://i5.walmartimages.com/asr/8b3504d5-de71-4e5e-bfc3-c622b6a86b10.40a951166426da54722360ae47a0eeca.jpeg?odnHeight=180&odnWidth=180&odnBg=ffffff,"Kid Odyssey Hover Soccer Ball Boy Toys Rechargeable, Kids Indoor Air Soccer Ball Floating LED Light Up, Power Kick Disc Fun with Foam Bumper (No AA Battery Needed) Gift For Boys Girls Age 3 4 5 6 7 8"
521,outdoor_toys,https://i5.walmartimages.com/asr/7515c807-c4c7-43cb-a287-638e36299eec.da62c8dd63be3362d1b4b0a7b7d5ebe4.jpeg?odnHeight=180&odnWidth=180&odnBg=ffffff,X-Shot Skins Lock Blaster (16 Darts) by ZURU for Ages 8 & Up
522,outdoor_toys,https://i5.walmartimages.com/seo/Step2-Wonderball-Toddler-Fun-House-Playhouse-Kids-Outdoor-Toys_9096fcf9-8a05-45a4-a7e7-79a130c72aa4.78f0306a461e3c1359d574f4e746f9c8.jpeg?odnHeight=180&odnWidth=180&odnBg=fffff,Step2 Wonderball Toddler Fun House Playhouse Kids Outdoor Toys
523,outdoor_toys,https://i5.walmartimages.com/seo/Little-Tikes-TotSports-Kids-T-Ball-Set-with-Bat-and-2-Balls-Ages-18-Months-to-4-Years_01f044eb-f831-4bdc-835f-7b29a7db6915_1.5393aba204d3f410e5c398df1174378c.jpeg?odnHeight=180&odnWidth=180&odnBg=fffff,"Little Tikes TotSports Kids T-Ball Set with Bat and 2 Balls, Ages 18 Months to 4 Years"
524,outdoor_toys,https://i5.walmartimages.com/asr/e6ade09c-5938-483b-abb2-a459734a3962.82af2851a34304b1a16a0481acd7f31e.png?odnHeight=180&odnWidth=180&odnBg=ffffff,"Play Day Sand and Water Table Play Set, Activity Table for Children, Ages 3+"
525,outdoor_toys,https://i5.walmartimages.com/asr/8e23d523-e8e9-4901-818b-16fa5983ec13.97b13c2d6ac7acd9c9f6221d60d7e673.jpeg?odnHeight=180&odnWidth=180&odnBg=ffffff,Ozark Trail Lake Float Lounger No Inflate Memory Foam Blue White and Teal Adult Unisex
526,outdoor_toys,https://i5.walmartimages.com/asr/84e2b377-f8a0-4327-9389-87c8848cf082.7887aa7a7281bc4aa88df416f3b7f981.jpeg?odnHeight=180&odnWidth=180&odnBg=ffffff,PLAY DAY BASKETBALL BALL PIT
527,outdoor_toys,https://i5.walmartimages.com/asr/4625071b-fa33-4305-883a-5f1d756a73c6.1b7bff2b3b191f5d405a2dd6ddd8330b.jpeg?odnHeight=180&odnWidth=180&odnBg=ffffff,"JA-RU Wooden Paddle Ball Set (Pack of 3+Sticker) Multicolor Vintage Retro Kid Toys, Party games, Indoor, Outdoor Set Games for Kids & Adults| W-751-3p"
528,outdoor_toys,https://i5.walmartimages.com/asr/883bbd37-4330-42c3-8150-b5a3565d9740.6fb976a1ea2c311aa2a87881b2c2d8cf.jpeg?odnHeight=180&odnWidth=180&odnBg=ffffff,Lifetime Kid's Outdoor Climb & Slide Swing Set with Trapeze Bar (91142)
529,outdoor_toys,https://i5.walmartimages.com/seo/WisToyz-Bubble-Machine-Walk-Stand-Dinosaur-Maker-Music-Lights-Automatic-Indoor-Outdoor-Blower-Kids-Toddlers-3-AA-Batteries-Needed_4a0334e6-6177-47ee-8dc7-72e78389d6e4.6f5f7ea96c4f328fee68c6a91d1cb362.jpeg?odnHeight=180&odnWidth=180&odnBg=fffff,"WisToyz Bubble Machine, Walk & Stand Dinosaur Bubble Maker with Music and Lights, Automatic Indoor Outdoor Bubble Blower for Kids Toddlers 3 AA Batteries Needed"
530,outdoor_toys,https://i5.walmartimages.com/asr/4016724a-2d22-4c77-b979-fa0d586989e9.a7bf9d7babbf8ada92615e0f5226a033.jpeg?odnHeight=180&odnWidth=180&odnBg=ffffff,"ArtCreativity Bubble Blowing Toy Train with Lights and Sounds, Battery Operated with Bubble Solution"
531,outdoor_toys,https://i5.walmartimages.com/asr/94a3c50d-fcd1-4027-9f3f-952b6bf1fad0.9265aa670b24c5fbfaec1d09945cc227.jpeg?odnHeight=180&odnWidth=180&odnBg=ffffff,Little Tikes Tree House Plastic Swing Set for 3 - 8 Year Old's
532,outdoor_toys,https://i5.walmartimages.com/seo/Syncfun-Bubble-Lawn-Mower-Machine-Summer-Outdoor-Games-Toys-Kids-Toddler-3-6-Years-Old-Maker-Push-Toy-Boys-Girls-Birthday-Gifts-Pink_d193111c-9c24-4eff-98bf-1016cf59be21.b6a962b5b4d00e5f29b5c97bc54ae66e.jpeg?odnHeight=180&odnWidth=180&odnBg=fffff,"Syncfun Bubble Lawn Mower, Bubble Machine Summer Outdoor Games Toys for Kids Toddler 3-6 Years Old, Bubble Maker Push Toy Boys Girls Birthday Gifts - Pink"
533,outdoor_toys,https://i5.walmartimages.com/seo/Step2-Sweetheart-Pink-Toddler-Playhouse-Plastic-Kids-Outdoor-Toy_2359b3a6-181f-461e-b34f-f0370277f4b8_1.fdd0c3bafa6c3a38f4ded2e8bd2a0a4f.jpeg?odnHeight=180&odnWidth=180&odnBg=fffff,Step2 Sweetheart Pink Toddler Playhouse Plastic Kids Outdoor Toy
534,outdoor_toys,https://i5.walmartimages.com/seo/3-Tier-Water-Table-Toys-for-Toddlers-Sand-and-Water-Table-Toy-Summer-Play-Toys-for-Toddlers-Age-3-12_08543737-9b54-47ac-a540-acec8be6e366.00192ef8e843935b607b5a9a6f80dc0d.jpeg?odnHeight=180&odnWidth=180&odnBg=fffff,3-Tier Water Table Toys for Toddlers Sand and Water Table Toy Summer Play Toys for Toddlers Age 3-12
535,outdoor_toys,https://i5.walmartimages.com/seo/Wupuaait-JYS20318-Goal-LBFB01-Super-Cool-Hover-Soccer-Ball-Set-Indoor-Outdoor-Sport_ce1fcb6a-c6ca-4f91-b1b4-c2b361565ee9.6c86c79d58ff14c9612396707d528f65.png?odnHeight=180&odnWidth=180&odnBg=fffff,Wupuaait JYS20318-Goal-LBFB01 Super Cool Hover Soccer Ball Set Indoor Outdoor Sport
536,outdoor_toys,https://i5.walmartimages.com/asr/d4bd94b0-344e-47d3-acc7-3628f4c1237e.730852f9fca4245535f86f7dfa5e8741.jpeg?odnHeight=180&odnWidth=180&odnBg=ffffff,"Banzai Pipeline Water Park Toy, Length: 14 ft 7 in, Width: 9 ft 6 in, Height: 7 ft 11 in, Inflatable Outdoor Backyard Water Slide Splash Toy"
537,outdoor_toys,https://i5.walmartimages.com/asr/c41e05c4-bea2-4c6e-8c8a-289bb624b285.4204ff8f31fd368b426fcfdc74502735.jpeg?odnHeight=180&odnWidth=180&odnBg=ffffff,Step2 Crabbie Sandbox Red Plastic Outdoor Sandbox with Cover for Kids
538,outdoor_toys,https://i5.walmartimages.com/asr/6e1d79b0-403e-4ff6-8723-fcc66220694c.f2a58a14c87155163ecf6d5aae52bbf9.jpeg?odnHeight=180&odnWidth=180&odnBg=ffffff,Adventure Force Tactical Strike Deuce Pro Manual Dart Gun Blaster Outdoor Toy with 24 Foam Pro Darts
539,outdoor_toys,https://i5.walmartimages.com/asr/fdbf0c49-8d5d-4bc6-b22b-5956ec9a20e9.2c351e1fd3131ba2c6adae654f567a9e.jpeg?odnHeight=180&odnWidth=180&odnBg=ffffff,"iTOYiFUN Bubble Machine with Remote Control, 2 Speed Levels, 18000+ Bubbles/Minute, Portable Automatic Bubble Maker Blower with Refill Solution for Kids, Outdoor/Indoor Toys"
540,outdoor_toys,https://i5.walmartimages.com/asr/5925923f-a0f6-437f-8bfe-3a861421c535.d02b1526226edf5d5595aa1c0cd0884a.jpeg?odnHeight=180&odnWidth=180&odnBg=ffffff,"MAXX BUBBLES BUBBLE WAND - 4 OZ SINGLES, BLUE, RED, ORANGE, PINK, GREEN & YELLOW"
541,outdoor_toys,https://i5.walmartimages.com/asr/80aac9ef-4f94-4aa6-af84-12ceae1e199c.f48a2a4a318c311eb287a157e19f3984.jpeg?odnHeight=180&odnWidth=180&odnBg=ffffff,"Play Day 3 Ring Unicorn Pool, Pink"
542,outdoor_toys,https://i5.walmartimages.com/asr/871fa903-c017-44fd-aeb7-e672a43cce27.6a2c9023051c0d0ed8a3e92f22c5d948.png?odnHeight=180&odnWidth=180&odnBg=ffffff,"Play Day 12CT Sidewalk Chalk, 12 Pieces"
543,outdoor_toys,https://i5.walmartimages.com/asr/7a07580d-896d-490d-a468-3aedb9515ef7.e22a186e56ca9c8189d5cfaf49b1df1b.jpeg?odnHeight=180&odnWidth=180&odnBg=ffffff,"Bubble Machine for Kids, 2 Speeds & 10000+ Bubbles per Minute, Bubble Blower for Toddlers with 3 Wands, Professional Automatic Bubble Machine for Parties"
544,outdoor_toys,https://i5.walmartimages.com/asr/32167974-0e83-46d5-8460-241e4de4b9f7.b098e6f4b3bd9b91f3018716cb744fad.jpeg?odnHeight=180&odnWidth=180&odnBg=ffffff,"Bubble Gun with 2 Pack Bubble Liquid, Bubble Machine for Toddlers with 360-Degree Leak-Proof Design, Ergonomic Grip, Automatic Bubble Guns for Kids, Party Favors, Birthday Gift"
545,outdoor_toys,https://i5.walmartimages.com/asr/c222362b-da83-472d-a871-a5e87c94b757.f5eac28b8caf4e58bf3bc6606e373ca5.jpeg?odnHeight=180&odnWidth=180&odnBg=ffffff,"Little Tikes Jumbo Inflatable Baseball and Football Trainer, 2 in 1 Sports Toy for Children"
546,outdoor_toys,https://i5.walmartimages.com/asr/4a4a215d-797f-464c-956f-8193a8802a63.5ac03d298b4f615e32147d2ff3437673.jpeg?odnHeight=180&odnWidth=180&odnBg=ffffff,"Nerf Super Soaker Minecraft Axolotl Kids Toy Water Blaster, Only At Walmart"
547,outdoor_toys,https://i5.walmartimages.com/asr/da86370f-47e3-42b5-a360-c694df073840.c6f416e6cfe0bc363593324b4574684a.jpeg?odnHeight=180&odnWidth=180&odnBg=ffffff,"LotFancy Potato Sack Race Bags for Outdoor Lawn Games, Outside Yard Games"
548,outdoor_toys,https://i5.walmartimages.com/asr/44f6f525-e8d8-489b-860c-45d02a4620d1.bac0f4e5c28c6400d40bfa64492dc784.jpeg?odnHeight=180&odnWidth=180&odnBg=ffffff,"Luniquz Bubble Machine for Kids,Automatic Bubble Blower Rechargeable, 90/360 Auto Rotatable Portable Bubble Maker Electric Bubbles Toy , Outdoor Wedding Party Gifts"
549,outdoor_toys,https://i5.walmartimages.com/asr/b9437c0f-2ef3-4d8c-98c5-76925819fc4f.e71b824ee77c5fdd43473eb117596ca7.jpeg?odnHeight=180&odnWidth=180&odnBg=ffffff,"Bluescape Deluxe Lounge, Inflatable Pool Float, Silver, Age 14 & up, Unisex"
550,outdoor_toys,https://i5.walmartimages.com/asr/8c8bd61a-2edd-4e09-866b-36db53a18f07.18d68ddf2d0a9b3b771f0bfa185afe7a.jpeg?odnHeight=180&odnWidth=180&odnBg=ffffff,"Play Day Toss & Catch Game, Red & Blue - 2 Discs & 1 Ball, Children Ages 3+"
551,outdoor_toys,https://i5.walmartimages.com/asr/712e8fdf-33aa-47ec-87a1-a444f2e85713.1cf0a08fb9655dcf9ed553d238e927c1.jpeg?odnHeight=180&odnWidth=180&odnBg=ffffff,Coleman Power Steel 26 x 12 x 52 Oval Metal Frame Above Ground Pool Set
552,outdoor_toys,https://i5.walmartimages.com/seo/GHB-PROTON-BLASTER_bee09f26-3796-440f-b1d1-f60d49fd58b4.9642d2e6fec6033c6aa37f4d8727074c.jpeg?odnHeight=180&odnWidth=180&odnBg=fffff,GHB PROTON BLASTER
553,outdoor_toys,https://i5.walmartimages.com/asr/5a332336-0c77-43e4-b67b-3a1116eda456.595cec54539f7b3829374d8f23829c20.jpeg?odnHeight=180&odnWidth=180&odnBg=ffffff,"Play Day Fish & Catch 12-Piece Pool & Bath Toy Game, Ages 3+, Unisex"
554,outdoor_toys,https://i5.walmartimages.com/asr/de5b61c8-afff-4d62-bc72-5fc290fb7051.114119dd6e3c45440b4bf1b15f658dfb.jpeg?odnHeight=180&odnWidth=180&odnBg=ffffff,"CoComelon Tunnel Play Tent, Polyester Material Allows for Indoor & Outdoor Use, Children Ages 3+"
555,outdoor_toys,https://i5.walmartimages.com/asr/d31ddb95-656e-4e9d-b5ad-de1fec55ac69.57a2daec2ed8f0ffb20f01e0a31ae813.jpeg?odnHeight=180&odnWidth=180&odnBg=ffffff,"Aqua G'Ripped Football Pool Toy for Children, Black & Blue, For the Backyard, Pool, or Beach"
556,outdoor_toys,https://i5.walmartimages.com/asr/24d2d9cb-5735-4426-8e3a-fc73df75ff49_1.947fe121a125bd4ce51cd223e114e96e.jpeg?odnHeight=180&odnWidth=180&odnBg=ffffff,"Little Tikes Fish 'n Splash Water Table with Tipping Fishbowl and 8 Piece Fishing Accessory Set, Outdoor Toy Play Set for Toddlers Kids Boys Girls Ages 2 3 4+ Year Old"
557,outdoor_toys,https://i5.walmartimages.com/asr/820f3454-cb88-4e2d-ab3a-b41a50e1829e.08115331074370bdc71498f4323d2745.jpeg?odnHeight=180&odnWidth=180&odnBg=ffffff,Princess Castle Kids Play Tent Toys for 3 6 8 12 Years Indoor Girls Hexagon Playhouse with Star Lights
558,outdoor_toys,https://i5.walmartimages.com/asr/93549368-9c51-4bb4-9847-e29f7a5a91ed.b1892c83cebcc5e3551cbe4a01d6b014.jpeg?odnHeight=180&odnWidth=180&odnBg=ffffff,"Play Day Rope Swing, Outdoor Adjustable Nylon Rope, Swing Set Accessory, Ages 3+"
559,outdoor_toys,https://i5.walmartimages.com/asr/5befd8a7-0cdf-4ad1-a8dd-e6515ee51bb1.6fbb9dc5f1cbf04f1e03d5763d0117f4.jpeg?odnHeight=180&odnWidth=180&odnBg=ffffff,"Pinkfong Baby Shark Inflatable Baby Boat, Pool Float Seat, Summer Water Play, Kids Ages 2+"
560,outdoor_toys,https://i5.walmartimages.com/asr/d0f28d60-a8b9-43c5-a2d3-f79e6c988e21.eb890f88a33654997bca2b8934ba6d6e.jpeg?odnHeight=180&odnWidth=180&odnBg=ffffff,"Sloosh 43"" Inflatable Automatic Bubble Machine, Bubble Blower Maker with Bubble Solution for Boy Girl Toddlers Kids, Indoor Outdoor Seasonal Merriment Toy, Easter Birthday Party Gift"
561,outdoor_toys,https://i5.walmartimages.com/asr/dde6e415-a31e-41ca-a14c-aed448c37ac4.ba5d265fc59fd7cf72abd375615b6a96.jpeg?odnHeight=180&odnWidth=180&odnBg=ffffff,Step2 Play up Gym Toddler Swingset and Outdoor Playground
562,outdoor_toys,https://i5.walmartimages.com/asr/04c784fb-cfac-420c-9ccd-7a10060a6adf_2.6fde19ffc94aad817b648984de203b34.jpeg?odnHeight=180&odnWidth=180&odnBg=ffffff,"Little Tikes 2-in-1 Snug and Secure Swing, High Back Swing, Blue"
563,outdoor_toys,https://i5.walmartimages.com/seo/GIKPAL-6-in-1-Toddler-Slide-and-Swing-Set-Climber-Slide-Playset-with-Basketball-Hoop-Long-Slide-and-Ball-Pool-for-Kids-Indoor-Outdoor_7e4465a3-0ccb-4306-ad56-d1ce516a9f02.421cc72e8e59b664f52d6b5ab6c2f702.jpeg?odnHeight=180&odnWidth=180&odnBg=fffff,"GIKPAL 6 in 1 Toddler Slide and Swing Set, Climber Slide Playset with Basketball Hoop Long Slide and Ball Pool for Kids Indoor Outdoor"
564,outdoor_toys,https://i5.walmartimages.com/seo/Gazillion-Bubbles-Tornado_f5ee5406-2778-4b96-852a-03867361d2c3.83a1be19b0ba7b66214a7355a9102ba7.jpeg?odnHeight=180&odnWidth=180&odnBg=fffff,Gazillion Bubbles Tornado
565,outdoor_toys,https://i5.walmartimages.com/seo/Syncfun-Bubble-Lawn-Mower-Machine-Summer-Outdoor-Games-Toys-Kids-Toddler-3-6-Years-Old-Maker-Push-Toy-Boys-Girls-Birthday-Gifts-Pink_d193111c-9c24-4eff-98bf-1016cf59be21.b6a962b5b4d00e5f29b5c97bc54ae66e.jpeg?odnHeight=180&odnWidth=180&odnBg=fffff,"Syncfun Bubble Lawn Mower, Bubble Machine Summer Outdoor Games Toys for Kids Toddler 3-6 Years Old, Bubble Maker Push Toy Boys Girls Birthday Gifts - Pink"
566,outdoor_toys,https://i5.walmartimages.com/asr/3a438da6-c139-4e1e-8bec-a06cb24026b8.94aee71b93ca7fdd5bf7d0668bbe1cc5.jpeg?odnHeight=180&odnWidth=180&odnBg=ffffff,"Marvel Spider-Man 4-in-1 Sports Center by Delta Children  Adjustable Easy Score Basketball Hoop, Soccer/Hockey Net and Golf Game, Red/Blue"
567,outdoor_toys,https://i5.walmartimages.com/asr/8e8b58ac-cf49-4711-a1ab-c49e6cf4baa7.b00bf90bb829bdbf54efb3c40befeac3.jpeg?odnHeight=180&odnWidth=180&odnBg=ffffff,"Banzai Jr. Backyard Inflatable Water-Sprinkling Splash Discovery Activity Center, Baby Pool, Age 9-24 Months"
568,outdoor_toys,https://i5.walmartimages.com/seo/XJD-Princess-Castle-Play-Kids-Tent-Girls-Toddlers-Portable-Pop-Up-Teepee-Indoor-Outdoor-Playhouse-Gift-Toys-Birthday-Gifts-Pink_fb09c73b-bd70-4195-afd4-3aad4dc37c35.876c12d170750584b003478d50ab79fd.jpeg?odnHeight=180&odnWidth=180&odnBg=fffff,"XJD Princess Castle Play Kids Tent for Girls Toddlers Portable Pop Up Play Teepee Indoor and Outdoor Playhouse Gift for Kids Girls Toys Birthday Gifts, Pink"
569,outdoor_toys,https://i5.walmartimages.com/asr/8a98daee-eb7b-4ac0-86e2-0a25f789664c.dfa4835ed96efb7b8a9ac0009a77d58c.jpeg?odnHeight=180&odnWidth=180&odnBg=ffffff,Rainbocorns Series 2 Purple Llamacorn The Ultimate Surprise Egg by ZURU
570,outdoor_toys,https://i5.walmartimages.com/asr/0076624d-5f09-474f-86b3-abd460cdbce5.d017de6b58d0130ee8dba5c20a5c5872.jpeg?odnHeight=180&odnWidth=180&odnBg=ffffff,Little Tikes Jr. Activity Gym for Toddlers
571,outdoor_toys,https://i5.walmartimages.com/asr/5fe9fc72-287d-4818-8ec5-e485451d2fa7.1fd14fa51aee8c821ab57153e2bf21a8.jpeg?odnHeight=180&odnWidth=180&odnBg=ffffff,Nerf Minecraft Ender Dragon Blaster and 12 Nerf Elite Foam Darts
572,outdoor_toys,https://i5.walmartimages.com/asr/4907207e-4263-47da-8401-cfa939bd61e8.568b175193ddaca4e370e88f54cacfff.jpeg?odnHeight=180&odnWidth=180&odnBg=ffffff,Nerf Fortnite 6-SH Rotating Drum Kids Toy Blaster for Boys and Girls with 6 Darts
573,outdoor_toys,https://i5.walmartimages.com/asr/5e48b7ea-4fd2-44db-a7b1-e6cbaf1fc9f9_1.2e6db429cf866cb81fe0576ee0c975f8.jpeg?odnHeight=180&odnWidth=180&odnBg=ffffff,Costway Inflatable Bounce House Water Slide Jump Bouncer Climbing Wall Splash Pool Blower Excluded
574,outdoor_toys,https://i5.walmartimages.com/seo/Hot-Bee-Hover-Soccer-Hockey-Ball-Set-2-in-1-LED-Rechargeable-Soccer-with-2-Goals-Indoor-Outdoor-Games-Toys-for-Kids-Boys-Girls-Ages-3_b12c617d-02a1-4049-bb1e-695dac53e58d.46df1f692958e855b164b49261db0026.jpeg?odnHeight=180&odnWidth=180&odnBg=fffff,"Hot Bee Hover Soccer Hockey Ball Set, 2 in 1 LED Rechargeable Soccer with 2 Goals Indoor/Outdoor Games Toys for Kids Boys Girls Ages 3+"
575,outdoor_toys,https://i5.walmartimages.com/seo/Best-Choice-Products-Kids-3-in-1-Outdoor-Convertible-Wood-Activity-Sand-Water-Picnic-Table-w-Umbrella-Green_6ae6ad47-f57f-409c-af45-6bdd6a857f8e.6d7c9964e91f8aa3ea69bf097f566352.jpeg?odnHeight=180&odnWidth=180&odnBg=fffff,Best Choice Products Kids 3-in-1 Outdoor Convertible Wood Activity Sand & Water Picnic Table w/ Umbrella - Green
576,outdoor_toys,https://i5.walmartimages.com/asr/0b76e06d-c39c-4d69-a888-55ca2b4529cf.f6b95b7f3c4078e0d62469977784b10e.jpeg?odnHeight=180&odnWidth=180&odnBg=ffffff,"Adventure Force Stranger Things Lucas Slingshot Blaster, Ages 14 Years & up"
577,outdoor_toys,https://i5.walmartimages.com/asr/caf648de-af1d-4186-9c05-191322d34e97.c8fedb2bf5f73db428e8b7d39b529e92.jpeg?odnHeight=180&odnWidth=180&odnBg=ffffff,ArtCreativity Leaf Blower Bubble Blowing Toy for Boys and Girls with Bubble Solution Included
578,outdoor_toys,https://i5.walmartimages.com/asr/3a87fd33-7122-4da4-980a-2038fe0bba5e.2df5d3ab5d198d7da3dc4c11df888805.jpeg?odnHeight=180&odnWidth=180&odnBg=ffffff,Lifetime Kid's Double Adventure Tower Swing Set with Bridge and Monkey Bars (90966)
579,outdoor_toys,https://i5.walmartimages.com/asr/360da06c-1693-4d88-b3b0-4401d99b4a8e.1706fbceffd70b6c8f25345ad1568ba3.jpeg?odnHeight=180&odnWidth=180&odnBg=ffffff,Gazillion Bubbles Premium 1 Liter Bubbles Solution Bottle Refill for Blower Toy Kids with Wand Bubbles Outdoor
580,outdoor_toys,https://i5.walmartimages.com/asr/00c9eeaf-1eb6-4b3a-900f-b2c95fe59215.5f014693b8c4f2aac97ede2a2ca7046e.jpeg?odnHeight=180&odnWidth=180&odnBg=ffffff,"TOY Life Dinosaur Shooting Games, Dinosaur Toys for Kids 3 4 5 6 7 8 12+ Boy Gifts Birthday Dinosaur Party Games, Shooting Toy Guns for Boys with 2 Dinosaur Pop Guns, 36 Foam Balls, Indoor Outdoor Toy"
581,outdoor_toys,https://i5.walmartimages.com/seo/Outdoor-Water-Sprinkler-Kids-Toddlers-Summer-Backyard-Spray-Toys-8-Wiggle-Tubes-Attaches-Garden-Hose-Boys-Girls-Ages-2-8-Purple_ba6e905a-2061-48d3-8dc8-b7bb1fb0ec87.884df8bf7ea81713982f9a23f1338dd4.jpeg?odnHeight=180&odnWidth=180&odnBg=fffff,"Outdoor Water Sprinkler for Kids and Toddlers, Summer Backyard Spray Toys with 8 Wiggle Tubes, Attaches to Garden Hose Toys for Boys and Girls Ages 2-8, Purple"
582,outdoor_toys,https://i5.walmartimages.com/asr/4ecffac4-0132-4ad1-b9a6-c30cafa3b2f9.c5d42aef4070de04077295e3192b68bb.jpeg?odnHeight=180&odnWidth=180&odnBg=ffffff,3-Pack Pool Noodle Foam Swimming Party Insulation Therapy Craft Fishing Floating 47 Inches Long  Assorted Colors
583,outdoor_toys,https://i5.walmartimages.com/asr/f62a74bf-9822-4a11-ac7a-106eadc0581a.32fb4c6e24af14206bcf42eb30e38292.jpeg?odnHeight=180&odnWidth=180&odnBg=ffffff,Punching Bag Boxing Set for Kids Sport Game Toys for Boys 3-6-10 Years with Junior Gloves 43 Inch Adjustable Stand
584,outdoor_toys,https://i5.walmartimages.com/seo/Step2-Neat-Tidy-Cottage-II-Brown-Playhouse-Plastic-Kids-Outdoor-Toy_50101a55-c1ea-41f7-812e-297dbb282d69.9b085155c03fe6cae7e9613966543332.jpeg?odnHeight=180&odnWidth=180&odnBg=fffff,Step2 Neat & Tidy Cottage II Brown Playhouse Plastic Kids Outdoor Toy
585,outdoor_toys,https://i5.walmartimages.com/seo/Toddlers-Water-Table-Waterfall-Maze-like-Wall-Double-Sided-Sand-Kids-32-PCS-Outdoor-Toys-Age-3-8-Activity-Sensory-Summer-Boys-Girls-Ages-4-8_15dfd686-a1a5-4476-a94b-02133d55717e.62309ac8607698f9d2a8e03bcce2e723.jpeg?odnHeight=180&odnWidth=180&odnBg=fffff,"Toddlers Water Table Waterfall Maze-like Wall - Double-Sided Water Sand Table for Kids, 32 PCS Outdoor Toys for Toddlers Age 3-8, Activity Sensory Table Summer Toys for Boys Girls Ages 4-8"
586,outdoor_toys,https://i5.walmartimages.com/asr/0f86e316-b153-4331-a97c-c041964223d9.74ac9447f4296df801bc96406ab25a41.jpeg?odnHeight=180&odnWidth=180&odnBg=ffffff,Nerf Rival Forerunner XXIII-1200 Toy Blaster with 12 Ball Dart Accu Rounds for Ages 14 and Up
